研报名称,机构名称,发布时间,行业,研报地址
公用事业行业研究周报：中特估系列3：央企集团及旗下电力相关上市公司梳理,天风证券,2023-05-24,电力行业,https://data.eastmoney.com/report/zw_industry.jshtml?infocode=AP202305241587131046
公用事业行业周报：《电力需求侧管理办法》&《电力负荷管理办法》征求意见,东方证券,2023-05-23,电力行业,https://data.eastmoney.com/report/zw_industry.jshtml?infocode=AP202305231587110560
电力行业行业事项点评：《电力需求侧管理办法》及《电力负荷管理办法》（征求意见稿）点评,信达证券,2023-05-22,电力行业,https://data.eastmoney.com/report/zw_industry.jshtml?infocode=AP202305221587047919
电力2022年报及2023Q1季报综述：淬炼真金，前景可期,东亚前海证券,2023-05-19,电力行业,https://data.eastmoney.com/report/zw_industry.jshtml?infocode=AP202305191586968293
火电行业专题报告：煤价低位运行，火电行情正当时,西南证券,2023-05-18,电力行业,https://data.eastmoney.com/report/zw_industry.jshtml?infocode=AP202305181586743281
