研报名称,机构名称,发布时间,行业,研报地址
石油石化行业专题研究：涤纶长丝：国内复苏+海外去库，看好长丝产业回暖,天风证券,2023-07-07,石油行业,https://data.eastmoney.com/report/zw_industry.jshtml?infocode=AP202307071592089901
煤炭债季度复盘：二季度长期限发行明显增加，煤价下跌对估值影响有限,山西证券,2023-07-07,煤炭行业,https://data.eastmoney.com/report/zw_industry.jshtml?infocode=AP202307071592088438
汽车电子系列报告之一：智能化接棒电动化，长期增长空间开启,东方财富证券,2023-07-07,半导体,https://data.eastmoney.com/report/zw_industry.jshtml?infocode=AP202307071592088417
基于不同情景假设的分析：银行对城投敞口的规模与影响,国信证券,2023-07-07,银行,https://data.eastmoney.com/report/zw_industry.jshtml?infocode=AP202307071592080539
消费电子：大尺寸价格持续上涨，Q3面板厂利润修复,国金证券,2023-07-07,消费电子,https://data.eastmoney.com/report/zw_industry.jshtml?infocode=AP202307071592080538
电子行业研究：2023世界人工智能大会召开，持续看好AI产业链投资机会,国金证券,2023-07-07,半导体,https://data.eastmoney.com/report/zw_industry.jshtml?infocode=AP202307071592080537
非银行金融行业：税优健康险范围扩容，供给端丰富有望带动健康险需求提升,信达证券,2023-07-07,多元金融,https://data.eastmoney.com/report/zw_industry.jshtml?infocode=AP202307071592080448
人形机器人行业研究报告：AI赋能人形机器人，关注核心零部件发展机遇,西南证券,2023-07-07,通用设备,https://data.eastmoney.com/report/zw_industry.jshtml?infocode=AP202307071592080438
电力设备：成本下降收益提升，储能景气持续上行,上海证券,2023-07-07,电网设备,https://data.eastmoney.com/report/zw_industry.jshtml?infocode=AP202307071592080436
汽车行业基础研究系列五：变局之下的汽车产业：供需、库存、盈利复盘,国信证券,2023-07-07,汽车整车,https://data.eastmoney.com/report/zw_industry.jshtml?infocode=AP202307071592079592
欧洲新能源车销量点评：6月销量同环比双升,德邦证券,2023-07-07,电源设备,https://data.eastmoney.com/report/zw_industry.jshtml?infocode=AP202307071592079590
电力设备与新能源：储能行业跟踪：行业量增价稳，业内企业订单活跃,华西证券,2023-07-07,电源设备,https://data.eastmoney.com/report/zw_industry.jshtml?infocode=AP202307071592079566
汽车零部件Ⅱ行业深度分析：聚焦头部车企产业链和全球化布局，优选强α公司,安信证券,2023-07-07,汽车零部件,https://data.eastmoney.com/report/zw_industry.jshtml?infocode=AP202307071592079130
保险Ⅱ行业点评报告：《关于适用商业健康保险个人所得税优惠政策产品有关事项的通知》点评-扩产品，优条款，激发税优健康险供需积极性,东吴证券,2023-07-07,保险,https://data.eastmoney.com/report/zw_industry.jshtml?infocode=AP202307061592077781
2023年6月疫苗批签发：2023年生物制品批签发跟踪,中银证券,2023-07-06,生物制品,https://data.eastmoney.com/report/zw_industry.jshtml?infocode=AP202307061592077594
纺织服饰行业深度报告：毛纺行业集中度逐步提升，龙头盈利能力优势显著,首创证券,2023-07-06,纺织服装,https://data.eastmoney.com/report/zw_industry.jshtml?infocode=AP202307061592077479
家用电器行业简评：把握空调行业机遇，关注新品类及出口链变化,东海证券,2023-07-06,家电行业,https://data.eastmoney.com/report/zw_industry.jshtml?infocode=AP202307061592076783
2023年光伏中期策略报告：新技术加速渗透，光储平价新时代开启,东吴证券,2023-07-06,光伏设备,https://data.eastmoney.com/report/zw_industry.jshtml?infocode=AP202307061592076350
银行行业2023年中期投资策略报告：基本面触底，配置价值凸显,东兴证券,2023-07-06,银行,https://data.eastmoney.com/report/zw_industry.jshtml?infocode=AP202307061592076277
金属行业2023半年度展望：关注周期性、成长性及对冲性的配置价值,东兴证券,2023-07-06,有色金属,https://data.eastmoney.com/report/zw_industry.jshtml?infocode=AP202307061592076276
电力设备与新能源行业2023年中期展望报告：风光新机遇，锂电新格局,东兴证券,2023-07-06,电池,https://data.eastmoney.com/report/zw_industry.jshtml?infocode=AP202307061592076275
交通运输行业中期策略：左侧配置出行链与快递，高股息板块攻守兼备,东兴证券,2023-07-06,物流行业,https://data.eastmoney.com/report/zw_industry.jshtml?infocode=AP202307061592076274
2023年中国第三方支付行业词条报告,头豹研究院,2023-07-06,多元金融,https://data.eastmoney.com/report/zw_industry.jshtml?infocode=AP202307061592075784
2023年中国光伏玻璃企业对比分析（福莱特、金晶科技、彩虹新能源、亚玛顿）,头豹研究院,2023-07-06,玻璃玻纤,https://data.eastmoney.com/report/zw_industry.jshtml?infocode=AP202307061592075782
互联网慢性病管理 头豹词条报告系列,头豹研究院,2023-07-06,化学制药,https://data.eastmoney.com/report/zw_industry.jshtml?infocode=AP202307061592075783
金属行业7月暨中期投资策略：金属板块进入底部布局好时机,国信证券,2023-07-06,能源金属,https://data.eastmoney.com/report/zw_industry.jshtml?infocode=AP202307061592074866
煤炭行业：低估值煤炭板块，在“中特估”加持下，有望充分受益,东兴证券,2023-07-06,煤炭行业,https://data.eastmoney.com/report/zw_industry.jshtml?infocode=AP202307061592074868
建筑行业7月暨中期投资策略：下半年建筑板块的四个关键问题,国信证券,2023-07-06,装修装饰,https://data.eastmoney.com/report/zw_industry.jshtml?infocode=AP202307061592074863
建筑行业2023年中期投资策略：基建托底稳增长，关注中特估及“一带一路”,西南证券,2023-07-06,工程建设,https://data.eastmoney.com/report/zw_industry.jshtml?infocode=AP202307061592074845
证券行业2023年7月投资策略：复苏预期，风格调整,国信证券,2023-07-06,证券,https://data.eastmoney.com/report/zw_industry.jshtml?infocode=AP202307061592074844
农业2023年中期投资策略：长夜漫漫终见曙，穿越周期破迷雾,民生证券,2023-07-06,农牧饲渔,https://data.eastmoney.com/report/zw_industry.jshtml?infocode=AP202307061592072607
汽车行业2023年度中期策略报告：聚焦降本增效及科技创新,中国银河,2023-07-06,汽车整车,https://data.eastmoney.com/report/zw_industry.jshtml?infocode=AP202307061592071492
电子行业首席联盟培训：AI时代投资逻辑,天风证券,2023-07-06,电子元件,https://data.eastmoney.com/report/zw_industry.jshtml?infocode=AP202307061592069689
房地产行业2023年中期策略：行业格局重塑趋势明显，发展模式变革势在必行,东兴证券,2023-07-06,房地产开发,https://data.eastmoney.com/report/zw_industry.jshtml?infocode=AP202307061592069688
新能源周报（第45期）：复合铜箔等新技术持续突破关键点,太平洋,2023-07-06,光伏设备,https://data.eastmoney.com/report/zw_industry.jshtml?infocode=AP202307061592069687
美容护理行业简评报告：美妆：多肽龙头湃肽生物冲击IPO，盈利能力持续提升,首创证券,2023-07-06,美容护理,https://data.eastmoney.com/report/zw_industry.jshtml?infocode=AP202307061592067787
医药行业政策点评：国谈规则调整释放重要利好，持续看好创新药以价换量,西南证券,2023-07-06,化学制药,https://data.eastmoney.com/report/zw_industry.jshtml?infocode=AP202307061592065503
房地产行业周报（2023年第26周）：销售环比有所上涨，多地政策持续宽松,财通证券,2023-07-06,房地产开发,https://data.eastmoney.com/report/zw_industry.jshtml?infocode=AP202307061592065502
化工行业2023年中期投资策略：把握底部复苏，分化中寻求机遇,西南证券,2023-07-06,化学原料,https://data.eastmoney.com/report/zw_industry.jshtml?infocode=AP202307061592064863
传媒行业7月投资策略：把握调整后的买入机会，持续看好AIGC应用落地,国信证券,2023-07-06,文化传媒,https://data.eastmoney.com/report/zw_industry.jshtml?infocode=AP202307061592064861
电力行业5月月报：高温来袭负荷迎新高，火电支撑用电量快速增长,信达证券,2023-07-06,电力行业,https://data.eastmoney.com/report/zw_industry.jshtml?infocode=AP202307061592064015
农林牧渔行业点评报告：USDA下调美豆种植面积，厄尔尼诺气候预期持续强化,开源证券,2023-07-06,农牧饲渔,https://data.eastmoney.com/report/zw_industry.jshtml?infocode=AP202307061592063509
传媒互联网行业2023年中期策略：投资风格偏向科技成长，下半年关注游戏、ARVR、互联网三大主线,东兴证券,2023-07-06,文化传媒,https://data.eastmoney.com/report/zw_industry.jshtml?infocode=AP202307061592063506
有色金属：锗、镓产品出口管制长期有望利好相关产业链标的,德邦证券,2023-07-06,有色金属,https://data.eastmoney.com/report/zw_industry.jshtml?infocode=AP202307061592063505
2023年中国元宇宙营销市场研究报告,艾瑞股份,2023-07-06,互联网服务,https://data.eastmoney.com/report/zw_industry.jshtml?infocode=AP202307061592063494
2023年中期金属投资策略：低库存，供需矛盾一触即发,海通国际,2023-07-06,有色金属,https://data.eastmoney.com/report/zw_industry.jshtml?infocode=AP202307061592063486
电力设备新能源2023年中期投资策略：国内储能招标高景气持续，下半年风电光伏迎接放量,国信证券,2023-07-06,电源设备,https://data.eastmoney.com/report/zw_industry.jshtml?infocode=AP202307061592062129
非银金融行业日报：三大指数全天走低 券商年内债承金额超6万亿,大同证券,2023-07-06,多元金融,https://data.eastmoney.com/report/zw_industry.jshtml?infocode=AP202307061592062091
计算机行业：国内重点AI大会有哪些亮点,华西证券,2023-07-06,计算机设备,https://data.eastmoney.com/report/zw_industry.jshtml?infocode=AP202307061592061925
食品饮料行业2023年第24周周报：阿斯巴甜风波再起，天然甜味剂未来可期,信达证券,2023-07-06,食品饮料,https://data.eastmoney.com/report/zw_industry.jshtml?infocode=AP202307061592061428
2023年中期建筑建材行业报告：建筑建材行业：回归下的修复与成长,东兴证券,2023-07-06,装修建材,https://data.eastmoney.com/report/zw_industry.jshtml?infocode=AP202307061592061357
证券Ⅱ行业月度点评：基金投顾业务转常规在即，债券注册制深化改革落地,财信证券,2023-07-06,证券,https://data.eastmoney.com/report/zw_industry.jshtml?infocode=AP202307061592061356
银行金融科技专题：从AIGC看商业银行数字化转型,平安证券,2023-07-06,银行,https://data.eastmoney.com/report/zw_industry.jshtml?infocode=AP202307061592060395
运动控制行业研究：高端装备“大脑”，机器人孕育新空间,国金证券,2023-07-06,专用设备,https://data.eastmoney.com/report/zw_industry.jshtml?infocode=AP202307061592060393
酒店行业周度数据跟踪：入住率环比回落，锦江增资海外优化资本结构,财通证券,2023-07-06,旅游酒店,https://data.eastmoney.com/report/zw_industry.jshtml?infocode=AP202307061592060392
计算机行业点评报告：全国高温下，关注电力市场化改革投资机会,财通证券,2023-07-06,互联网服务,https://data.eastmoney.com/report/zw_industry.jshtml?infocode=AP202307061592060391
半导体设备市场点评报告：荷兰公布出口限制细则，设备国产替代有望加速,财通证券,2023-07-06,半导体,https://data.eastmoney.com/report/zw_industry.jshtml?infocode=AP202307061592060390
银行：6月社融前瞻：社融或再次同比少增,天风证券,2023-07-06,银行,https://data.eastmoney.com/report/zw_industry.jshtml?infocode=AP202307061592059877
2023年生物医药行业中报业绩前瞻：疫情影响褪去，院内诊疗刚需恢复强劲,国信证券,2023-07-06,医药商业,https://data.eastmoney.com/report/zw_industry.jshtml?infocode=AP202307061592059876
电子行业动态研究报告：Wolfspeed获十年长约，碳化硅赛道持续景气,华鑫证券,2023-07-06,电子元件,https://data.eastmoney.com/report/zw_industry.jshtml?infocode=AP202307061592059790
医药生物：最新医保谈判意见稿出台，有望驱动创新药板块持续向好,德邦证券,2023-07-06,医药商业,https://data.eastmoney.com/report/zw_industry.jshtml?infocode=AP202307061592059240
计算机行业事件点评：北京发布数据要素重磅政策，行业进入政策加速催化期,民生证券,2023-07-06,计算机设备,https://data.eastmoney.com/report/zw_industry.jshtml?infocode=AP202307061592058965
消费行业7月投资策略：6月指数止跌回升，需求增速有所放缓,海通国际,2023-07-06,食品饮料,https://data.eastmoney.com/report/zw_industry.jshtml?infocode=AP202307061592058472
期货行业动态跟踪（2023-06）：新品种上市稳步推进，行业客户权益持续增长,财通证券,2023-07-06,多元金融,https://data.eastmoney.com/report/zw_industry.jshtml?infocode=AP202307061592058449
房地产行业2023年中期投资策略：基本面弱复苏，关注政策再释放,西南证券,2023-07-06,房地产开发,https://data.eastmoney.com/report/zw_industry.jshtml?infocode=AP202307061592058412
计算机行业月报：美博弈持续深入，AI加速产业格局重塑,中原证券,2023-07-06,计算机设备,https://data.eastmoney.com/report/zw_industry.jshtml?infocode=AP202307061592057998
互联网传媒行业周数据：2023W26周数据跟踪,上海证券,2023-07-06,文化传媒,https://data.eastmoney.com/report/zw_industry.jshtml?infocode=AP202307061592057997
可选消费行业投资策略：海外去库周期或临近尾声，建议关注优质企业外销底部反转机会,开源证券,2023-07-06,家电行业,https://data.eastmoney.com/report/zw_industry.jshtml?infocode=AP202307061592057957
电子行业周报：荷兰宣布出口管制，浸润式光刻机限制范围符合预期,国信证券,2023-07-06,电子元件,https://data.eastmoney.com/report/zw_industry.jshtml?infocode=AP202307061592057956
家用电器行业六月行业动态报告：行业景气复苏，空调表现突出,中国银河,2023-07-06,家电行业,https://data.eastmoney.com/report/zw_industry.jshtml?infocode=AP202307061592057000
白酒行业23Q2业绩前瞻：估值底+预期底背景下，关注二季报有望超预期标的,浙商证券,2023-07-06,食品饮料,https://data.eastmoney.com/report/zw_industry.jshtml?infocode=AP202307061592056290
医药行业事件点评：医保续约新规征求意见，看好创新药预期反转,民生证券,2023-07-06,医疗服务,https://data.eastmoney.com/report/zw_industry.jshtml?infocode=AP202307061592052901
双碳环保日报：国家发改委关于加强非常规水资源配置利用的指导意见,东吴证券,2023-07-06,环保行业,https://data.eastmoney.com/report/zw_industry.jshtml?infocode=AP202307051592052824
存储器行业专题研究：双墙阻碍算力升级，探讨四大新型存储应用,民生证券,2023-07-06,消费电子,https://data.eastmoney.com/report/zw_industry.jshtml?infocode=AP202307051592052627
2023年中期投资策略：交运投资中最重要的事,国海证券,2023-07-05,航运港口,https://data.eastmoney.com/report/zw_industry.jshtml?infocode=AP202307051592052467
有色金属行业深度：云南电解铝：汛期复产开启，供给扰动仍存,德邦证券,2023-07-05,有色金属,https://data.eastmoney.com/report/zw_industry.jshtml?infocode=AP202307051592052348
传媒互联网行业6月报：关注世界人工智能大会；暑期档票房恢复有望超预期,德邦证券,2023-07-05,文化传媒,https://data.eastmoney.com/report/zw_industry.jshtml?infocode=AP202307051592052347
数据要素地方政策密集出台，加速行业发展,国联证券,2023-07-05,软件开发,https://data.eastmoney.com/report/zw_industry.jshtml?infocode=AP202307051592052199
通信行业点评：核心原材料镓、锗实施出口管制，国内光芯片厂商迎利好,民生证券,2023-07-05,通信设备,https://data.eastmoney.com/report/zw_industry.jshtml?infocode=AP202307051592051760
互联网行业2023年7月投资策略：国内外大模型及AI应用先后发布，5月社零持续复苏,国信证券,2023-07-05,互联网服务,https://data.eastmoney.com/report/zw_industry.jshtml?infocode=AP202307051592051334
