研报名称,机构名称,发布时间,行业,研报地址
大炼化周报：需求端支撑弱势，国内大炼化盈利缩窄,信达证券,2023-06-26,石油行业,https://data.eastmoney.com/report/zw_industry.jshtml?infocode=AP202306261591288870
医药生物行业周报：多因素加速探底，调整中积极布局优势方向,中泰证券,2023-06-26,医药商业,https://data.eastmoney.com/report/zw_industry.jshtml?infocode=AP202306261591288523
新型电力系统周报：三门核电签约全国最大核能供汽项目，运营商收益率有望提升,国海证券,2023-06-26,风电设备,https://data.eastmoney.com/report/zw_industry.jshtml?infocode=AP202306261591288294
建筑行业周报：加快发展战略性新兴产业，LPR再度下调促进内需恢复,安信证券,2023-06-26,装修建材,https://data.eastmoney.com/report/zw_industry.jshtml?infocode=AP202306261591288278
化工行业周报：国际油价偏弱下行，TDI价格小幅上涨,中银证券,2023-06-26,化纤行业,https://data.eastmoney.com/report/zw_industry.jshtml?infocode=AP202306261591288225
消费品零售&化妆品行业周报：“618”交易规模稳健但增速持续回落，端午假期促进消费潜力进一步释放,中国银河,2023-06-26,商业百货,https://data.eastmoney.com/report/zw_industry.jshtml?infocode=AP202306261591287815
建材行业策略周报：产业链需求改善有限，关注地产政策出台,财通证券,2023-06-26,玻璃玻纤,https://data.eastmoney.com/report/zw_industry.jshtml?infocode=AP202306261591287164
环保与公用事业周报：国家能源局发布1-5月份全国电力工业统计数据，电源工程投资完成额大幅提升,德邦证券,2023-06-26,公用事业,https://data.eastmoney.com/report/zw_industry.jshtml?infocode=AP202306261591287163
有色金属行业周报：购置税减免政策延续，需求边际向好,中泰证券,2023-06-26,有色金属,https://data.eastmoney.com/report/zw_industry.jshtml?infocode=AP202306261591287150
食品饮料行业深度报告：零食量贩专题研究-好风凭借力，轻舟万重山,中泰证券,2023-06-26,食品饮料,https://data.eastmoney.com/report/zw_industry.jshtml?infocode=AP202306261591287147
食品饮料周思考（第25周）：五月社零数据环比增长，把握底部配置机会,中泰证券,2023-06-26,食品饮料,https://data.eastmoney.com/report/zw_industry.jshtml?infocode=AP202306261591287145
5月电力数据跟踪：居民生活用电同比增速环比上涨，水电出力环比好转，光伏装机表现亮眼,华福证券,2023-06-26,公用事业,https://data.eastmoney.com/report/zw_industry.jshtml?infocode=AP202306261591287143
通信行业周报：1-5月电信业务收入7125亿元，同比增长6.8%，推荐关注交换机行业投资机会,国元证券,2023-06-26,通信设备,https://data.eastmoney.com/report/zw_industry.jshtml?infocode=AP202306261591287139
环保行业跟踪周报：新能源购置税减免延期环卫电动化持续受益，继续推荐优质环保资产,东吴证券,2023-06-26,环保行业,https://data.eastmoney.com/report/zw_industry.jshtml?infocode=AP202306261591286689
建筑材料行业周观点：LPR调降助力政策边际向好，静待基本面拐点向上,德邦证券,2023-06-26,水泥建材,https://data.eastmoney.com/report/zw_industry.jshtml?infocode=AP202306261591286378
国防军工行业周报：空军某团飞行二大队荣获“时代楷模”称号,德邦证券,2023-06-26,航天航空,https://data.eastmoney.com/report/zw_industry.jshtml?infocode=AP202306261591286377
建筑装饰：日本建筑企业缘何上涨,财通证券,2023-06-26,工程建设,https://data.eastmoney.com/report/zw_industry.jshtml?infocode=AP202306261591286282
食品饮料行业周报：端午反馈平稳，关注Q2可能超预期个股,德邦证券,2023-06-26,食品饮料,https://data.eastmoney.com/report/zw_industry.jshtml?infocode=AP202306261591286249
电力设备行业研究周报：构建高质量充电基础设施体系 利好大功率快充,申港证券,2023-06-26,电源设备,https://data.eastmoney.com/report/zw_industry.jshtml?infocode=AP202306261591286242
医药行业周报：减肥药物扩容行业，重视多肽产业链机会,德邦证券,2023-06-26,医药商业,https://data.eastmoney.com/report/zw_industry.jshtml?infocode=AP202306261591286241
汽车行业研究周报：政策加持下板块回暖有望延续,申港证券,2023-06-26,汽车零部件,https://data.eastmoney.com/report/zw_industry.jshtml?infocode=AP202306261591286240
电力设备新能源行业周报（第25周）：新能车购置税减免细则出台，光伏上游价格底部区间已现,浙商证券,2023-06-26,电源设备,https://data.eastmoney.com/report/zw_industry.jshtml?infocode=AP202306261591286239
化工行业周报：全球最大高性能膜材生产基地投产，多个项目在首届尼龙大会签约,德邦证券,2023-06-26,橡胶制品,https://data.eastmoney.com/report/zw_industry.jshtml?infocode=AP202306261591286238
医药生物投融资周报：智翔金泰上市，礼来收购DICE,浙商证券,2023-06-26,化学制药,https://data.eastmoney.com/report/zw_industry.jshtml?infocode=AP202306261591286236
家用电器23W25周观点：618专题六：从618数据看家电板块的增长趋势、量价趋势、平台趋势,德邦证券,2023-06-26,家电行业,https://data.eastmoney.com/report/zw_industry.jshtml?infocode=AP202306261591286235
房地产行业研究：LPR下调10BP，商票逾期数量环比上升,国金证券,2023-06-26,房地产开发,https://data.eastmoney.com/report/zw_industry.jshtml?infocode=AP202306261591286226
电气设备行业周报：机器人“政策利好+龙头催化”，国内核心零部件环节机遇频频,德邦证券,2023-06-26,电源设备,https://data.eastmoney.com/report/zw_industry.jshtml?infocode=AP202306261591286194
银行行业研究周报：LPR降息点评,申港证券,2023-06-26,银行,https://data.eastmoney.com/report/zw_industry.jshtml?infocode=AP202306261591286183
计算机行业研究周报：具身智能，人工智能的下一个方向,申港证券,2023-06-26,计算机设备,https://data.eastmoney.com/report/zw_industry.jshtml?infocode=AP202306261591286182
环保行业研究周报：再提扩容重启 关注碳价值提升,申港证券,2023-06-26,环保行业,https://data.eastmoney.com/report/zw_industry.jshtml?infocode=AP202306261591286181
房地产行业研究周报：LPR利率下调 房贷利率进入历史低位,申港证券,2023-06-26,房地产开发,https://data.eastmoney.com/report/zw_industry.jshtml?infocode=AP202306261591286180
钢铁行业周报：钢材库存继续下行，下周钢价仍有支撑,华福证券,2023-06-26,钢铁行业,https://data.eastmoney.com/report/zw_industry.jshtml?infocode=AP202306261591286176
电力设备及新能源行业周报：新能源购置税延期超预期，持续看好人形机器人对工控催化,华福证券,2023-06-26,电源设备,https://data.eastmoney.com/report/zw_industry.jshtml?infocode=AP202306261591286174
化工行业：先进材料，强链升级提升产业附加值,华福证券,2023-06-26,化学制品,https://data.eastmoney.com/report/zw_industry.jshtml?infocode=AP202306261591286172
医药生物行业周报： 集采催化化学发光价值重塑，国产替代正当时,华福证券,2023-06-26,化学制药,https://data.eastmoney.com/report/zw_industry.jshtml?infocode=AP202306261591286173
医药行业周报：医药下半年展望：关注院内复苏，聚焦创新和中医药机遇,民生证券,2023-06-26,医药商业,https://data.eastmoney.com/report/zw_industry.jshtml?infocode=AP202306261591286111
建筑行业周报：我国成立绿色建筑全国重点实验室,中银证券,2023-06-26,工程建设,https://data.eastmoney.com/report/zw_industry.jshtml?infocode=AP202306261591286110
传媒行业周报：震荡中坚定AI应用主线，关注电影暑期档,开源证券,2023-06-26,文化传媒,https://data.eastmoney.com/report/zw_industry.jshtml?infocode=AP202306261591286084
食品饮料行业研究：端午食饮需求如何？,国金证券,2023-06-26,食品饮料,https://data.eastmoney.com/report/zw_industry.jshtml?infocode=AP202306261591286073
电力设备与新能源行业研究：光伏Q3淡季不淡，氢能开启预期兑现，海风招标全面重启,国金证券,2023-06-26,电源设备,https://data.eastmoney.com/report/zw_industry.jshtml?infocode=AP202306261591286072
交通运输仓储行业研究：5月快递业务量同比增长18.9%，端午假期旅客量同比增长89.1%,国金证券,2023-06-26,物流行业,https://data.eastmoney.com/report/zw_industry.jshtml?infocode=AP202306261591286069
公用事业及环保产业行业研究：5月分产业用电分化，各类电源投资增速扩大,国金证券,2023-06-26,公用事业,https://data.eastmoney.com/report/zw_industry.jshtml?infocode=AP202306261591286071
传媒互联网产业行业研究：游戏版号发放，腾讯大模型及visionOS SDK发布,国金证券,2023-06-26,文化传媒,https://data.eastmoney.com/report/zw_industry.jshtml?infocode=AP202306261591286070
有色金属行业周报：新能源汽车利好政策频出，美联储鹰派信号施压金属价格,安信证券,2023-06-26,有色金属,https://data.eastmoney.com/report/zw_industry.jshtml?infocode=AP202306261591286066
农林牧渔行业周报：存栏积压致生猪出栏均重偏大，7-8月或现“价涨重降”局面,开源证券,2023-06-26,农牧饲渔,https://data.eastmoney.com/report/zw_industry.jshtml?infocode=AP202306261591286064
商贸零售行业周报：润本股份过会，国货婴童护理品牌前景可期,开源证券,2023-06-26,商业百货,https://data.eastmoney.com/report/zw_industry.jshtml?infocode=AP202306261591286063
建筑材料行业周报：LPR下调&政策仍可期，关注建材底部配置机会,开源证券,2023-06-26,水泥建材,https://data.eastmoney.com/report/zw_industry.jshtml?infocode=AP202306261591286062
房地产行业周报：单周销售市场低位徘徊，央行下调LPR,开源证券,2023-06-26,房地产开发,https://data.eastmoney.com/report/zw_industry.jshtml?infocode=AP202306261591286061
社会服务行业周报：端午出行“量优于价”，文旅融合项目获热捧,开源证券,2023-06-26,旅游酒店,https://data.eastmoney.com/report/zw_industry.jshtml?infocode=AP202306261591286060
非银金融行业周报：关注非银左侧机会，寿险全年景气度确定性较强,开源证券,2023-06-26,保险,https://data.eastmoney.com/report/zw_industry.jshtml?infocode=AP202306261591286059
食品饮料行业周报：底部成为共识，等待催化修复,开源证券,2023-06-26,食品饮料,https://data.eastmoney.com/report/zw_industry.jshtml?infocode=AP202306261591286058
基础化工行业研究周报：巴斯夫湛江一体化基地聚乙烯装置开建，正丁醇、辛醇价格上涨,天风证券,2023-06-26,化学制品,https://data.eastmoney.com/report/zw_industry.jshtml?infocode=AP202306261591286053
基础化工行业周报：“恢复和扩大消费”调研协商座谈会20日在京召开,东莞证券,2023-06-26,化学制品,https://data.eastmoney.com/report/zw_industry.jshtml?infocode=AP202306261591286047
建筑装饰行业研究周报：央企并购重组迎新机遇，重视新疆区域煤化工投资,天风证券,2023-06-26,工程建设,https://data.eastmoney.com/report/zw_industry.jshtml?infocode=AP202306261591286046
商贸零售23Q2业绩前瞻：医美及黄金珠宝龙头加速增长，美妆龙头稳健成长,民生证券,2023-06-26,商业百货,https://data.eastmoney.com/report/zw_industry.jshtml?infocode=AP202306261591286015
食饮行业周报（2023年6月第4期）：端午白酒回款优秀，大众品618榜单公布,浙商证券,2023-06-26,食品饮料,https://data.eastmoney.com/report/zw_industry.jshtml?infocode=AP202306261591285609
国防装备行业周报（2023年6月第4周）：密切关注俄罗斯局势变化；国防“内需+外贸”双驱动,浙商证券,2023-06-26,航天航空,https://data.eastmoney.com/report/zw_industry.jshtml?infocode=AP202306261591285608
证券行业2023年中期投资策略：业绩回升确定性强，继续看好估值修复,中原证券,2023-06-26,证券,https://data.eastmoney.com/report/zw_industry.jshtml?infocode=AP202306261591285604
汽车行业周报：多重催化利好，底部向上明确,太平洋,2023-06-26,汽车零部件,https://data.eastmoney.com/report/zw_industry.jshtml?infocode=AP202306261591285603
社会服务行业投资策略周报：旅游出行消费市场螺旋式修复，总体景气度延续,财通证券,2023-06-26,旅游酒店,https://data.eastmoney.com/report/zw_industry.jshtml?infocode=AP202306261591285602
金融&金融科技行业周报：6月LPR如期下调，债券注册制稳步落地,平安证券,2023-06-26,多元金融,https://data.eastmoney.com/report/zw_industry.jshtml?infocode=AP202306261591285601
原油周报：美联储加息预期增强，国际油价先涨后跌,东吴证券,2023-06-26,石油行业,https://data.eastmoney.com/report/zw_industry.jshtml?infocode=AP202306261591285599
中药行业事件点评：中成药全国集采拟中选公布，长期利好头部中药企业发展,德邦证券,2023-06-26,中药,https://data.eastmoney.com/report/zw_industry.jshtml?infocode=AP202306261591285598
有色金属行业周报：国家政策预期向好，大宗商品反弹可期，继续看多铝、金、锡锑及锂,华福证券,2023-06-26,有色金属,https://data.eastmoney.com/report/zw_industry.jshtml?infocode=AP202306261591285597
玻璃玻纤行业研究周报：光伏玻璃周内无新增供给，浮法需求季节性转弱,天风证券,2023-06-26,玻璃玻纤,https://data.eastmoney.com/report/zw_industry.jshtml?infocode=AP202306261591285588
水泥行业研究周报：节前出货环比下滑，价格稳中有降,天风证券,2023-06-26,水泥建材,https://data.eastmoney.com/report/zw_industry.jshtml?infocode=AP202306261591285587
建筑材料行业研究周报：经济政策力度预期震荡反复，新材料或加快转化节奏,天风证券,2023-06-26,水泥建材,https://data.eastmoney.com/report/zw_industry.jshtml?infocode=AP202306261591285586
建筑材料行业研究周报：玻纤周跟踪：产品价格继续低位徘徊,天风证券,2023-06-26,水泥建材,https://data.eastmoney.com/report/zw_industry.jshtml?infocode=AP202306261591285585
农林牧渔2023年第25周周报：猪价未起，产能加速去化逻辑加强！推荐生猪板块！,天风证券,2023-06-26,农牧饲渔,https://data.eastmoney.com/report/zw_industry.jshtml?infocode=AP202306261591285584
计算机周观点：关注垂类大模型的投资机遇,开源证券,2023-06-26,计算机设备,https://data.eastmoney.com/report/zw_industry.jshtml?infocode=AP202306261591285583
农业重点数据跟踪周报：消费支撑不足，养殖信心低迷，产能去化或持续,财通证券,2023-06-26,农牧饲渔,https://data.eastmoney.com/report/zw_industry.jshtml?infocode=AP202306261591285558
医药行业周报：持续关注医药底部个股,西南证券,2023-06-26,化学制药,https://data.eastmoney.com/report/zw_industry.jshtml?infocode=AP202306261591285551
有色与新材料周报：面板产业供需回暖，OLED有机材料国产化推进,平安证券,2023-06-26,有色金属,https://data.eastmoney.com/report/zw_industry.jshtml?infocode=AP202306261591285550
电力设备及新能源行业：新能源车购置税补贴延期力度超预期，结构优化下利好行业,华福证券,2023-06-26,电源设备,https://data.eastmoney.com/report/zw_industry.jshtml?infocode=AP202306261591285549
地产行业周报：央行调降LPR，临沂发布房地产新政,平安证券,2023-06-26,房地产开发,https://data.eastmoney.com/report/zw_industry.jshtml?infocode=AP202306261591285545
家电行业动态分析：618家电消费稳步复苏，空调表现亮眼,安信证券,2023-06-26,家电行业,https://data.eastmoney.com/report/zw_industry.jshtml?infocode=AP202306261591285528
交通运输行业周报：VLCC市场运价回落，中泰航班恢复进程良好,中银证券,2023-06-26,航空机场,https://data.eastmoney.com/report/zw_industry.jshtml?infocode=AP202306261591285529
通信行业周报：工信部：1-5月电信业务收入同比增长6.8%,东莞证券,2023-06-26,通信设备,https://data.eastmoney.com/report/zw_industry.jshtml?infocode=AP202306261591285451
电力设备及新能源行业周报：光伏产业链价格逐步探底，1-5月风电装机量同增51.2%,东莞证券,2023-06-26,电源设备,https://data.eastmoney.com/report/zw_industry.jshtml?infocode=AP202306261591285449
汽车行业周报：新能源购置税减免政策再延续，有望稳定行业发展预期,东莞证券,2023-06-26,汽车整车,https://data.eastmoney.com/report/zw_industry.jshtml?infocode=AP202306261591285448
