研报名称,机构名称,发布时间,行业,研报地址
商贸零售行业点评报告：AI+教育商业化率先落地，Duolingo商业模式解析，期待AI+教育多点开花,东吴证券,2023-05-18,商业百货,https://data.eastmoney.com/report/zw_industry.jshtml?infocode=AP202305181586944306
互联网行业业绩点评：腾讯控股23Q1：游戏收入增长较快，视频号贡献广告业务增量,中银证券,2023-05-18,文化传媒,https://data.eastmoney.com/report/zw_industry.jshtml?infocode=AP202305181586813198
2023年中国计算机视觉行业词条报告,头豹研究院,2023-05-18,计算机设备,https://data.eastmoney.com/report/zw_industry.jshtml?infocode=AP202305181586805801
2023年中国单克隆抗体药物行业词条报告,头豹研究院,2023-05-18,化学制药,https://data.eastmoney.com/report/zw_industry.jshtml?infocode=AP202305181586805802
2023年工业软件系列：CAX助力工业4.0转型（摘要版）,头豹研究院,2023-05-18,软件开发,https://data.eastmoney.com/report/zw_industry.jshtml?infocode=AP202305181586805804
家电行业月报：行业一季度经营稳健，景气有待持续修复,中原证券,2023-05-18,家电行业,https://data.eastmoney.com/report/zw_industry.jshtml?infocode=AP202305181586774599
证券Ⅱ行业专题报告：半年度策略：业绩向上，价值重估,浙商证券,2023-05-18,证券,https://data.eastmoney.com/report/zw_industry.jshtml?infocode=AP202305181586774598
机器人行业点评报告：特斯拉人形机器人产业化提速，聚焦AI下一个浪潮“具身智能”,浙商证券,2023-05-18,通用设备,https://data.eastmoney.com/report/zw_industry.jshtml?infocode=AP202305181586774556
4月上市猪企经营数据跟踪：销售均价下降，猪企出栏节奏分化明显,山西证券,2023-05-18,农牧饲渔,https://data.eastmoney.com/report/zw_industry.jshtml?infocode=AP202305181586763121
白酒行业2022年报&2023年一季报点评：场景复苏、需求催化，持续看好白酒行业机会,源达信息,2023-05-18,食品饮料,https://data.eastmoney.com/report/zw_industry.jshtml?infocode=AP202305181586761580
氢能燃料电池行业研究：从海外公司年报看氢能行业系列（一）：Plug Power,国金证券,2023-05-18,电池,https://data.eastmoney.com/report/zw_industry.jshtml?infocode=AP202305181586752391
电力设备：电解液深度报告-六氟磷酸锂盈利能力触底，反转在即,华金证券,2023-05-18,电池,https://data.eastmoney.com/report/zw_industry.jshtml?infocode=AP202305181586752203
电子行业动态点评：存储器行业底部特征明显，关注产业链投资机遇,东莞证券,2023-05-18,半导体,https://data.eastmoney.com/report/zw_industry.jshtml?infocode=AP202305181586752199
社服与消费视角点评4月国内宏观数据：消费低基数造高同比，市场延续恢复态势,中银证券,2023-05-18,专业服务,https://data.eastmoney.com/report/zw_industry.jshtml?infocode=AP202305181586751597
食品饮料社零数据点评：4月餐饮、烟酒类较快反弹，两年复合增速稳健,中银证券,2023-05-18,食品饮料,https://data.eastmoney.com/report/zw_industry.jshtml?infocode=AP202305181586751594
建筑装饰4月经济数据点评：4月基建投资稳健，“一带一路”推进叠加国企改革深化、继续重点推荐低估绩优央国企,中泰证券,2023-05-18,工程建设,https://data.eastmoney.com/report/zw_industry.jshtml?infocode=AP202305181586750479
房地产行业深度报告：销售拿地下滑，业绩承压，行业分化格局初显,开源证券,2023-05-18,房地产开发,https://data.eastmoney.com/report/zw_industry.jshtml?infocode=AP202305181586750475
传媒互联网产业行业研究：新品硬件发布将促进内容生态繁荣，VR摄像机初露锋芒,国金证券,2023-05-18,文化传媒,https://data.eastmoney.com/report/zw_industry.jshtml?infocode=AP202305181586750472
家用电器行业月度点评：Q1白电经营稳健，Q2起行业整体有望企稳向上,财信证券,2023-05-18,家电行业,https://data.eastmoney.com/report/zw_industry.jshtml?infocode=AP202305181586750471
传媒行业月度点评：AI行情回落，关注基本面优质个股,财信证券,2023-05-18,文化传媒,https://data.eastmoney.com/report/zw_industry.jshtml?infocode=AP202305181586750470
食品饮料行业2023年一季度业绩分析：业绩指标全面改善，经营呈现积极态势,中原证券,2023-05-18,食品饮料,https://data.eastmoney.com/report/zw_industry.jshtml?infocode=AP202305181586745708
有色金属：黑色产业链周观点,南京证券,2023-05-18,有色金属,https://data.eastmoney.com/report/zw_industry.jshtml?infocode=AP202305181586745705
教育行业跟踪深度报告：教育板块历轮行情复盘与投资启示,国信证券,2023-05-18,教育,https://data.eastmoney.com/report/zw_industry.jshtml?infocode=AP202305181586745703
电子行业深度：存储周期底部企稳，龙头减产加速行业修复,德邦证券,2023-05-18,半导体,https://data.eastmoney.com/report/zw_industry.jshtml?infocode=AP202305181586745699
银行业一季度货币政策执行报告点评：控总量，调结构，保持利率水平合理适度,天风证券,2023-05-18,银行,https://data.eastmoney.com/report/zw_industry.jshtml?infocode=AP202305181586744386
医药生物行业制药装备板块2022+2023Q1总结：合同负债保持高位，看好全年订单恢复,中泰证券,2023-05-18,医药商业,https://data.eastmoney.com/report/zw_industry.jshtml?infocode=AP202305181586744380
医药生物专题研究报告：特色原料药季报总结之2022&2023Q1-复苏可期，关注困境反转及新动能,中泰证券,2023-05-18,化学制药,https://data.eastmoney.com/report/zw_industry.jshtml?infocode=AP202305181586744362
白酒双周更新：宴席消费带动白酒景气回升,中泰证券,2023-05-18,食品饮料,https://data.eastmoney.com/report/zw_industry.jshtml?infocode=AP202305181586744361
1-4月国家统计局建材行业数据点评：地产竣工修复持续加速，基建投资维持韧性,中泰证券,2023-05-18,水泥建材,https://data.eastmoney.com/report/zw_industry.jshtml?infocode=AP202305181586744360
天然气行业深度报告：全球天然气供需依旧紧平衡，气价或将维持中高位,国海证券,2023-05-18,采掘行业,https://data.eastmoney.com/report/zw_industry.jshtml?infocode=AP202305181586743607
机械行业月度动态报告：PMI回落不改复苏趋势，关注车辆设备招标及维修需求,中国银河,2023-05-18,通用设备,https://data.eastmoney.com/report/zw_industry.jshtml?infocode=AP202305181586743473
充电桩行业深度报告：充电桩迎来加速期，出海认证+渠道+技术构建α壁垒,华宝证券,2023-05-18,电网设备,https://data.eastmoney.com/report/zw_industry.jshtml?infocode=AP202305181586743286
食品饮料行业周报：基本面稳中向好，估值调整打开布局窗口,湘财证券,2023-05-18,食品饮料,https://data.eastmoney.com/report/zw_industry.jshtml?infocode=AP202305181586743284
医药生物新股系列专题报告：内镜耗材再添成员，安杰思科创板上市,浙商证券,2023-05-18,生物制品,https://data.eastmoney.com/report/zw_industry.jshtml?infocode=AP202305181586743283
煤炭行业周报：需求有望触底，煤价偏弱运行，难有大幅下跌空间,湘财证券,2023-05-18,煤炭行业,https://data.eastmoney.com/report/zw_industry.jshtml?infocode=AP202305181586743282
火电行业专题报告：煤价低位运行，火电行情正当时,西南证券,2023-05-18,电力行业,https://data.eastmoney.com/report/zw_industry.jshtml?infocode=AP202305181586743281
半导体行业事件点评：市场需求分化，Q2晶圆代工厂业绩预期略有差异,湘财证券,2023-05-18,半导体,https://data.eastmoney.com/report/zw_industry.jshtml?infocode=AP202305181586743280
2023年4月电量数据跟踪：经济复苏拉动三产用电修复，风光发电增速分化,湘财证券,2023-05-18,环保行业,https://data.eastmoney.com/report/zw_industry.jshtml?infocode=AP202305181586743278
传媒行业2023华西证券中期策略会：把握AI增收主线，重视业绩反转节点,华西证券,2023-05-18,文化传媒,https://data.eastmoney.com/report/zw_industry.jshtml?infocode=AP202305181586743277
航空机场4月数据点评：换季后国际航线放量明显，国内旅客量超19年同期,东兴证券,2023-05-18,航空机场,https://data.eastmoney.com/report/zw_industry.jshtml?infocode=AP202305181586743273
房地产行业点评报告：商品房销售金额保持增长，开发投资数据持续承压,开源证券,2023-05-18,房地产开发,https://data.eastmoney.com/report/zw_industry.jshtml?infocode=AP202305181586743270
白酒板块2022年年报及2023年一季报总结：高端韧性强，区域龙头率先复苏,湘财证券,2023-05-18,酿酒行业,https://data.eastmoney.com/report/zw_industry.jshtml?infocode=AP202305181586743268
医疗服务行业周报：医药板块业绩分化，医疗服务表现较优,湘财证券,2023-05-18,医疗服务,https://data.eastmoney.com/report/zw_industry.jshtml?infocode=AP202305181586743267
医药生物行业上市公司2022年年报及2023年一季报总结,东亚前海证券,2023-05-18,医药商业,https://data.eastmoney.com/report/zw_industry.jshtml?infocode=AP202305181586742372
电力设备与新能源行业投资策略报告：内驱外需共同推进，国内储能迈入高景气赛道,华西证券,2023-05-18,电源设备,https://data.eastmoney.com/report/zw_industry.jshtml?infocode=AP202305181586741564
保险Ⅱ2023年4月保费点评：寿险复苏延续，产险增速回落,浙商证券,2023-05-18,保险,https://data.eastmoney.com/report/zw_industry.jshtml?infocode=AP202305181586741196
房地产行业：新周期下房企“中特估”的价值,浙商证券,2023-05-18,房地产开发,https://data.eastmoney.com/report/zw_industry.jshtml?infocode=AP202305181586741193
半导体行业深度二：存储拐点将至，新需求点亮曙光,国金证券,2023-05-18,半导体,https://data.eastmoney.com/report/zw_industry.jshtml?infocode=AP202305181586741191
保险债权投资计划分类登记新规发布，简政放权与风险防范并重,中诚信国际,2023-05-18,保险,https://data.eastmoney.com/report/zw_industry.jshtml?infocode=AP202305181586741188
电子：2023年4月台股营收点评-销售旺季/XR新品有望拉动显示&光学行业需求，23Q2行业景气度有望筑底回升,上海证券,2023-05-18,半导体,https://data.eastmoney.com/report/zw_industry.jshtml?infocode=AP202305181586741187
