研报名称,机构名称,发布时间,行业,研报地址
有色金属行业月度点评：有色金属承压，新能源材料价格反弹,财信证券,2023-05-29,有色金属,https://data.eastmoney.com/report/zw_industry.jshtml?infocode=AP202305291587338896
有色行业周报：铜铝黄金迎来布局机会,西南证券,2023-05-29,有色金属,https://data.eastmoney.com/report/zw_industry.jshtml?infocode=AP202305291587333101
有色金属行业周报：宏观悲观情绪或见底，继续推荐黄金、锂矿和锡板块,华福证券,2023-05-29,有色金属,https://data.eastmoney.com/report/zw_industry.jshtml?infocode=AP202305291587333076
有色钢铁行业周策略（2023年第21周）：持续关注细分高景气行业新材料投资机会,东方证券,2023-05-29,有色金属,https://data.eastmoney.com/report/zw_industry.jshtml?infocode=AP202305291587333058
有色金属行业研究周报：美国经济数据超预期压制金价，锂价反弹势头放缓,中国银河,2023-05-29,有色金属,https://data.eastmoney.com/report/zw_industry.jshtml?infocode=AP202305291587330906
