研报名称,机构名称,发布时间,行业,研报地址
有色金属行业周报：美国经济韧性凸显，贵金属进一步调整空间有限,中泰证券,2023-07-03,有色金属,https://data.eastmoney.com/report/zw_industry.jshtml?infocode=AP202307031591991224
有色金属&钢铁行业周报：机器人概念延续强势，稀土磁材本周涨势亮眼,东莞证券,2023-07-03,有色金属,https://data.eastmoney.com/report/zw_industry.jshtml?infocode=AP202307031591989251
有色与新材料周报：终端基本面改善在即，电子特气价高位运行,平安证券,2023-07-03,有色金属,https://data.eastmoney.com/report/zw_industry.jshtml?infocode=AP202307031591989006
有色金属行业周报：海外加息预期升温，金属价格震荡延续,上海证券,2023-07-03,有色金属,https://data.eastmoney.com/report/zw_industry.jshtml?infocode=AP202307031591987286
有色金属行业研究：大宗及贵金属周报：6月制造业PMI好于预期，金属价格强势反弹,国金证券,2023-07-03,有色金属,https://data.eastmoney.com/report/zw_industry.jshtml?infocode=AP202307031591987194
金属&新材料周报：机器人有望成为稀土永磁新增长极,财通证券,2023-07-03,有色金属,https://data.eastmoney.com/report/zw_industry.jshtml?infocode=AP202307031591987143
有色金属行业周报：美联储鹰派言论维持加息预期，经济筑底有望迎来改善,安信证券,2023-07-03,有色金属,https://data.eastmoney.com/report/zw_industry.jshtml?infocode=AP202307021591986855
有色金属周报：美联储或继续加息，商品价格继续承压,民生证券,2023-07-03,有色金属,https://data.eastmoney.com/report/zw_industry.jshtml?infocode=AP202307021591986436
有色金属行业周报：机器人加快商业化进程，磁材板块值得重视,中邮证券,2023-07-03,有色金属,https://data.eastmoney.com/report/zw_industry.jshtml?infocode=AP202307021591986361
有色-基本金属周报：鲍威尔延续鹰派表态，低库存及空调消费支撑铜价,华西证券,2023-07-02,有色金属,https://data.eastmoney.com/report/zw_industry.jshtml?infocode=AP202307021591986018
有色金属行业周报：加息预期强化，金属价格延续震荡偏弱,国联证券,2023-07-02,有色金属,https://data.eastmoney.com/report/zw_industry.jshtml?infocode=AP202307021591984991
有色金属行业跟踪周报：美联储加息预期强化，商品价格承压下跌,东吴证券,2023-07-02,有色金属,https://data.eastmoney.com/report/zw_industry.jshtml?infocode=AP202307011591984300
有色金属行业周报：欧美央行巩固加息预期，锂盐价格略有走弱,山西证券,2023-06-30,有色金属,https://data.eastmoney.com/report/zw_industry.jshtml?infocode=AP202306301591955411
有色金属深度报告：人型机器人加速商业化，稀土永磁迎新风,中邮证券,2023-06-30,有色金属,https://data.eastmoney.com/report/zw_industry.jshtml?infocode=AP202306301591891132
有色金属：俄罗斯优势资源全梳理,浙商证券,2023-06-28,有色金属,https://data.eastmoney.com/report/zw_industry.jshtml?infocode=AP202306281591762399
金属行业2023年中期策略系列报告之贵金属篇：加息尾声，扶摇直上会有时,民生证券,2023-06-28,有色金属,https://data.eastmoney.com/report/zw_industry.jshtml?infocode=AP202306281591762383
金属行业2023年中期策略系列报告之新材料篇：新兴领域引领需求，自主可控势不可挡,民生证券,2023-06-27,有色金属,https://data.eastmoney.com/report/zw_industry.jshtml?infocode=AP202306271591725056
金属行业2023年中期策略系列报告之工业金属篇：加息尾声，星星之火可以燎原,民生证券,2023-06-27,有色金属,https://data.eastmoney.com/report/zw_industry.jshtml?infocode=AP202306271591724498
有色金属行业周报：正海磁材业绩点评：全球高性能钕铁硼永磁材料龙头持续进化,爱建证券,2023-06-27,有色金属,https://data.eastmoney.com/report/zw_industry.jshtml?infocode=AP202306271591723829
有色金属深度报告：全球锡行业供给大观,中邮证券,2023-06-27,有色金属,https://data.eastmoney.com/report/zw_industry.jshtml?infocode=AP202306261591600875
有色金属行业周报：美联储表态偏鹰，但就业市场边际弱化，贵金属上行趋势不改,中泰证券,2023-06-26,有色金属,https://data.eastmoney.com/report/zw_industry.jshtml?infocode=AP202306261591291765
有色金属行业研究周报：美联储继续维持鹰派，有色大宗商品受挫,中国银河,2023-06-26,有色金属,https://data.eastmoney.com/report/zw_industry.jshtml?infocode=AP202306261591289358
有色金属行业周报：购置税减免政策延续，需求边际向好,中泰证券,2023-06-26,有色金属,https://data.eastmoney.com/report/zw_industry.jshtml?infocode=AP202306261591287150
有色金属行业周报：国家政策预期向好，大宗商品反弹可期，继续看多铝、金、锡锑及锂,华福证券,2023-06-26,有色金属,https://data.eastmoney.com/report/zw_industry.jshtml?infocode=AP202306261591285597
有色与新材料周报：面板产业供需回暖，OLED有机材料国产化推进,平安证券,2023-06-26,有色金属,https://data.eastmoney.com/report/zw_industry.jshtml?infocode=AP202306261591285550
有色金属行业周报：新能源汽车利好政策频出，美联储鹰派信号施压金属价格,安信证券,2023-06-26,有色金属,https://data.eastmoney.com/report/zw_industry.jshtml?infocode=AP202306251591284664
有色-基本金属行业周报：鲍威尔表态偏鹰宏观暂承压，云南电解铝开始复产关注后续水电情况,华西证券,2023-06-26,有色金属,https://data.eastmoney.com/report/zw_industry.jshtml?infocode=AP202306251591283769
有色金属周度报告：继续看好金属价格上行趋势,信达证券,2023-06-25,有色金属,https://data.eastmoney.com/report/zw_industry.jshtml?infocode=AP202306251591284320
金属&新材料周报：美联储“放鹰”，金价短期承压,财通证券,2023-06-25,有色金属,https://data.eastmoney.com/report/zw_industry.jshtml?infocode=AP202306251591278970
有色金属行业周报：鹰派发言令市场承压，金属价格出现回调,国联证券,2023-06-25,有色金属,https://data.eastmoney.com/report/zw_industry.jshtml?infocode=AP202306251591276653
有色金属行业研究：能源金属周报：购置税政策落地，需求逐步回暖,国金证券,2023-06-25,有色金属,https://data.eastmoney.com/report/zw_industry.jshtml?infocode=AP202306251591276380
有色金属行业研究：大宗及贵金属周报：美联储鹰派言论令外盘金属价格有所回调,国金证券,2023-06-25,有色金属,https://data.eastmoney.com/report/zw_industry.jshtml?infocode=AP202306251591276379
金属矿企产量全梳理,海通国际,2023-06-25,有色金属,https://data.eastmoney.com/report/zw_industry.jshtml?infocode=AP202306251591276000
有色金属行业跟踪周报：美联储加息预期抬升，工业金属价格承压,东吴证券,2023-06-25,有色金属,https://data.eastmoney.com/report/zw_industry.jshtml?infocode=AP202306251591275702
能源金属：5月碳酸锂进口量环比减少10.64%，氢氧化锂出口量环比增长8.62%,华西证券,2023-06-24,有色金属,https://data.eastmoney.com/report/zw_industry.jshtml?infocode=AP202306221591223074
有色金属行业深度报告：供需趋紧下电解铝行业进入上行周期,浙商证券,2023-06-21,有色金属,https://data.eastmoney.com/report/zw_industry.jshtml?infocode=AP202306211591193885
有色金属行业深度：贵金属：金银新起点，重视长逻辑,德邦证券,2023-06-21,有色金属,https://data.eastmoney.com/report/zw_industry.jshtml?infocode=AP202306211591150728
有色金属行业半年度策略：产业链逐步回暖，继续关注黄金、锂和铝板块,中原证券,2023-06-21,有色金属,https://data.eastmoney.com/report/zw_industry.jshtml?infocode=AP202306211591146757
有色行业周报：持续低库存&MLF利率下调铜价继续走高,首创证券,2023-06-21,有色金属,https://data.eastmoney.com/report/zw_industry.jshtml?infocode=AP202306211591144501
有色金属周度报告：宏观面边际向好，支撑金属价格上行,信达证券,2023-06-20,有色金属,https://data.eastmoney.com/report/zw_industry.jshtml?infocode=AP202306201591082207
2023年金属板块研究框架,浙商证券,2023-06-20,有色金属,https://data.eastmoney.com/report/zw_industry.jshtml?infocode=AP202306201591082004
有色金属行业周报：印尼铝土矿出口禁令生效，美联储暂停加息符合预期,华金证券,2023-06-19,有色金属,https://data.eastmoney.com/report/zw_industry.jshtml?infocode=AP202306191591075337
有色金属行业周报：悲观情绪充分释放，板块β向好,中泰证券,2023-06-19,有色金属,https://data.eastmoney.com/report/zw_industry.jshtml?infocode=AP202306191591066911
有色行业周报：继续推荐铜铝，加工板块有望阶段反弹,西南证券,2023-06-19,有色金属,https://data.eastmoney.com/report/zw_industry.jshtml?infocode=AP202306191591064273
有色金属行业周报：锂价趋于稳定，金价短期承压,中邮证券,2023-06-19,有色金属,https://data.eastmoney.com/report/zw_industry.jshtml?infocode=AP202306191591063130
有色金属：5月中国社会融资规模为15600亿元，环比增加27.87%,海通国际,2023-06-19,有色金属,https://data.eastmoney.com/report/zw_industry.jshtml?infocode=AP202306191591062267
有色金属行业周报：美联储暂停加息，国内政策预期强化，重视大宗金属的投资机会,中泰证券,2023-06-19,有色金属,https://data.eastmoney.com/report/zw_industry.jshtml?infocode=AP202306191591062052
有色金属行业研究周报：美联储鹰派式暂停加息，政策出台宏观预期好转利好工业金属反弹,中国银河,2023-06-19,有色金属,https://data.eastmoney.com/report/zw_industry.jshtml?infocode=AP202306191591061415
有色金属行业周报：铂科新材业绩点评：全球领先的金属软磁材料供应商有望稳健增长,爱建证券,2023-06-19,有色金属,https://data.eastmoney.com/report/zw_industry.jshtml?infocode=AP202306191591060921
金属&新材料周报：央行降息落地，工业金属价格上行,财通证券,2023-06-19,有色金属,https://data.eastmoney.com/report/zw_industry.jshtml?infocode=AP202306191591058838
有色金属周报：水电吃紧致电解铝供应偏紧，关注铝冶炼企业盈利改善,德邦证券,2023-06-19,有色金属,https://data.eastmoney.com/report/zw_industry.jshtml?infocode=AP202306191591058832
大宗及贵金属周报：吨铝利润持续扩大，铝板块配置价值凸显,国金证券,2023-06-19,有色金属,https://data.eastmoney.com/report/zw_industry.jshtml?infocode=AP202306191591058752
有色与新材料周报：看好电子耗材需求上行，建议关注镍钴底部行情,平安证券,2023-06-19,有色金属,https://data.eastmoney.com/report/zw_industry.jshtml?infocode=AP202306191591058747
有色金属行业周报：6月暂停加息，大宗商品反弹延续，继续推荐金、铝及锡锑,华福证券,2023-06-19,有色金属,https://data.eastmoney.com/report/zw_industry.jshtml?infocode=AP202306191591058707
有色金属行业2022年报及2023年一季报回顾：22年板块盈利再创新高 估值处于历史低位,首创证券,2023-06-19,有色金属,https://data.eastmoney.com/report/zw_industry.jshtml?infocode=AP202306191591056952
有色金属周报：国内政策预期向好，美联储暂停加息推动工业金属价格反弹,民生证券,2023-06-19,有色金属,https://data.eastmoney.com/report/zw_industry.jshtml?infocode=AP202306191591056933
金属行业周度市场观察,国信证券,2023-06-19,有色金属,https://data.eastmoney.com/report/zw_industry.jshtml?infocode=AP202306191591056896
工业金属行业专题：底部布局正当时,国信证券,2023-06-19,有色金属,https://data.eastmoney.com/report/zw_industry.jshtml?infocode=AP202306191591056892
有色金属行业研究：能源金属周报：锂、稀土价格持续震荡,国金证券,2023-06-19,有色金属,https://data.eastmoney.com/report/zw_industry.jshtml?infocode=AP202306191591056868
有色金属&钢铁行业周报：美联储6月暂停加息，但表示未来仍有加息可能,东莞证券,2023-06-19,有色金属,https://data.eastmoney.com/report/zw_industry.jshtml?infocode=AP202306191591056845
有色金属行业周报：宏观情绪修复，继续推荐铜铝黄金,安信证券,2023-06-19,有色金属,https://data.eastmoney.com/report/zw_industry.jshtml?infocode=AP202306181591056377
有色-基本金属行业周报：美联储如预期暂停加息，宏观压力暂缓有色反弹,华西证券,2023-06-18,有色金属,https://data.eastmoney.com/report/zw_industry.jshtml?infocode=AP202306181591055841
有色金属行业跟踪周报：联储上调加息终点预期，黄金价格承压运行,东吴证券,2023-06-18,有色金属,https://data.eastmoney.com/report/zw_industry.jshtml?infocode=AP202306181591054801
有色金属行业周报：宏观利好频出，金属价格回暖,国联证券,2023-06-18,有色金属,https://data.eastmoney.com/report/zw_industry.jshtml?infocode=AP202306171591054602
有色金属行业周报：国内宏观利好基本金属，碳酸锂价格持稳运行,山西证券,2023-06-16,有色金属,https://data.eastmoney.com/report/zw_industry.jshtml?infocode=AP202306161591026530
有色金属行业2023中期策略：降息前后迎来贵金属主升浪，能源金属处于大底部,浙商证券,2023-06-16,有色金属,https://data.eastmoney.com/report/zw_industry.jshtml?infocode=AP202306161591015897
有色行业周报：库存持续去化提振铜铝 金价震荡静待FOMC会议,首创证券,2023-06-15,有色金属,https://data.eastmoney.com/report/zw_industry.jshtml?infocode=AP202306151590958885
有色与新材料2023年中期策略报告：乘需求复苏之风，行国产替代之路,平安证券,2023-06-14,有色金属,https://data.eastmoney.com/report/zw_industry.jshtml?infocode=AP202306141590928612
有色行业周报：继续推荐黄金铜铝,西南证券,2023-06-13,有色金属,https://data.eastmoney.com/report/zw_industry.jshtml?infocode=AP202306131590893356
有色金属行业周报：终端需求向好，锂价维持高位运行,中泰证券,2023-06-13,有色金属,https://data.eastmoney.com/report/zw_industry.jshtml?infocode=AP202306131590891350
有色金属行业周报：云南6月降雨量提升，关注下周美联储议息会议,华金证券,2023-06-13,有色金属,https://data.eastmoney.com/report/zw_industry.jshtml?infocode=AP202306131590885908
有色金属行业周报：锂延续供应偏紧，锡产量渐入拐点,中邮证券,2023-06-12,有色金属,https://data.eastmoney.com/report/zw_industry.jshtml?infocode=AP202306121590862499
有色金属行业行业研究周报：锂价继续延续反弹，美国就业市场降温,中国银河,2023-06-12,有色金属,https://data.eastmoney.com/report/zw_industry.jshtml?infocode=AP202306121590857803
有色金属行业周报：从陆家嘴论坛看有色金属行业,爱建证券,2023-06-12,有色金属,https://data.eastmoney.com/report/zw_industry.jshtml?infocode=AP202306121590854222
有色金属行业周报：悲观情绪逐步释放，持续看好黄金与铜铝右侧机会,安信证券,2023-06-12,有色金属,https://data.eastmoney.com/report/zw_industry.jshtml?infocode=AP202306121590853880
有色金属周报： 持续关注黄金及顺周期铜铝板块机会,德邦证券,2023-06-12,有色金属,https://data.eastmoney.com/report/zw_industry.jshtml?infocode=AP202306121590852393
有色金属行业周报：世界银行上调2023年全球经济增长预期，推荐黄金、铝及锡锑,华福证券,2023-06-12,有色金属,https://data.eastmoney.com/report/zw_industry.jshtml?infocode=AP202306121590852372
有色与新材料周报：终端基本面逐步回暖，湿电子化学品需求有望上行,平安证券,2023-06-12,有色金属,https://data.eastmoney.com/report/zw_industry.jshtml?infocode=AP202306121590851205
有色金属周报：稳增长预期支撑商品价格，关注下周美联储议息,民生证券,2023-06-12,有色金属,https://data.eastmoney.com/report/zw_industry.jshtml?infocode=AP202306121590850048
大宗及贵金属周报：云南电解铝复产提速，加息预期有所延后,国金证券,2023-06-12,有色金属,https://data.eastmoney.com/report/zw_industry.jshtml?infocode=AP202306121590849980
有色金属&钢铁行业周报：需求预期转好，铁矿石价格快速上涨,东莞证券,2023-06-12,有色金属,https://data.eastmoney.com/report/zw_industry.jshtml?infocode=AP202306121590849956
基础化工新材料行业周报：2023Q1全球半导体设备出货金额同增9%，广信材料电子感光材料年内部分试生产,国海证券,2023-06-12,有色金属,https://data.eastmoney.com/report/zw_industry.jshtml?infocode=AP202306111590849290
有色-基本金属行业周报：美周初请失业金人数大增令就业表现有隐忧，云南降雨增长关注铝复产问题,华西证券,2023-06-12,有色金属,https://data.eastmoney.com/report/zw_industry.jshtml?infocode=AP202306111590848914
金属&新材料周报：暂停加息概率提升，金价后续看涨,财通证券,2023-06-11,有色金属,https://data.eastmoney.com/report/zw_industry.jshtml?infocode=AP202306111590848157
有色金属行业跟踪周报：降息预期尚未明朗，黄金价格震荡运行,东吴证券,2023-06-11,有色金属,https://data.eastmoney.com/report/zw_industry.jshtml?infocode=AP202306101590846936
有色金属行业周报：宏观预期转好升温，关注有色配置机会,国联证券,2023-06-11,有色金属,https://data.eastmoney.com/report/zw_industry.jshtml?infocode=AP202306101590846747
有色金属：海外锂资源企业近况总结-增量预期维持不变，2023年重点关注需求端,华西证券,2023-06-11,有色金属,https://data.eastmoney.com/report/zw_industry.jshtml?infocode=AP202306101590845902
有色金属行业双周报：对国内支持政策预期将支撑金属价格,国泰君安证券(香港),2023-06-09,有色金属,https://data.eastmoney.com/report/zw_industry.jshtml?infocode=AP202306091590662170
有色金属行业周报：基本金属需求不佳，碳酸锂价格延续涨势,山西证券,2023-06-09,有色金属,https://data.eastmoney.com/report/zw_industry.jshtml?infocode=AP202306091590662014
有色金属行业5月行业动态报告：国内经济动能减弱压制有色金属行业景气下落,中国银河,2023-06-07,有色金属,https://data.eastmoney.com/report/zw_industry.jshtml?infocode=AP202306071590519686
有色行业周报：美元指数回升有色承压 铝持续去库料偏强运行,首创证券,2023-06-07,有色金属,https://data.eastmoney.com/report/zw_industry.jshtml?infocode=AP202306071590508609
有色周汇报：锂价延续反弹，铜铝价格企稳,南京证券,2023-06-07,有色金属,https://data.eastmoney.com/report/zw_industry.jshtml?infocode=AP202306071590508588
有色金属行业周报：降息预期放缓，贵金属阶段性承压，继续看多贵金属和锂板块,华福证券,2023-06-07,有色金属,https://data.eastmoney.com/report/zw_industry.jshtml?infocode=AP202306071590508553
有色金属行业周报：供需博弈增强，锂价持稳运行,中泰证券,2023-06-07,有色金属,https://data.eastmoney.com/report/zw_industry.jshtml?infocode=AP202306071590508209
新材料行业周报：碳纤维龙头产能加速落地；光伏玻璃供给端或有望收紧,中泰证券,2023-06-07,有色金属,https://data.eastmoney.com/report/zw_industry.jshtml?infocode=AP202306071590508206
有色周汇报：能源金属延续反弹，工业金属小幅承压,南京证券,2023-06-07,有色金属,https://data.eastmoney.com/report/zw_industry.jshtml?infocode=AP202306071590508199
有色行业周报：铜矿加工费持续回升 铜价存下行压力,首创证券,2023-06-07,有色金属,https://data.eastmoney.com/report/zw_industry.jshtml?infocode=AP202306071590508193
有色金属行业周报：美联储加息预期有所升温，不改贵金属上行趋势,中泰证券,2023-06-07,有色金属,https://data.eastmoney.com/report/zw_industry.jshtml?infocode=AP202306071590508187
有色金属行业专题研究：稀土永磁：新兴领域支撑行业不断成长,东方财富证券,2023-06-06,有色金属,https://data.eastmoney.com/report/zw_industry.jshtml?infocode=AP202306061590460214
有色金属行业深度报告：百年未有之变局，黄金时代！,东吴证券,2023-06-06,有色金属,https://data.eastmoney.com/report/zw_industry.jshtml?infocode=AP202306061590447819
