研报名称,机构名称,发布时间,行业,研报地址
有色金属周报：政策预期+低库存支撑工业金属价格，能源金属博弈加剧,民生证券,2023-05-28,有色金属,https://data.eastmoney.com/report/zw_industry.jshtml?infocode=AP202305281587323955
有色金属行业周报：缅甸佤邦重申锡矿禁采，光伏超预期带动锑需求,中邮证券,2023-05-28,有色金属,https://data.eastmoney.com/report/zw_industry.jshtml?infocode=AP202305281587323588
有色金属行业跟踪周报：美国6月加息预期升温，金属价格短期承压,东吴证券,2023-05-28,有色金属,https://data.eastmoney.com/report/zw_industry.jshtml?infocode=AP202305281587322951
有色金属行业周报：宏观与需求共振，低库存支撑金属价格,国联证券,2023-05-28,有色金属,https://data.eastmoney.com/report/zw_industry.jshtml?infocode=AP202305271587319042
有色金属行业深度分析：资源为王：全球锂矿23年一季报更新,安信证券,2023-05-26,有色金属,https://data.eastmoney.com/report/zw_industry.jshtml?infocode=AP202305261587297785
