研报名称,机构名称,发布时间,行业,研报地址
交通运输行业周报：把握低估值高分红主线，关注客运量确定性改善品种,华福证券,2023-05-30,物流行业,https://data.eastmoney.com/report/zw_industry.jshtml?infocode=AP202305301587347774
交通运输行业周报：各大电商平台开启618预售，快递市场份额预计向头部企业持续聚集,上海证券,2023-05-30,物流行业,https://data.eastmoney.com/report/zw_industry.jshtml?infocode=AP202305301587347545
交通运输仓储行业研究：快递业务量同比大增 C919商业航班完成首飞,国金证券,2023-05-29,物流行业,https://data.eastmoney.com/report/zw_industry.jshtml?infocode=AP202305291587330312
交通运输行业2023年6月投资策略：拥抱低估值高股息的基建资产，布局航空油运高弹性机会,国信证券,2023-05-29,物流行业,https://data.eastmoney.com/report/zw_industry.jshtml?infocode=AP202305291587330267
快递行业4月数据点评：件量加速修复，行业ASP持续承压,西南证券,2023-05-29,物流行业,https://data.eastmoney.com/report/zw_industry.jshtml?infocode=AP202305291587330193
