研报名称,机构名称,发布时间,行业,研报地址
社会服务行业周报：进入暑期出行旺季，酒店和景区更为受益,浙商证券,2023-05-29,专业服务,https://data.eastmoney.com/report/zw_industry.jshtml?infocode=AP202305291587338914
社会服务行业周报：关注二季度业绩兑现方向，聚焦会展、文体设备细分行业龙头,中国银河,2023-05-29,专业服务,https://data.eastmoney.com/report/zw_industry.jshtml?infocode=AP202305291587336760
社会服务行业周观点：暑期旅游预热超预期，持续利好线下消费,中航证券,2023-05-29,专业服务,https://data.eastmoney.com/report/zw_industry.jshtml?infocode=AP202305291587325811
社会服务行业周报：板块表现分化，景区类公司经营改善明显,南京证券,2023-05-23,专业服务,https://data.eastmoney.com/report/zw_industry.jshtml?infocode=AP202305231587092349
社会服务行业周报：暑期旅游预订热潮将至，佳禾食品发布定增预案扩产咖啡,开源证券,2023-05-22,专业服务,https://data.eastmoney.com/report/zw_industry.jshtml?infocode=AP202305221587042950
