研报名称,机构名称,发布时间,行业,研报地址
社会服务行业周报：板块表现分化，景区类公司经营改善明显,南京证券,2023-05-23,专业服务,https://data.eastmoney.com/report/zw_industry.jshtml?infocode=AP202305231587092349
社会服务行业周报：暑期旅游预订热潮将至，佳禾食品发布定增预案扩产咖啡,开源证券,2023-05-22,专业服务,https://data.eastmoney.com/report/zw_industry.jshtml?infocode=AP202305221587042950
社会服务行业周报：出行板块进入低基数复苏阶段，重点关注环比改善持续提升方向,中国银河,2023-05-21,专业服务,https://data.eastmoney.com/report/zw_industry.jshtml?infocode=AP202305211587036164
社服与消费视角点评4月国内宏观数据：消费低基数造高同比，市场延续恢复态势,中银证券,2023-05-18,专业服务,https://data.eastmoney.com/report/zw_industry.jshtml?infocode=AP202305181586751597
社会服务行业周观点：五一假后迎来错峰出游热潮，演出经济持续火热,万联证券,2023-05-15,专业服务,https://data.eastmoney.com/report/zw_industry.jshtml?infocode=AP202305151586644947
