研报名称,机构名称,发布时间,行业,研报地址
心脏电生理器械 头豹词条报告系列,头豹研究院,2023-06-28,医疗器械,https://data.eastmoney.com/report/zw_industry.jshtml?infocode=AP202306281591792187
心血管介入医疗器械 头豹词条报告系列,头豹研究院,2023-06-28,医疗器械,https://data.eastmoney.com/report/zw_industry.jshtml?infocode=AP202306281591792188
2023年中国药用玻璃市场研究,头豹研究院,2023-06-20,医疗器械,https://data.eastmoney.com/report/zw_industry.jshtml?infocode=AP202306201591098881
骨科器械财报总结及行业专题：行而不辍，未来可期,国信证券,2023-06-16,医疗器械,https://data.eastmoney.com/report/zw_industry.jshtml?infocode=AP202306161591018793
检测检验行业深度报告：百年检测穿越牛熊，兼具稳健性与成长性,浙商证券,2023-06-07,医疗器械,https://data.eastmoney.com/report/zw_industry.jshtml?infocode=AP202306071590508221
医疗器械专题报告：手术动力系统第一股，西山科技上市,浙商证券,2023-06-07,医疗器械,https://data.eastmoney.com/report/zw_industry.jshtml?infocode=AP202306071590504267
2023年中国制氧机行业词条报告,头豹研究院,2023-06-02,医疗器械,https://data.eastmoney.com/report/zw_industry.jshtml?infocode=AP202306021589557590
医疗器械行业专题：2023Q1美股医疗器械公司业绩及看点复盘,德邦证券,2023-06-02,医疗器械,https://data.eastmoney.com/report/zw_industry.jshtml?infocode=AP202306021589247325
2023年中国医用配送机器人行业词条报告,头豹研究院,2023-05-29,医疗器械,https://data.eastmoney.com/report/zw_industry.jshtml?infocode=AP202305291587342433
医药生物：血液透析行业深度研究：需求持续提升，国产替代空间广阔,国联证券,2023-05-25,医疗器械,https://data.eastmoney.com/report/zw_industry.jshtml?infocode=AP202305251587161244
医疗器械行业行业研究：医用耗材支付管理升级，各省医保支付规范有望统一,国金证券,2023-05-22,医疗器械,https://data.eastmoney.com/report/zw_industry.jshtml?infocode=AP202305221587039557
2023年中国产后康复设备行业词条报告,头豹研究院,2023-05-19,医疗器械,https://data.eastmoney.com/report/zw_industry.jshtml?infocode=AP202305191586976545
2023年中国CT设备行业词条报告,头豹研究院,2023-05-17,医疗器械,https://data.eastmoney.com/report/zw_industry.jshtml?infocode=AP202305171586728557
内镜板块2022年报及2023一季报总结：内镜板块，上行周期,浙商证券,2023-05-12,医疗器械,https://data.eastmoney.com/report/zw_industry.jshtml?infocode=AP202305121586524294
医疗器械：疫情影响导致内部分化，关注政策催化以及诊疗复苏机会,中泰证券,2023-05-10,医疗器械,https://data.eastmoney.com/report/zw_industry.jshtml?infocode=AP202305101586444829
2023年中国移动医疗器械行业词条报告,头豹研究院,2023-05-09,医疗器械,https://data.eastmoney.com/report/zw_industry.jshtml?infocode=AP202305091586409708
医药行业周报（23年第18周）：美股医疗器械公司发布2023一季报，关注诊疗复苏相关标的,国信证券,2023-05-09,医疗器械,https://data.eastmoney.com/report/zw_industry.jshtml?infocode=AP202305091586393120
医药生物2022年年报及2023年一季报总结：医疗器械：院内诊疗需求逐步修复，关注业绩弹性,华福证券,2023-05-08,医疗器械,https://data.eastmoney.com/report/zw_industry.jshtml?infocode=AP202305081586358782
药械上游板块2022年报及2023Q1总结：动能切换、扩张整合,浙商证券,2023-05-04,医疗器械,https://data.eastmoney.com/report/zw_industry.jshtml?infocode=AP202305041586268096
医疗器械行业周度点评：关注百亿级结直肠癌早筛市场,财信证券,2023-04-26,医疗器械,https://data.eastmoney.com/report/zw_industry.jshtml?infocode=AP202304261585880762
医药行业点评报告：大型医用设备配置目录调整，提升渗透率,国开证券,2023-03-31,医疗器械,https://data.eastmoney.com/report/zw_industry.jshtml?infocode=AP202303311584736146
糖尿病管理器械市场行业报告：糖尿病器械潜力十足，CGM市场方兴未艾,华金证券,2023-03-30,医疗器械,https://data.eastmoney.com/report/zw_industry.jshtml?infocode=AP202303301584668087
软镜行业深度报告：技术积淀数十载，国产替代正当时,国海证券,2023-03-27,医疗器械,https://data.eastmoney.com/report/zw_industry.jshtml?infocode=AP202303271584567327
结构性心脏病介入器械,头豹研究院,2023-03-24,医疗器械,https://data.eastmoney.com/report/zw_industry.jshtml?infocode=AP202303241584545072
大型医用设备配置证政策行业点评：配置证调整落地，行业供给端扩容加速,德邦证券,2023-03-24,医疗器械,https://data.eastmoney.com/report/zw_industry.jshtml?infocode=AP202303241584526321
医疗器械行业周度点评：国产CGM产品相继获批，国内血糖监测行业有望加速发展,财信证券,2023-03-22,医疗器械,https://data.eastmoney.com/report/zw_industry.jshtml?infocode=AP202303221584469170
医药生物：新版大型医用设备配置许可管理目录发布，医院采购需求有望加速释放,中泰证券,2023-03-22,医疗器械,https://data.eastmoney.com/report/zw_industry.jshtml?infocode=AP202303221584467469
医药生物行业周报：持续血糖监测国产替代进程有望提速,爱建证券,2023-03-21,医疗器械,https://data.eastmoney.com/report/zw_industry.jshtml?infocode=AP202303211584436543
医疗器械EBC展会行业跟踪点评：二代测序，应用加速,浙商证券,2023-03-21,医疗器械,https://data.eastmoney.com/report/zw_industry.jshtml?infocode=AP202303211584430607
医药生物行业03月周报：关注医疗资源下沉与医疗需求恢复的受益标的,国联证券,2023-03-12,医疗器械,https://data.eastmoney.com/report/zw_industry.jshtml?infocode=AP202303131584211775
医疗器械行业周度点评：《关于做好2023年医药集中采购和价格管理工作的通知》发布，耗材集采持续推进,财信证券,2023-03-08,医疗器械,https://data.eastmoney.com/report/zw_industry.jshtml?infocode=AP202303081584121885
医药行业深度报告：小孔之光——窥探新机遇，内镜国产化拉开序幕,平安证券,2023-03-02,医疗器械,https://data.eastmoney.com/report/zw_industry.jshtml?infocode=AP202303021583956048
生命科学工具行业行业研究：打好仪器设备国产化攻坚战，行业迎来发展期,国金证券,2023-02-24,医疗器械,https://data.eastmoney.com/report/zw_industry.jshtml?infocode=AP202302241583677772
医疗器械出海专题：出海水到渠成，空间大有可为,西南证券,2023-02-21,医疗器械,https://data.eastmoney.com/report/zw_industry.jshtml?infocode=AP202302211583412400
医药生物行业专题研究：软镜破壁替代正当时，国内厂商露锋芒,东方财富证券,2023-02-20,医疗器械,https://data.eastmoney.com/report/zw_industry.jshtml?infocode=AP202302201583393982
医疗创新器械-内窥镜行业专题：核心三问，内窥镜技术趋势图谱和投资机会,西南证券,2023-02-13,医疗器械,https://data.eastmoney.com/report/zw_industry.jshtml?infocode=AP202302131583078778
海外医疗器械专题：复苏机会有望贯穿全年，积极把握当前时点,中泰证券,2023-02-03,医疗器械,https://data.eastmoney.com/report/zw_industry.jshtml?infocode=AP202302031582723778
耗材集采系列报告之一：口腔种植牙行业及集采分析,浙商证券,2023-01-19,医疗器械,https://data.eastmoney.com/report/zw_industry.jshtml?infocode=AP202301191582167737
医疗器械行业点评报告：口腔种植体集采落地，看好行业规模加速扩容,财通证券,2023-01-13,医疗器械,https://data.eastmoney.com/report/zw_industry.jshtml?infocode=AP202301131581962335
2023年医疗器械行业投资策略报告：春暖花开，静待行业变革与复苏,财信证券,2023-01-04,医疗器械,https://data.eastmoney.com/report/zw_industry.jshtml?infocode=AP202301041581688026
医疗器械行业研究：安杰思招股说明书整理,国金证券,2023-01-03,医疗器械,https://data.eastmoney.com/report/zw_industry.jshtml?infocode=AP202301031581638540
心脏瓣膜行业深度报告：厚积薄发，心脏瓣膜介入赛道初探,华安证券,2022-12-29,医疗器械,https://data.eastmoney.com/report/zw_industry.jshtml?infocode=AP202212291581497043
医疗器械行业深度研究：耗材集采规则持续优化，降价风险逐步缓和,国金证券,2022-12-29,医疗器械,https://data.eastmoney.com/report/zw_industry.jshtml?infocode=AP202212291581456331
中国医疗器械在“一带一路”国家贸易状况及贡献度分析,众成数科,2022-12-28,医疗器械,https://data.eastmoney.com/report/zw_industry.jshtml?infocode=AP202212281581429043
2022年医疗机器人行业概览：医疗机器人厂商众多，能否决出龙头存在（摘要版）,头豹研究院,2022-12-21,医疗器械,https://data.eastmoney.com/report/zw_industry.jshtml?infocode=AP202212211581276108
医疗行业行业研究：全面布局常规医疗复苏 重点聚焦三大方向,国金证券,2022-12-21,医疗器械,https://data.eastmoney.com/report/zw_industry.jshtml?infocode=AP202212211581264535
医疗器械行业周度点评：27省电生理耗材集采落地，国产厂家中标良好,财信证券,2022-12-21,医疗器械,https://data.eastmoney.com/report/zw_industry.jshtml?infocode=AP202212211581253427
医疗器械行业周度点评：疫情防控持续优化，关注医疗器械相关板块,财信证券,2022-12-15,医疗器械,https://data.eastmoney.com/report/zw_industry.jshtml?infocode=AP202212151581104501
医疗器械行业周度点评：疫情防控措施优化，院内外医疗需求有望复苏,财信证券,2022-12-06,医疗器械,https://data.eastmoney.com/report/zw_industry.jshtml?infocode=AP202212061580854518
医疗器械：冠脉支架接续采购结果公布，中选价格有所提升,财信证券,2022-12-02,医疗器械,https://data.eastmoney.com/report/zw_industry.jshtml?infocode=AP202212021580754221
医疗器械行业事项点评：冠脉支架续标落地，中标价格均有提升,信达证券,2022-12-02,医疗器械,https://data.eastmoney.com/report/zw_industry.jshtml?infocode=AP202212021580747529
医疗器械行业周度点评：疫情反复，寻找变化中的确定性机会,财信证券,2022-11-30,医疗器械,https://data.eastmoney.com/report/zw_industry.jshtml?infocode=AP202211301580687148
医疗器械行业研究：冠脉支架接续采购落地，中标价格整体提升,国金证券,2022-11-30,医疗器械,https://data.eastmoney.com/report/zw_industry.jshtml?infocode=AP202211301580684920
医药生物行业周报：科研仪器赛道长坡厚雪，国产替代景气高,上海证券,2022-11-28,医疗器械,https://data.eastmoney.com/report/zw_industry.jshtml?infocode=AP202211281580635142
医疗行业研究：回调之后的第二波才是核心机会，对基本面和政策预期保持乐观,国金证券,2022-11-28,医疗器械,https://data.eastmoney.com/report/zw_industry.jshtml?infocode=AP202211281580620891
2022年中国内窥镜行业：澳华内镜、开立医疗、南微医学如何开启国产品牌之路？,头豹研究院,2022-11-24,医疗器械,https://data.eastmoney.com/report/zw_industry.jshtml?infocode=AP202211241580548689
医疗器械行业周度点评：ICU、方舱医院、发热门诊建设加强，建议继续关注医疗新基建投资机会,财信证券,2022-11-22,医疗器械,https://data.eastmoney.com/report/zw_industry.jshtml?infocode=AP202211221580476203
医药生物行业周报：防疫新时期，防疫主题常规复苏双驱动,东海证券,2022-11-22,医疗器械,https://data.eastmoney.com/report/zw_industry.jshtml?infocode=AP202211221580464710
医疗器械：疫情防控立足科学，ICU行业迎来利好,信达证券,2022-11-21,医疗器械,https://data.eastmoney.com/report/zw_industry.jshtml?infocode=AP202211211580414271
医疗器械行业事项点评：冠脉支架续标公告发布，中标价格有望提升,信达证券,2022-11-15,医疗器械,https://data.eastmoney.com/report/zw_industry.jshtml?infocode=AP202211151580267391
医疗器械行业周度点评：集采大势下，关注与政策共振的优秀标的,财信证券,2022-11-13,医疗器械,https://data.eastmoney.com/report/zw_industry.jshtml?infocode=AP202211131580205866
医药生物深度报告：稳中求进，微创时代铸就百亿吻合器市场,华安证券,2022-11-04,医疗器械,https://data.eastmoney.com/report/zw_industry.jshtml?infocode=AP202211041579969073
医疗器械专题研究报告：疫情扰动下增速稳健，政策缓和后有望迎来向上拐点,中泰证券,2022-11-04,医疗器械,https://data.eastmoney.com/report/zw_industry.jshtml?infocode=AP202211041579915010
医疗器械IVD行业政策点评：从定量到定性，更重市场化竞争,浙商证券,2022-11-02,医疗器械,https://data.eastmoney.com/report/zw_industry.jshtml?infocode=AP202211021579777848
医疗器械行业2022三季报总结及策略展望：价值和成长兼顾，寻找高景气/内生动能充足+壁垒高型标的,华安证券,2022-11-01,医疗器械,https://data.eastmoney.com/report/zw_industry.jshtml?infocode=AP202211011579703559
医疗器械行业事项点评：介入巨头豪掷收购，药球发展指日可待,信达证券,2022-10-26,医疗器械,https://data.eastmoney.com/report/zw_industry.jshtml?infocode=AP202210261579477129
医疗器械行业专题报告：骨科耗材集采逐步落地，国产替代有望加速,财通证券,2022-10-24,医疗器械,https://data.eastmoney.com/report/zw_industry.jshtml?infocode=AP202210241579413697
医疗器械行业深度：医疗新基建：高景气，新机遇,财信证券,2022-10-18,医疗器械,https://data.eastmoney.com/report/zw_industry.jshtml?infocode=AP202210181579257098
医疗器械行业专题：医疗新基建，加快优质医疗资源扩容和区域均衡布局,华安证券,2022-10-17,医疗器械,https://data.eastmoney.com/report/zw_industry.jshtml?infocode=AP202210171579203489
医疗器械行业点评报告：卫健委贴息政策更新：财政贴息助力医疗新基建加速，医疗设备板块有望迎来数千亿级需求释放,开源证券,2022-10-12,医疗器械,https://data.eastmoney.com/report/zw_industry.jshtml?infocode=AP202210121579083743
医疗器械行业研究：美瞳行业兼具消费和医疗属性，市场发展迅速,国金证券,2022-10-10,医疗器械,https://data.eastmoney.com/report/zw_industry.jshtml?infocode=AP202210101579034370
医疗器械行业政策点评报告：财政支持加大，利好器械放量,浙商证券,2022-10-09,医疗器械,https://data.eastmoney.com/report/zw_industry.jshtml?infocode=AP202210091578994413
医疗器械行业点评：脊柱类耗材国家集采拟中选结果出炉，国产龙头中标情况良好,财信证券,2022-09-30,医疗器械,https://data.eastmoney.com/report/zw_industry.jshtml?infocode=AP202209301578791271
医疗器械行业跟踪分析报告：脊柱国采终端降幅符合预期，国产替代加速,财通证券,2022-09-28,医疗器械,https://data.eastmoney.com/report/zw_industry.jshtml?infocode=AP202209281578745742
医疗器械行业：脊柱国采结果落地，国产龙头有望受益,中泰证券,2022-09-28,医疗器械,https://data.eastmoney.com/report/zw_industry.jshtml?infocode=AP202209281578735539
医疗器械行业月度点评：医疗新基建持续铺开，相关板块将陆续受益,财信证券,2022-09-28,医疗器械,https://data.eastmoney.com/report/zw_industry.jshtml?infocode=AP202209281578733756
医药行业上游供应链系列专题深度：政策东风持续，科学仪器国产替代加速,国金证券,2022-09-28,医疗器械,https://data.eastmoney.com/report/zw_industry.jshtml?infocode=AP202209281578729808
医疗器械行业点评：脊柱集采拟中标结果公布，国产份额有望提升,国金证券,2022-09-28,医疗器械,https://data.eastmoney.com/report/zw_industry.jshtml?infocode=AP202209281578729806
医疗器械行业点评：口腔种植体集采1号文件发布，促进行业规范化发展,天风证券,2022-09-23,医疗器械,https://data.eastmoney.com/report/zw_industry.jshtml?infocode=AP202209231578614575
医疗行业研究：政策和业绩双底铸就，建议加大配置,国金证券,2022-09-19,医疗器械,https://data.eastmoney.com/report/zw_industry.jshtml?infocode=AP202209191578497853
医疗器械行业跟踪分析报告：口腔种植医疗服务收费和耗材价格专项治理点评-价格降幅好于预期，看好口腔耗材与服务,财通证券,2022-09-13,医疗器械,https://data.eastmoney.com/report/zw_industry.jshtml?infocode=AP202209131578320088
2022年冲击波医疗器械行业研究报告,亿渡数据,2022-09-13,医疗器械,https://data.eastmoney.com/report/zw_industry.jshtml?infocode=AP202209131578315343
医疗器械行业跟踪分析报告：骨科植入器械政策落地，长期发展空间大,财通证券,2022-09-13,医疗器械,https://data.eastmoney.com/report/zw_industry.jshtml?infocode=AP202209131578310338
制药设备及耗材板块2022年中报总结：上半年经营受疫情影响，产品升级驱动未来成长,西南证券,2022-09-07,医疗器械,https://data.eastmoney.com/report/zw_industry.jshtml?infocode=AP202209071578102660
医疗行业研究：低点已过，看好下半年医疗板块加速复苏,国金证券,2022-09-06,医疗器械,https://data.eastmoney.com/report/zw_industry.jshtml?infocode=AP202209061578078423
医疗器械专题研究报告：疫情扰动下增速良好，自主创新+全球化发展逻辑持续兑现,中泰证券,2022-09-06,医疗器械,https://data.eastmoney.com/report/zw_industry.jshtml?infocode=AP202209061578074970
医疗器械板块2022年中报总结：剔除新冠检测短期承压，下半年聚焦医疗设备、出海、医疗新基建等领域,西南证券,2022-09-06,医疗器械,https://data.eastmoney.com/report/zw_industry.jshtml?infocode=AP202209061578070242
医疗器械行业2022中报总结及展望：价值和成长兼顾，寻找具备产业比较优势、内生动能充足型标的,华安证券,2022-09-05,医疗器械,https://data.eastmoney.com/report/zw_industry.jshtml?infocode=AP202209051578051034
药械上游板块2022H1总结：品类升级期、规模量产前,浙商证券,2022-09-05,医疗器械,https://data.eastmoney.com/report/zw_industry.jshtml?infocode=AP202209051578045096
医疗器械行业快报：国家医保局发文指引医疗器械带量采购方向，创新器械有望迎来板块性利好,安信证券,2022-09-05,医疗器械,https://data.eastmoney.com/report/zw_industry.jshtml?infocode=AP202209051578038732
医疗器械板块2022半年报总结：疫情下分化，创新中迭起,浙商证券,2022-09-05,医疗器械,https://data.eastmoney.com/report/zw_industry.jshtml?infocode=AP202209051578034464
内窥镜行业专题报告：市场需求景气，国产替代空间广,东莞证券,2022-08-30,医疗器械,https://data.eastmoney.com/report/zw_industry.jshtml?infocode=AP202208301577840911
医疗器械行业研究：电生理集采方案发布，控费进入常态化阶段,国金证券,2022-08-29,医疗器械,https://data.eastmoney.com/report/zw_industry.jshtml?infocode=AP202208291577773366
医疗器械行业月度点评：联影医疗拟上市，关注国产影像设备产业升级及国产替代相关标的,财信证券,2022-08-22,医疗器械,https://data.eastmoney.com/report/zw_industry.jshtml?infocode=AP202208221577442029
医学影像专题系列二：掘“芯”核心部件，高端影像国产替代进行时,德邦证券,2022-08-18,医疗器械,https://data.eastmoney.com/report/zw_industry.jshtml?infocode=AP202208181577338274
医疗器械行业专题：PB-ROE模型在低值耗材中的应用,华安证券,2022-08-18,医疗器械,https://data.eastmoney.com/report/zw_industry.jshtml?infocode=AP202208181577324234
基因测序行业深度报告：高壁垒叠加自主可控，国内基因测序龙头上市在即,信达证券,2022-08-15,医疗器械,https://data.eastmoney.com/report/zw_industry.jshtml?infocode=AP202208151577210099
2022年中国3D生物打印行业概览：发展现状对比分析研究报告（摘要版）,头豹研究院,2022-08-09,医疗器械,https://data.eastmoney.com/report/zw_industry.jshtml?infocode=AP202208091577052278
2022年MRD动态监测技术细分研究报告,头豹研究院,2022-08-04,医疗器械,https://data.eastmoney.com/report/zw_industry.jshtml?infocode=AP202208041576905609
医疗器械行业月度点评：疫情影响边际减弱，关注消费及医疗新基建双主线,财信证券,2022-08-04,医疗器械,https://data.eastmoney.com/report/zw_industry.jshtml?infocode=AP202208041576895021
