研报名称,机构名称,发布时间,行业,研报地址
环保&专精特新周报：《国家水网建设规划纲要》印发,国海证券,2023-06-01,环保行业,https://data.eastmoney.com/report/zw_industry.jshtml?infocode=AP202306011587459747
环保行业月报：2023M1-3环卫新能源销量同增27%，渗透率同比提升2.01pct至6.84%,东吴证券国际经纪,2023-06-01,环保行业,https://data.eastmoney.com/report/zw_industry.jshtml?infocode=AP202306011587449213
环保行业点评报告：《2022年北京市生态环境状况公报》发布，生态环境质量实现持续改善,东吴证券,2023-06-01,环保行业,https://data.eastmoney.com/report/zw_industry.jshtml?infocode=AP202306011587443282
环保行业点评报告：山东省生态环境厅等七部门印发减污降碳协同增效实施方案，进一步落实碳达峰,东吴证券,2023-05-31,环保行业,https://data.eastmoney.com/report/zw_industry.jshtml?infocode=AP202305311587368878
环保行业事件点评：环卫车1-4月市场跟踪，新能源渗透率同比上升,东莞证券,2023-05-30,环保行业,https://data.eastmoney.com/report/zw_industry.jshtml?infocode=AP202305301587352265
环保行业点评报告：点源、线源、面源、内源同治，安徽推动巢湖水质实现历史性好转,东吴证券,2023-05-30,环保行业,https://data.eastmoney.com/report/zw_industry.jshtml?infocode=AP202305301587348716
环保行业研究周报：生物柴油原料问题持续发酵,申港证券,2023-05-29,环保行业,https://data.eastmoney.com/report/zw_industry.jshtml?infocode=AP202305291587330273
公用环保行业202305第5期：《国家水网建设规划纲要》印发，分散式风电项目审批流程简化,国信证券,2023-05-29,环保行业,https://data.eastmoney.com/report/zw_industry.jshtml?infocode=AP202305291587330266
低碳研究行业周报：电改进行时，用电侧业务形态迎发展,华福证券,2023-05-29,环保行业,https://data.eastmoney.com/report/zw_industry.jshtml?infocode=AP202305291587328889
环保行业周报：国务院印发《国家水网建设规划纲要》,东莞证券,2023-05-29,环保行业,https://data.eastmoney.com/report/zw_industry.jshtml?infocode=AP202305291587328563
公用事业与环保行业周报：本周煤价跌幅扩大，广东省推进“新能源+储能”建设,西南证券,2023-05-29,环保行业,https://data.eastmoney.com/report/zw_industry.jshtml?infocode=AP202305291587325735
低碳研究行业周报：水网建设加速，水务+管网有望充分受益,华福证券,2023-05-29,环保行业,https://data.eastmoney.com/report/zw_industry.jshtml?infocode=AP202305291587325691
环保行业跟踪周报：理顺价格机制推动加快国家水网建设，环卫新能源销量提速期待试点城市落地,东吴证券,2023-05-29,环保行业,https://data.eastmoney.com/report/zw_industry.jshtml?infocode=AP202305281587324339
环保行业点评报告：理顺价格机制推动加快国家水网建设，智慧水务&监测设备需求提速,东吴证券,2023-05-28,环保行业,https://data.eastmoney.com/report/zw_industry.jshtml?infocode=AP202305281587323183
双碳环保日报：中共中央、国务院印发《国家水网建设规划纲要》，2035年基本形成国家水网总体格局,东吴证券,2023-05-28,环保行业,https://data.eastmoney.com/report/zw_industry.jshtml?infocode=AP202305271587307341
环保行业事件点评：完善国家水网格局，提高国家水安全保障,东莞证券,2023-05-26,环保行业,https://data.eastmoney.com/report/zw_industry.jshtml?infocode=AP202305261587288994
环保行业事件点评：完善水网布局，智慧水务值关注,民生证券,2023-05-26,环保行业,https://data.eastmoney.com/report/zw_industry.jshtml?infocode=AP202305261587285188
双碳环保日报：云南全面加快城市生活垃圾分类，城市居民小区生活垃圾分类覆盖率年底达90%,东吴证券,2023-05-26,环保行业,https://data.eastmoney.com/report/zw_industry.jshtml?infocode=AP202305261587180772
双碳环保日报：湖北省印发大气污染防治“三大”治理攻坚战役和“六大”专项提升行动计划,东吴证券,2023-05-25,环保行业,https://data.eastmoney.com/report/zw_industry.jshtml?infocode=AP202305241587149314
环保行业月报：2023M4环卫新能源销量提速，期待试点城市落地,东吴证券,2023-05-24,环保行业,https://data.eastmoney.com/report/zw_industry.jshtml?infocode=AP202305241587136614
工业气体行业深度报告：长坡厚雪优质赛道，国产替代大有可为,中泰证券,2023-05-24,环保行业,https://data.eastmoney.com/report/zw_industry.jshtml?infocode=AP202305241587125443
双碳环保日报：工信部公开征求对《工业领域碳达峰碳中和标准体系建设指南（2023版）》的意见,东吴证券,2023-05-24,环保行业,https://data.eastmoney.com/report/zw_industry.jshtml?infocode=AP202305241587121418
双碳环保日报：湖南省大气污染防治攻坚行动计划（2023-2025 年）征求意见,东吴证券,2023-05-23,环保行业,https://data.eastmoney.com/report/zw_industry.jshtml?infocode=AP202305231587070453
环保行业跟踪周报：锂价回升回收盈利能力波动，行业规范化发展逐步推进,东吴证券,2023-05-23,环保行业,https://data.eastmoney.com/report/zw_industry.jshtml?infocode=AP202305221587063525
从海外公司年报看氢能行业系列（六）：ITM Power,国金证券,2023-05-22,环保行业,https://data.eastmoney.com/report/zw_industry.jshtml?infocode=AP202305221587047301
污泥处理行业研究：需求加速释放 市场规模实现跨越式增长,财联社,2023-05-22,环保行业,https://data.eastmoney.com/report/zw_industry.jshtml?infocode=AP202305221587040793
环保行业点评报告：2023—2024年黄河流域“清废行动”正式启动,东吴证券,2023-05-22,环保行业,https://data.eastmoney.com/report/zw_industry.jshtml?infocode=AP202305221587039549
环保行业研究周报：为新能源环卫装备开启乡村市场,申港证券,2023-05-22,环保行业,https://data.eastmoney.com/report/zw_industry.jshtml?infocode=AP202305221587039537
低碳研究行业：火电专题：梳理火电资产质地，探寻结构性机会,华福证券,2023-05-22,环保行业,https://data.eastmoney.com/report/zw_industry.jshtml?infocode=AP202305221587037450
环保与公用事业周报：深化电价机制改革，推动灵活调节资源建设,德邦证券,2023-05-22,环保行业,https://data.eastmoney.com/report/zw_industry.jshtml?infocode=AP202305221587037360
环保行业跟踪周报：环境运营资产估值提升的本质？自由现金流改善！推荐水务固废天然气+半导体治理,东吴证券,2023-05-22,环保行业,https://data.eastmoney.com/report/zw_industry.jshtml?infocode=AP202305221587036761
环保及公用事业行业周报：第三监管周期输配电价政策明晰，四台核电新机组环境报告书审议通过,安信证券,2023-05-22,环保行业,https://data.eastmoney.com/report/zw_industry.jshtml?infocode=AP202305211587036114
环保行业周报：全面部署黄河流域固体废物倾倒排查整治工作,东莞证券,2023-05-21,环保行业,https://data.eastmoney.com/report/zw_industry.jshtml?infocode=AP202305211587035738
环保行业点评报告：生态环境部启动2023-2024黄河流域“清废行动”，全面排查固废倾倒,东吴证券,2023-05-19,环保行业,https://data.eastmoney.com/report/zw_industry.jshtml?infocode=AP202305191586979213
环保行业点评报告：国家发展改革委、国家能源局加快推进充电基础设施建设，更好支持新能源汽车下乡,东吴证券,2023-05-19,环保行业,https://data.eastmoney.com/report/zw_industry.jshtml?infocode=AP202305191586978091
2023年4月电量数据跟踪：经济复苏拉动三产用电修复，风光发电增速分化,湘财证券,2023-05-18,环保行业,https://data.eastmoney.com/report/zw_industry.jshtml?infocode=AP202305181586743278
环保行业点评报告：《赣州市城乡建设领域碳达峰实施方案》印发，推进生活垃圾污水治理低碳化,东吴证券,2023-05-18,环保行业,https://data.eastmoney.com/report/zw_industry.jshtml?infocode=AP202305181586741163
环保行业跟踪周报：“一带一路”绿色发展圆桌会成功召开，持续推荐水务固废价值重估+半导体治理,东吴证券,2023-05-16,环保行业,https://data.eastmoney.com/report/zw_industry.jshtml?infocode=AP202305161586682696
环保公用行业：多省发布碳达峰实施方案，能源转型持续推进,中国银河,2023-05-15,环保行业,https://data.eastmoney.com/report/zw_industry.jshtml?infocode=AP202305151586638036
环保、公用事业行业周报：煤炭价格有望继续下行，关注基本面持续修复的火电,华西证券,2023-05-15,环保行业,https://data.eastmoney.com/report/zw_industry.jshtml?infocode=AP202305151586633899
低碳研究行业周报：煤价下行+迎峰度夏，持续推荐火电板块,华福证券,2023-05-15,环保行业,https://data.eastmoney.com/report/zw_industry.jshtml?infocode=AP202305151586633337
环保行业研究周报：托底处置 区域联动 推进危废整合,申港证券,2023-05-15,环保行业,https://data.eastmoney.com/report/zw_industry.jshtml?infocode=AP202305151586632360
环保行业周报：推进城市黑臭水体治理及生活污水处理提质增效,东莞证券,2023-05-15,环保行业,https://data.eastmoney.com/report/zw_industry.jshtml?infocode=AP202305151586625005
环保与公用事业周报：做好抽水蓄能规划建设，大力提升产业链支撑能力,德邦证券,2023-05-15,环保行业,https://data.eastmoney.com/report/zw_industry.jshtml?infocode=AP202305151586624991
环保&专精特新周报：第三次海洋污染基线调研工作开启,国海证券,2023-05-15,环保行业,https://data.eastmoney.com/report/zw_industry.jshtml?infocode=AP202305141586624310
环保行业深度报告：中特估专题1：低估值+高股息+现金流改善，一带一路助力，水务固废资产价值重估,东吴证券,2023-05-14,环保行业,https://data.eastmoney.com/report/zw_industry.jshtml?infocode=AP202305141586621446
环保行业2022年年报及2023年一季报业绩综述：业绩承压不及预期，静待复苏机会,东莞证券,2023-05-12,环保行业,https://data.eastmoney.com/report/zw_industry.jshtml?infocode=AP202305121586534983
环保行业板块2022年年报及2023年一季报总结：至暗时刻已过，环保产业迎来壮大新机遇,德邦证券,2023-05-11,环保行业,https://data.eastmoney.com/report/zw_industry.jshtml?infocode=AP202305111586486729
环保及公用事业行业月报：双碳标准体系建设指南发布，环境监测需求或将释放,湘财证券,2023-05-10,环保行业,https://data.eastmoney.com/report/zw_industry.jshtml?infocode=AP202305101586441963
环保行业点评报告：《危险废物重大工程建设总体实施方案》印发，加强危废处理技术&基础设施支撑,东吴证券,2023-05-10,环保行业,https://data.eastmoney.com/report/zw_industry.jshtml?infocode=AP202305101586438793
环保行业动态报告：多因素致业绩承压，关注细分领域机会,中国银河,2023-05-10,环保行业,https://data.eastmoney.com/report/zw_industry.jshtml?infocode=AP202305101586437029
环保行业跟踪周报：低估值+高股息+现金流发力，一带一路助力，优质环保资产价值重估,东吴证券,2023-05-10,环保行业,https://data.eastmoney.com/report/zw_industry.jshtml?infocode=AP202305091586422118
环卫系列之玉禾田2022年年报&2023年一季报点评：聚焦主业提升经营效益，高质投资延长价值链条,天风证券,2023-05-08,环保行业,https://data.eastmoney.com/report/zw_industry.jshtml?infocode=AP202305081586354928
环卫系列之侨银股份22年报、23一季报与定增方案点评：业绩增长有力，全域综合治理模式可期,天风证券,2023-05-08,环保行业,https://data.eastmoney.com/report/zw_industry.jshtml?infocode=AP202305081586354913
环保行业周报：提升生态碳汇能力，建立生态系统碳汇计量体系,东莞证券,2023-05-08,环保行业,https://data.eastmoney.com/report/zw_industry.jshtml?infocode=AP202305081586352498
低碳研究行业周报：现货市场负电价频现，关注新能源消纳,华福证券,2023-05-08,环保行业,https://data.eastmoney.com/report/zw_industry.jshtml?infocode=AP202305081586348588
双碳环保日报：川渝联合印发征集工业领域低碳技术&装备&产品的通知，聚焦节能节水等领域,东吴证券,2023-05-06,环保行业,https://data.eastmoney.com/report/zw_industry.jshtml?infocode=AP202305061586318672
环保行业2022年年报及2023年一季报业绩综述：水务、设备稳步增长，固废、烟气有望走出低谷,民生证券,2023-05-05,环保行业,https://data.eastmoney.com/report/zw_industry.jshtml?infocode=AP202305051586290038
环保行业研究周报：“十四五”海绵城市全域推进,申港证券,2023-05-05,环保行业,https://data.eastmoney.com/report/zw_industry.jshtml?infocode=AP202305051586290032
双碳环保日报：山西省印发《山西省有色金属行业转型升级2023年行动计划》，推动绿色低碳转型,东吴证券,2023-05-05,环保行业,https://data.eastmoney.com/report/zw_industry.jshtml?infocode=AP202305051586276901
环保行业专题研究：公用环保—四月可转债报告,天风证券,2023-05-05,环保行业,https://data.eastmoney.com/report/zw_industry.jshtml?infocode=AP202305041586267276
低碳研究行业周报：碳关税正式立法，绿电绿氢潜力可期,华福证券,2023-05-04,环保行业,https://data.eastmoney.com/report/zw_industry.jshtml?infocode=AP202305041586267961
环保公用行业行业动态报告：欧盟理事会通过碳边境调节机制，或将加速国内减排降碳进度,中国银河,2023-05-04,环保行业,https://data.eastmoney.com/report/zw_industry.jshtml?infocode=AP202305041586267284
环保&专精特新周报：“十四五”第三批海绵城市建设示范工作推进,国海证券,2023-05-04,环保行业,https://data.eastmoney.com/report/zw_industry.jshtml?infocode=AP202305031586217990
环保行业跟踪周报：财政部推进第三批海绵城市建设，政策红利凸显,东吴证券,2023-05-03,环保行业,https://data.eastmoney.com/report/zw_industry.jshtml?infocode=AP202305031586223690
环保行业框架分析,华安证券,2023-04-28,环保行业,https://data.eastmoney.com/report/zw_industry.jshtml?infocode=AP202304271585998652
环保行业点评报告：工信部发布《建材工业鼓励推广应用的技术和产品目录（2023年本）》,东吴证券,2023-04-27,环保行业,https://data.eastmoney.com/report/zw_industry.jshtml?infocode=AP202304271585971661
环保行业点评报告：财政部：关于修改《节能减排补助资金管理暂行办法》的通知,东吴证券,2023-04-27,环保行业,https://data.eastmoney.com/report/zw_industry.jshtml?infocode=AP202304271585959205
环保行业点评报告：广东省发布2023年推动落后产能退出工作方案,东吴证券,2023-04-27,环保行业,https://data.eastmoney.com/report/zw_industry.jshtml?infocode=AP202304271585941171
环保行业跟踪周报：工信部开展工业节能监察工作严格能效约束，持续推荐环保三大成长主线标题,东吴证券,2023-04-24,环保行业,https://data.eastmoney.com/report/zw_industry.jshtml?infocode=AP202304241585760134
环保公用行业：四川省发布电力需求侧市场化响应实施方案，有望充分调动需求侧灵活负荷资源,中国银河,2023-04-24,环保行业,https://data.eastmoney.com/report/zw_industry.jshtml?infocode=AP202304241585733321
环保行业研究周报：碳关税提升碳市场建设紧迫性,申港证券,2023-04-24,环保行业,https://data.eastmoney.com/report/zw_industry.jshtml?infocode=AP202304241585732006
环保与公用事业周报：开展重点行业能效专项监察工作，实现节能监察全覆盖,德邦证券,2023-04-24,环保行业,https://data.eastmoney.com/report/zw_industry.jshtml?infocode=AP202304241585731688
环保行业周报：国家低碳城市试点开展全面评估,东莞证券,2023-04-24,环保行业,https://data.eastmoney.com/report/zw_industry.jshtml?infocode=AP202304241585729543
低碳研究行业周报：管道输氢加速推进，期待“西氢东送”长距离输氢,华福证券,2023-04-23,环保行业,https://data.eastmoney.com/report/zw_industry.jshtml?infocode=AP202304231585727059
环保行业点评报告：广东省发文进一步强化臭氧污染防治，持续推荐环保三大成长主线,东吴证券,2023-04-23,环保行业,https://data.eastmoney.com/report/zw_industry.jshtml?infocode=AP202304231585716983
环保行业点评报告：山东省生态环境厅发布橡胶制品业污染防治技术指南，持续推荐环保三大成长主线,东吴证券,2023-04-21,环保行业,https://data.eastmoney.com/report/zw_industry.jshtml?infocode=AP202304211585677402
环保行业月报：2023M1-3环卫新能源销量同增27%，渗透率同比提升2.01pct至6.84%,东吴证券,2023-04-21,环保行业,https://data.eastmoney.com/report/zw_industry.jshtml?infocode=AP202304211585674058
环保及公用事业行业点评：2023年3月电量数据跟踪-经济复苏推动用电增长，电力生产整体加快,湘财证券,2023-04-21,环保行业,https://data.eastmoney.com/report/zw_industry.jshtml?infocode=AP202304211585672026
环保行业点评报告：浙江省发布排污权有偿使用和交易管理办法，持续推荐环保三大成长主线,东吴证券,2023-04-20,环保行业,https://data.eastmoney.com/report/zw_industry.jshtml?infocode=AP202304201585599630
环保行业跟踪周报：国家能源局积极推动能源消费侧转型，持续推荐环保三大成长主线,东吴证券,2023-04-19,环保行业,https://data.eastmoney.com/report/zw_industry.jshtml?infocode=AP202304191585583504
低碳研究行业点评：欧盟碳关税靴子落地，加速提振绿电绿氢消费,华福证券,2023-04-19,环保行业,https://data.eastmoney.com/report/zw_industry.jshtml?infocode=AP202304191585579865
环保行业点评报告：河南省发布新能源和可再生能源发展“十四五”规划,东吴证券,2023-04-19,环保行业,https://data.eastmoney.com/report/zw_industry.jshtml?infocode=AP202304191585558090
环保行业点评报告：工信部、发改委、生态环境部共同发布关于推动铸造和锻压行业高质量发展的指导意见,东吴证券,2023-04-18,环保行业,https://data.eastmoney.com/report/zw_industry.jshtml?infocode=AP202304181585529603
环保行业跟踪周报：锂价&折扣系数下行再生盈利企稳，双碳政策下再生材料重要性提升，回收渠道推进,东吴证券,2023-04-17,环保行业,https://data.eastmoney.com/report/zw_industry.jshtml?infocode=AP202304171585518422
环保行业研究周报：南美干旱产生大量生柴缺口待补,申港证券,2023-04-17,环保行业,https://data.eastmoney.com/report/zw_industry.jshtml?infocode=AP202304171585494039
公用环保行业202304第3期：《2023年能源工作指导意见》发布，光热发电行业梳理,国信证券,2023-04-17,环保行业,https://data.eastmoney.com/report/zw_industry.jshtml?infocode=AP202304171585492735
环保行业深度报告：半导体配套治理：刚需&高壁垒铸就价值，设备国产替代&耗材突破高端制程！,东吴证券,2023-04-17,环保行业,https://data.eastmoney.com/report/zw_industry.jshtml?infocode=AP202304171585491522
环保与公用事业周报：深入推进能源结构转型，绿氢行业发展有望加速,德邦证券,2023-04-17,环保行业,https://data.eastmoney.com/report/zw_industry.jshtml?infocode=AP202304171585491495
环保行业周报：环境监测与再生生物柴油未来可期,东莞证券,2023-04-17,环保行业,https://data.eastmoney.com/report/zw_industry.jshtml?infocode=AP202304171585490719
环保及公用事业行业周报：《2023年能源工作指导意见》发布，能源保供稳价与数字化转型势在必行,安信证券,2023-04-16,环保行业,https://data.eastmoney.com/report/zw_industry.jshtml?infocode=AP202304161585488388
双碳环保日报：生态环境部原则通过《全国生态质量监督监测工作方案》 ，推进生态环境监测发展,东吴证券,2023-04-16,环保行业,https://data.eastmoney.com/report/zw_industry.jshtml?infocode=AP202304161585488287
环保公用行业行业动态报告：《2023年能源工作指导意见发布》 ，能源结构转型持续推进,中国银河,2023-04-16,环保行业,https://data.eastmoney.com/report/zw_industry.jshtml?infocode=AP202304161585486888
双碳环保日报：国家能源局印发《2023年能源工作指导意见》，积极推进清洁低碳转型,东吴证券,2023-04-14,环保行业,https://data.eastmoney.com/report/zw_industry.jshtml?infocode=AP202304141585444894
双碳环保日报：《湖北省新污染物治理工作方案》发布，加强新污染物治理能力,东吴证券,2023-04-12,环保行业,https://data.eastmoney.com/report/zw_industry.jshtml?infocode=AP202304121585388211
环保行业月报：中特估推动环保国企价值重估，CCER方法学公开征集重启渐行渐近,东吴证券,2023-04-12,环保行业,https://data.eastmoney.com/report/zw_industry.jshtml?infocode=AP202304121585378546
双碳环保日报：《杭州市工业企业重点环保设施运行安全专项整治实施方案》发布，排查环保设施风险,东吴证券,2023-04-12,环保行业,https://data.eastmoney.com/report/zw_industry.jshtml?infocode=AP202304121585346344
双碳环保日报：福建省发布城乡建设领域碳达峰实施方案，持续推进绿色低碳发展,东吴证券,2023-04-11,环保行业,https://data.eastmoney.com/report/zw_industry.jshtml?infocode=AP202304101585266164
环保行业跟踪周报：中法联合声明关注碳中和，加快能源和气候转型，多省聚焦空气污染与臭氧防治,东吴证券,2023-04-10,环保行业,https://data.eastmoney.com/report/zw_industry.jshtml?infocode=AP202304101585258011
环保行业研究周报：关注额外性对CCER定位的明确,申港证券,2023-04-10,环保行业,https://data.eastmoney.com/report/zw_industry.jshtml?infocode=AP202304101585250357
