研报名称,机构名称,发布时间,行业,研报地址
房地产行业周报（2023年第21周）：销售温和波动复苏，城市表现持续分化,财通证券,2023-05-28,房地产开发,https://data.eastmoney.com/report/zw_industry.jshtml?infocode=AP202305281587323944
房地产行业第21周周报：新房微降二手房微升，市场整体保持平稳,信达证券,2023-05-28,房地产开发,https://data.eastmoney.com/report/zw_industry.jshtml?infocode=AP202305281587323364
房地产行业5月：销售弱复苏,国联证券,2023-05-26,房地产开发,https://data.eastmoney.com/report/zw_industry.jshtml?infocode=AP202305261587298885
房地产行业4月公司月报：房企销售与拿地均价进一步提升，高均价房企市场优势明显,东兴证券,2023-05-26,房地产开发,https://data.eastmoney.com/report/zw_industry.jshtml?infocode=AP202305261587289893
房地产行业4月月报：高低能级区域销售分化明显，竣工大幅度改善但新开工和投资持续下行,东兴证券,2023-05-24,房地产开发,https://data.eastmoney.com/report/zw_industry.jshtml?infocode=AP202305241587147371
