研报名称,机构名称,发布时间,行业,研报地址
医药生物行业+公司首次覆盖：多重因素推动流感疫苗渗透率提升，存量厂商具备较强先发优势,东吴证券,2023-05-21,医药商业,https://data.eastmoney.com/report/zw_industry.jshtml?infocode=AP202305211587035769
合成生物学周报：两部门联合发文鼓励减少使用一次性塑料制品，生物丙烯商业化未来可期,华安证券,2023-05-21,医药商业,https://data.eastmoney.com/report/zw_industry.jshtml?infocode=AP202305211587035623
医药生物行业跟踪周报：中药龙头太极集团创新高后，还有哪些标的有望陆续新高？,东吴证券,2023-05-21,医药商业,https://data.eastmoney.com/report/zw_industry.jshtml?infocode=AP202305211587034896
医药生物行业05月周报：关注ASCO会议摘要披露和门诊手术恢复,国联证券,2023-05-21,医药商业,https://data.eastmoney.com/report/zw_industry.jshtml?infocode=AP202305201587030925
疫苗板块2022+2023Q1总结：压制因素出清，23Q2-Q3景气有望迎来上行,中泰证券,2023-05-19,医药商业,https://data.eastmoney.com/report/zw_industry.jshtml?infocode=AP202305191586956987
中药Ⅱ行业深度报告：中药国企改革渐入佳境，有望迎来估值重塑,开源证券,2023-05-19,医药商业,https://data.eastmoney.com/report/zw_industry.jshtml?infocode=AP202305191586952058
医药生物行业制药装备板块2022+2023Q1总结：合同负债保持高位，看好全年订单恢复,中泰证券,2023-05-18,医药商业,https://data.eastmoney.com/report/zw_industry.jshtml?infocode=AP202305181586744380
医药生物行业上市公司2022年年报及2023年一季报总结,东亚前海证券,2023-05-18,医药商业,https://data.eastmoney.com/report/zw_industry.jshtml?infocode=AP202305181586742372
一次性手套行业深度报告：供需关系拐点临近，即将迎来盈利能力提升周期,首创证券,2023-05-17,医药商业,https://data.eastmoney.com/report/zw_industry.jshtml?infocode=AP202305171586718895
医药生物投融资周报：Syneos被收购，泰楚生物获融,浙商证券,2023-05-16,医药商业,https://data.eastmoney.com/report/zw_industry.jshtml?infocode=AP202305161586684791
药店板块2022&2023Q1总结：盈利回升，整合分化加速,中泰证券,2023-05-16,医药商业,https://data.eastmoney.com/report/zw_industry.jshtml?infocode=AP202305161586678988
医药生物行业周报：乘国企改革东风，关注“中特估”相关投资标的,爱建证券,2023-05-16,医药商业,https://data.eastmoney.com/report/zw_industry.jshtml?infocode=AP202305161586675300
医药行业周报：国企改革仍为主线之一，天津为医药国改标杆,德邦证券,2023-05-16,医药商业,https://data.eastmoney.com/report/zw_industry.jshtml?infocode=AP202305161586669819
医药生物行业周报：北京市DRG和带量采购政策联动方案出台,东莞证券,2023-05-15,医药商业,https://data.eastmoney.com/report/zw_industry.jshtml?infocode=AP202305151586632287
医药行业2023年5月投资月报：业绩分化，看好医药后市行情,西南证券,2023-05-15,医药商业,https://data.eastmoney.com/report/zw_industry.jshtml?infocode=AP202305151586625257
医药生物行业：GSK公司RSV疫苗获批，有望成为重磅品种,国融证券,2023-05-15,医药商业,https://data.eastmoney.com/report/zw_industry.jshtml?infocode=AP202305151586625068
医药生物行业双周报：创新为行业长期发展主线，相关产业链机会值得关注,东方证券,2023-05-15,医药商业,https://data.eastmoney.com/report/zw_industry.jshtml?infocode=AP202305151586624997
医药生物行业跟踪周报：Q2全面看多院内严肃医疗复苏，重点推荐处方药及器械等,东吴证券,2023-05-15,医药商业,https://data.eastmoney.com/report/zw_industry.jshtml?infocode=AP202305141586624297
新药周观点：亿帆医药艾贝格司亭α获批上市，为患者带来更多差异化选择,安信证券,2023-05-14,医药商业,https://data.eastmoney.com/report/zw_industry.jshtml?infocode=AP202305141586621870
医药生物行业5月周报：关注医疗复苏与政策利好带来的中长期机会,国联证券,2023-05-14,医药商业,https://data.eastmoney.com/report/zw_industry.jshtml?infocode=AP202305131586610335
医药生物行业月度报告：整体业绩增速放缓，关注边际改善方向,财信证券,2023-05-12,医药商业,https://data.eastmoney.com/report/zw_industry.jshtml?infocode=AP202305121586527961
2023年中国银屑病药物行业词条报告,头豹研究院,2023-05-11,医药商业,https://data.eastmoney.com/report/zw_industry.jshtml?infocode=AP202305111586499999
医药行业2022年报&2023年一季报点评：估值低位，板块分化，看好中药、创新药、医疗器械领域,源达信息,2023-05-11,医药商业,https://data.eastmoney.com/report/zw_industry.jshtml?infocode=AP202305111586496828
2023年零售药店行业专题报告：边际拐点已现，长期价值不变,头豹研究院,2023-05-10,医药商业,https://data.eastmoney.com/report/zw_industry.jshtml?infocode=AP202305101586455469
医药生物行业2023年5月投资策略：行业表现分化，寻找细分板块中的优质公司,国信证券,2023-05-09,医药商业,https://data.eastmoney.com/report/zw_industry.jshtml?infocode=AP202305091586405033
医药生物行业周报：2023Q1医疗设备增长恢复较快，关注疫后复苏,爱建证券,2023-05-09,医药商业,https://data.eastmoney.com/report/zw_industry.jshtml?infocode=AP202305091586393948
医药行业周报：“中西结合”+“中特估”为当前医药投资关键词,德邦证券,2023-05-09,医药商业,https://data.eastmoney.com/report/zw_industry.jshtml?infocode=AP202305091586393113
医药生物板块2022年年报&2023年一季报综述：后疫情时代部分细分板块存在业绩修复机会，整体板块增长与估值扩张需要新的增长动力,中银证券,2023-05-09,医药商业,https://data.eastmoney.com/report/zw_industry.jshtml?infocode=AP202305091586393054
医药生物行业周报：2022及23Q1业绩受疫情扰动，2023静候复苏,平安证券,2023-05-09,医药商业,https://data.eastmoney.com/report/zw_industry.jshtml?infocode=AP202305091586392495
医药生物2022年年报及2023年一季报总结：医疗服务：Q1复苏强劲，短期政策扰动出清，龙头将持续受益于渗透率和集中度双重提升,华福证券,2023-05-08,医药商业,https://data.eastmoney.com/report/zw_industry.jshtml?infocode=AP202305081586373756
医药生物行业周报：复苏进入关键验证期，继续把握复苏+创新双主线,中泰证券,2023-05-08,医药商业,https://data.eastmoney.com/report/zw_industry.jshtml?infocode=AP202305081586355014
医药生物2022年报和2023一季报综述：医药板块底部已现，结构性行情可期,中邮证券,2023-05-08,医药商业,https://data.eastmoney.com/report/zw_industry.jshtml?infocode=AP202305081586353108
CXO 2022&2023Q1总结：竞争优势明显，看好触底,浙商证券,2023-05-08,医药商业,https://data.eastmoney.com/report/zw_industry.jshtml?infocode=AP202305081586348704
医药健康行业研究：技术升级赋能行业应用，AI+医药健康发展有望提速,国金证券,2023-05-08,医药商业,https://data.eastmoney.com/report/zw_industry.jshtml?infocode=AP202305081586348540
医药生物行业跟踪周报：二季度医药战略性配置四大方向，创新中药、品牌中药位居首位,东吴证券,2023-05-07,医药商业,https://data.eastmoney.com/report/zw_industry.jshtml?infocode=AP202305061586343426
医药生物行业周报：业绩驱动告一段落，进入主题和概念催化时期,华安证券,2023-05-06,医药商业,https://data.eastmoney.com/report/zw_industry.jshtml?infocode=AP202305051586314181
2022年中国生物工艺解决方案行业概览：多宁生物、乐纯生物、奥浦迈——攻克多项“卡脖子技术”（摘要版）,头豹研究院,2023-05-05,医药商业,https://data.eastmoney.com/report/zw_industry.jshtml?infocode=AP202305051586312305
医药生物行业2022年年报及2023年一季报总结：业绩逐步走出疫情扰动，看好行业持续反弹机会,上海证券,2023-05-05,医药商业,https://data.eastmoney.com/report/zw_industry.jshtml?infocode=AP202305051586289986
医药行业连锁药店2022年报及2023一季报总结：人效租效提升，收益质量好转,浙商证券,2023-05-05,医药商业,https://data.eastmoney.com/report/zw_industry.jshtml?infocode=AP202305051586285657
医药生物2022年报、2023年一季报跟踪总结：创新破局,浙商证券,2023-05-04,医药商业,https://data.eastmoney.com/report/zw_industry.jshtml?infocode=AP202305041586268106
原料药及仿制药2022&2023Q1总结：上游降本，下游提效,浙商证券,2023-05-04,医药商业,https://data.eastmoney.com/report/zw_industry.jshtml?infocode=AP202305041586268045
医药行业2023年5月月报：看好中药、创新、复苏,浙商证券,2023-05-04,医药商业,https://data.eastmoney.com/report/zw_industry.jshtml?infocode=AP202305041586267936
医药生物周报（23年第17周）：年报及一季报“成绩单”已出，关注疫情后复苏,国信证券,2023-05-04,医药商业,https://data.eastmoney.com/report/zw_industry.jshtml?infocode=AP202305041586267240
医药行业2022年及23Q1总结报告：百业待兴，看好疫后复苏和创新产业链两大主线,东吴证券,2023-05-04,医药商业,https://data.eastmoney.com/report/zw_industry.jshtml?infocode=AP202305031586217010
医药行业2023Q1持仓分析：23Q1医药持仓稳定,西南证券,2023-04-27,医药商业,https://data.eastmoney.com/report/zw_industry.jshtml?infocode=AP202304271585930883
医药生物周观点：创新药和中药，两手抓两手都要硬,天风证券,2023-04-27,医药商业,https://data.eastmoney.com/report/zw_industry.jshtml?infocode=AP202304271585929560
医药生物行业周报：新冠关注再起，复苏进入验证关键期,中泰证券,2023-04-25,医药商业,https://data.eastmoney.com/report/zw_industry.jshtml?infocode=AP202304251585785499
2023年中国RNAi行业词条报告,头豹研究院,2023-04-24,医药商业,https://data.eastmoney.com/report/zw_industry.jshtml?infocode=AP202304241585763652
医药生物周跟踪：中药：政策支撑，营运提升,浙商证券,2023-04-23,医药商业,https://data.eastmoney.com/report/zw_industry.jshtml?infocode=AP202304231585718758
连锁药店行业深度报告：连锁化，多元化，处方外流加速,东海证券,2023-04-19,医药商业,https://data.eastmoney.com/report/zw_industry.jshtml?infocode=AP202304191585588673
