研报名称,机构名称,发布时间,行业,研报地址
电力设备及新能源行业周报：电网投资持续高增，发改委再出重磅政策支持电改和储能发展提速,华福证券,2023-05-29,电池,https://data.eastmoney.com/report/zw_industry.jshtml?infocode=AP202305291587328890
锂电产业链周评（5月第4周）：电池企业加快储能产品布局，锂盐报价略有回调,国信证券,2023-05-29,电池,https://data.eastmoney.com/report/zw_industry.jshtml?infocode=AP202305291587328879
氢能&燃料电池行业研究：从海外公司年报看氢能行业系列（八）：Enapter,国金证券,2023-05-29,电池,https://data.eastmoney.com/report/zw_industry.jshtml?infocode=AP202305291587328584
电力设备及新能源行业周报：SNEC上新技术、新产品精彩亮相；宁德时代发布全球首个零辅源光储融合解决方案,华金证券,2023-05-29,电池,https://data.eastmoney.com/report/zw_industry.jshtml?infocode=AP202305291587324869
电力设备与新能源行业周观察：锂电竞争力持续增强，光储新兴市场创造增量,华西证券,2023-05-29,电池,https://data.eastmoney.com/report/zw_industry.jshtml?infocode=AP202305281587324541
