研报名称,机构名称,发布时间,行业,研报地址
电力设备与新能源行业6月周报：硅料价格接近历史底部，CCER重启助力碳市场扩容,国联证券,2023-07-02,电源设备,https://data.eastmoney.com/report/zw_industry.jshtml?infocode=AP202307011591984295
电力设备行业投资策略报告：利空出尽，否极泰来,万联证券,2023-06-30,电源设备,https://data.eastmoney.com/report/zw_industry.jshtml?infocode=AP202306301591954122
电力设备与新能源行业研究：虚拟电厂系列专题（一）：迎峰度夏！开启千亿蓝海市场,国金证券,2023-06-30,电源设备,https://data.eastmoney.com/report/zw_industry.jshtml?infocode=AP202306301591917219
电力设备：上游价格接近触底，关注TOPCon、辅材和分布式,上海证券,2023-06-27,电源设备,https://data.eastmoney.com/report/zw_industry.jshtml?infocode=AP202306271591732815
电力设备行业深度报告：新型储能方兴未艾，工商+大储如日方升,东海证券,2023-06-27,电源设备,https://data.eastmoney.com/report/zw_industry.jshtml?infocode=AP202306271591720628
电力设备与新能源行业周报：5月光伏装机高增，N型趋势进一步确认,上海证券,2023-06-27,电源设备,https://data.eastmoney.com/report/zw_industry.jshtml?infocode=AP202306271591706581
电力设备行业周报：海博思创冲关科创板，光伏上游价格接近触底,华鑫证券,2023-06-26,电源设备,https://data.eastmoney.com/report/zw_industry.jshtml?infocode=AP202306261591295195
电力设备及新能源行业周报：异质结组件订单频签订，海外风机巨头产品质量隐患显现,平安证券,2023-06-26,电源设备,https://data.eastmoney.com/report/zw_industry.jshtml?infocode=AP202306261591291780
电力设备新能源周报（第44期）：政策助推行业边际向好，重视新技术,太平洋,2023-06-26,电源设备,https://data.eastmoney.com/report/zw_industry.jshtml?infocode=AP202306261591287520
电力设备行业研究周报：构建高质量充电基础设施体系 利好大功率快充,申港证券,2023-06-26,电源设备,https://data.eastmoney.com/report/zw_industry.jshtml?infocode=AP202306261591286242
电力设备新能源行业周报（第25周）：新能车购置税减免细则出台，光伏上游价格底部区间已现,浙商证券,2023-06-26,电源设备,https://data.eastmoney.com/report/zw_industry.jshtml?infocode=AP202306261591286239
电气设备行业周报：机器人“政策利好+龙头催化”，国内核心零部件环节机遇频频,德邦证券,2023-06-26,电源设备,https://data.eastmoney.com/report/zw_industry.jshtml?infocode=AP202306261591286194
电力设备及新能源行业周报：新能源购置税延期超预期，持续看好人形机器人对工控催化,华福证券,2023-06-26,电源设备,https://data.eastmoney.com/report/zw_industry.jshtml?infocode=AP202306261591286174
电力设备与新能源行业研究：光伏Q3淡季不淡，氢能开启预期兑现，海风招标全面重启,国金证券,2023-06-26,电源设备,https://data.eastmoney.com/report/zw_industry.jshtml?infocode=AP202306261591286072
电力设备及新能源行业：新能源车购置税补贴延期力度超预期，结构优化下利好行业,华福证券,2023-06-26,电源设备,https://data.eastmoney.com/report/zw_industry.jshtml?infocode=AP202306261591285549
电力设备及新能源行业周报：光伏产业链价格逐步探底，1-5月风电装机量同增51.2%,东莞证券,2023-06-26,电源设备,https://data.eastmoney.com/report/zw_industry.jshtml?infocode=AP202306261591285449
电气设备：人形机器人：AI赋能下空间可期，看好特斯拉供应链,天风证券,2023-06-26,电源设备,https://data.eastmoney.com/report/zw_industry.jshtml?infocode=AP202306261591285115
电力设备与新能源：风光装机跟踪：5月装机继续高增，下半年潜力空间可期,国联证券,2023-06-26,电源设备,https://data.eastmoney.com/report/zw_industry.jshtml?infocode=AP202306251591284663
电力设备行业跟踪周报：新能源汽车购置税超预期、机器人产业潜力巨大,东吴证券,2023-06-26,电源设备,https://data.eastmoney.com/report/zw_industry.jshtml?infocode=AP202306251591284330
电力设备与新能源行业6月第4周周报：新能源车购置税减免延续至2027年,中银证券,2023-06-26,电源设备,https://data.eastmoney.com/report/zw_industry.jshtml?infocode=AP202306251591281872
"电力设备行业周报：购置税政策利好产业链修复，迎峰度夏看好虚拟电厂_陈晓,牛义杰",华安证券,2023-06-25,电源设备,https://data.eastmoney.com/report/zw_industry.jshtml?infocode=AP202306251591284412
电力设备行业专题研究：特斯拉·前瞻：为何入局Robotaxi？盈利模式如何？,天风证券,2023-06-24,电源设备,https://data.eastmoney.com/report/zw_industry.jshtml?infocode=AP202306241591274958
氢能系列报告（三）液氢篇：氢能市场放量增长，液氢有望率先受益,华安证券,2023-06-21,电源设备,https://data.eastmoney.com/report/zw_industry.jshtml?infocode=AP202306211591205238
电力设备及新能源：充电桩政策再加码，板块景气度有望持续,华金证券,2023-06-20,电源设备,https://data.eastmoney.com/report/zw_industry.jshtml?infocode=AP202306201591099059
新能源周报（第43期）：重视终端创新，降价带来需求正反馈,太平洋,2023-06-20,电源设备,https://data.eastmoney.com/report/zw_industry.jshtml?infocode=AP202306201591089196
电力设备与新能源行业周报：硅料价格跌幅扩大，看好光伏需求反弹,上海证券,2023-06-20,电源设备,https://data.eastmoney.com/report/zw_industry.jshtml?infocode=AP202306201591082213
加氢站 头豹词条报告系列,头豹研究院,2023-06-19,电源设备,https://data.eastmoney.com/report/zw_industry.jshtml?infocode=AP202306191591075478
电力设备行业周报：硅料价格持续下探，充电桩政策有望进一步加码,华鑫证券,2023-06-19,电源设备,https://data.eastmoney.com/report/zw_industry.jshtml?infocode=AP202306191591073715
电力设备与新能源行业周报：硅料价格触底实质性驱动板块预期及情绪全面修复,国金证券,2023-06-19,电源设备,https://data.eastmoney.com/report/zw_industry.jshtml?infocode=AP202306191591062090
电力设备及新能源周报：汽车下乡促消费，海风发展加速度,民生证券,2023-06-19,电源设备,https://data.eastmoney.com/report/zw_industry.jshtml?infocode=AP202306191591062031
电力设备及新能源行业周报：光伏博弈趋弱，海风利好不断,华福证券,2023-06-19,电源设备,https://data.eastmoney.com/report/zw_industry.jshtml?infocode=AP202306191591058632
电力设备新能源行业新老交替迭代成长：百炼成钢，去伪存真,浙商证券,2023-06-19,电源设备,https://data.eastmoney.com/report/zw_industry.jshtml?infocode=AP202306191591056976
储能产业链周评（6月第3周）：海外储能补贴方案频出，国内开启储能试点示范项目申报,国信证券,2023-06-19,电源设备,https://data.eastmoney.com/report/zw_industry.jshtml?infocode=AP202306191591056888
电力设备及新能源行业周报：江苏大丰800MW海风项目招标启动，广东多地开启海风项目竞配,东莞证券,2023-06-19,电源设备,https://data.eastmoney.com/report/zw_industry.jshtml?infocode=AP202306191591056844
电力设备行业跟踪周报：内外部环境改善，锂电、光伏、工控机器人均受益,东吴证券,2023-06-19,电源设备,https://data.eastmoney.com/report/zw_industry.jshtml?infocode=AP202306191591056605
电力设备与新能源行业6月第3周周报：光伏产业链持续降价，欧洲天然气期货价格大涨,中银证券,2023-06-19,电源设备,https://data.eastmoney.com/report/zw_industry.jshtml?infocode=AP202306181591056416
电力设备与新能源行业：TOPCon专题报告：渗透率加速提升，全产业N型共振,东吴证券,2023-06-18,电源设备,https://data.eastmoney.com/report/zw_industry.jshtml?infocode=AP202306181591055293
电力设备与新能源：储能招标1-5月同比增长146%，硅料价格延续跌势,信达证券,2023-06-18,电源设备,https://data.eastmoney.com/report/zw_industry.jshtml?infocode=AP202306181591055195
电力设备与新能源行业6月周报：光伏产业链价格触底，风电招标重启景气上行,国联证券,2023-06-18,电源设备,https://data.eastmoney.com/report/zw_industry.jshtml?infocode=AP202306171591054649
电力设备及新能源：分布式光伏接网获政策力推，关注储能及配网升级改造,华金证券,2023-06-18,电源设备,https://data.eastmoney.com/report/zw_industry.jshtml?infocode=AP202306171591048082
欧洲新能源车销量点评：5月总量环比提升，销势向好,德邦证券,2023-06-16,电源设备,https://data.eastmoney.com/report/zw_industry.jshtml?infocode=AP202306161591023447
储能与电力设备周报（第2期）：广东市场加速，装机旺季将至,太平洋,2023-06-16,电源设备,https://data.eastmoney.com/report/zw_industry.jshtml?infocode=AP202306161591023444
电力设备及新能源行业2023年中期策略报告：重供给格局，掘金海风、N型电池及绿氢,平安证券,2023-06-15,电源设备,https://data.eastmoney.com/report/zw_industry.jshtml?infocode=AP202306151590958868
电新行业双周报2023年第9期总第9期：世界动力电池大会召开 动力电池行业迈入从有到好新阶段,长城国瑞证券,2023-06-14,电源设备,https://data.eastmoney.com/report/zw_industry.jshtml?infocode=AP202306141590928619
电力设备与新能源行业动态报告：政策与需求双轮驱动，充电桩建设加速,华西证券,2023-06-13,电源设备,https://data.eastmoney.com/report/zw_industry.jshtml?infocode=AP202306131590906338
储能与电力设备周报（第1期）：政策加码，重视新市场弹性,太平洋,2023-06-13,电源设备,https://data.eastmoney.com/report/zw_industry.jshtml?infocode=AP202306131590900842
电力设备与新能源行业周报：5月电动车销量同比高增，商务部组织新能源汽车促消费活动,中泰证券,2023-06-13,电源设备,https://data.eastmoney.com/report/zw_industry.jshtml?infocode=AP202306131590891349
电力设备及新能源行业周报：新型电力系统蓝皮书发布；光伏产量同比激增,华金证券,2023-06-13,电源设备,https://data.eastmoney.com/report/zw_industry.jshtml?infocode=AP202306131590885745
电力设备及新能源周报：松下全力扩大电池产能，美国组件需求旺盛,民生证券,2023-06-12,电源设备,https://data.eastmoney.com/report/zw_industry.jshtml?infocode=AP202306121590867690
电新行业周报（2023年第22期）：广东发布《促进新型储能电站发展若干措施》，工商业储能盈利能力再获增强,安信证券,2023-06-12,电源设备,https://data.eastmoney.com/report/zw_industry.jshtml?infocode=AP202306121590854125
电力设备与新能源行业周报：光伏价格加速赶底，板块底部提前确认,国金证券,2023-06-12,电源设备,https://data.eastmoney.com/report/zw_industry.jshtml?infocode=AP202306121590852652
低碳研究行业周报：迎峰度夏电力大考在即，水电如何备考,华福证券,2023-06-12,电源设备,https://data.eastmoney.com/report/zw_industry.jshtml?infocode=AP202306121590852379
电力设备及新能源行业周报：光伏产业链博弈近尾声，5月动力锂电库销比持续回落,华福证券,2023-06-12,电源设备,https://data.eastmoney.com/report/zw_industry.jshtml?infocode=AP202306121590852378
电力设备及新能源行业周报：硅料价格持续快速下行，美国发布清洁氢战略路线图,平安证券,2023-06-12,电源设备,https://data.eastmoney.com/report/zw_industry.jshtml?infocode=AP202306121590851805
光储行业2023年中期投资策略：经济性带来成长力量，光储需求锋芒显现,中银证券,2023-06-12,电源设备,https://data.eastmoney.com/report/zw_industry.jshtml?infocode=AP202306121590851789
新能源车销量和电池装机量点评：长风破浪会有时，直挂云帆济沧海,德邦证券,2023-06-12,电源设备,https://data.eastmoney.com/report/zw_industry.jshtml?infocode=AP202306121590851257
电力设备及新能源行业周报：2022年中国海上风电度电成本降至约0.33元,东莞证券,2023-06-12,电源设备,https://data.eastmoney.com/report/zw_industry.jshtml?infocode=AP202306121590851255
电力设备行业研究周报：5月动力电池装机量稳步增长,申港证券,2023-06-12,电源设备,https://data.eastmoney.com/report/zw_industry.jshtml?infocode=AP202306121590851202
电力设备新能源行业周报（第23周）：硅料价格加速见底，全面看多光伏赛道,浙商证券,2023-06-12,电源设备,https://data.eastmoney.com/report/zw_industry.jshtml?infocode=AP202306121590851179
全球能源：美国氢能路线图；2024年或成拐点年；购买美国氢气公司,海通国际,2023-06-12,电源设备,https://data.eastmoney.com/report/zw_industry.jshtml?infocode=AP202306121590850741
电新&公用：从“百家争鸣”到“三足鼎立”，技术+资源+资金提升储能系统集中度,海通国际,2023-06-12,电源设备,https://data.eastmoney.com/report/zw_industry.jshtml?infocode=AP202306121590850739
储能产业链周评（6月第2周）：海外国家级氢能规划频出，国内储能中标加速放量,国信证券,2023-06-12,电源设备,https://data.eastmoney.com/report/zw_industry.jshtml?infocode=AP202306121590850012
锂电行业周报：出口增长强劲，产业链优势显现,川财证券,2023-06-12,电源设备,https://data.eastmoney.com/report/zw_industry.jshtml?infocode=AP202306121590849942
电力设备行业跟踪周报：新能源汽车销售向好、硅料加速下跌有望刺激需求,东吴证券,2023-06-11,电源设备,https://data.eastmoney.com/report/zw_industry.jshtml?infocode=AP202306111590848640
新能源行业周报：江苏大丰800MW海风海缆采购启动，国内外5月销量超预期,中邮证券,2023-06-11,电源设备,https://data.eastmoney.com/report/zw_industry.jshtml?infocode=AP202306111590848302
新型电力系统专题（01）：虚拟电厂：用户侧能源转型的起点,民生证券,2023-06-11,电源设备,https://data.eastmoney.com/report/zw_industry.jshtml?infocode=AP202306111590848180
电力设备及新能源行业周报：1-4月光伏产品累计出口额同比增长18.9%，下游盈利持续改善,山西证券,2023-06-11,电源设备,https://data.eastmoney.com/report/zw_industry.jshtml?infocode=AP202306111590847679
电力设备与新能源行业6月周报：新能源汽车屡获政策支持，各地强配储能要求趋严,国联证券,2023-06-11,电源设备,https://data.eastmoney.com/report/zw_industry.jshtml?infocode=AP202306111590847261
电力设备与新能源行业月报（2023年5月）：光伏产业链价格快速下跌，拜登继续缓征东南亚光伏关税,东兴证券,2023-06-08,电源设备,https://data.eastmoney.com/report/zw_industry.jshtml?infocode=AP202306081590589724
氢能：有望成为21世纪的终极能源,信达证券,2023-06-08,电源设备,https://data.eastmoney.com/report/zw_industry.jshtml?infocode=AP202306081590571893
光热行业深度系列报告：自带储能的太阳能利用形式，千亿级市场加速到来,德邦证券,2023-06-07,电源设备,https://data.eastmoney.com/report/zw_industry.jshtml?infocode=AP202306071590512112
充电桩、储能上市公司周报：充电桩概念股延续涨势，储能板块小幅反弹,川财证券,2023-06-07,电源设备,https://data.eastmoney.com/report/zw_industry.jshtml?infocode=AP202306071590508538
充电桩、储能上市公司周报：充电桩、储能均小幅下跌，总体走势优于大盘,川财证券,2023-06-07,电源设备,https://data.eastmoney.com/report/zw_industry.jshtml?infocode=AP202306071590508195
电力设备与新能源行业周报：电动车销量同比高增，海风装机景气度可观,中泰证券,2023-06-06,电源设备,https://data.eastmoney.com/report/zw_industry.jshtml?infocode=AP202306061590477773
电力设备与新能源行业周报：地方性补贴持续出台，高性能电池进展顺利,上海证券,2023-06-06,电源设备,https://data.eastmoney.com/report/zw_industry.jshtml?infocode=AP202306061590465111
锂电行业2023年5月月报：销量数据回暖，出口表现抢眼,川财证券,2023-06-05,电源设备,https://data.eastmoney.com/report/zw_industry.jshtml?infocode=AP202306051590412694
电力设备与新能源行业周观察：政策延续优化，电动车+充电基础设施发展环境向好,华西证券,2023-06-05,电源设备,https://data.eastmoney.com/report/zw_industry.jshtml?infocode=AP202306051590408637
电力设备及新能源周报：印度光伏组件进口税拟减半，广东发布7+16GW海风竞配,民生证券,2023-06-05,电源设备,https://data.eastmoney.com/report/zw_industry.jshtml?infocode=AP202306051590407060
电力设备行业周报：政策按下充电桩加速键，迎来黄金发展期,华鑫证券,2023-06-05,电源设备,https://data.eastmoney.com/report/zw_industry.jshtml?infocode=AP202306051590407022
电力设备及新能源行业：短中期车购税减免有支撑，优惠刺激力度大，关注结构性优化,华福证券,2023-06-05,电源设备,https://data.eastmoney.com/report/zw_industry.jshtml?infocode=AP202306051590405851
电力设备及新能源行业周报：政策继续支持新能车和新型电力系统发展，板块底部应更乐观一些,华福证券,2023-06-05,电源设备,https://data.eastmoney.com/report/zw_industry.jshtml?infocode=AP202306051590405850
电力设备行业研究周报：新型电力系统建设加速 低碳与储能地位提升,申港证券,2023-06-05,电源设备,https://data.eastmoney.com/report/zw_industry.jshtml?infocode=AP202306051590405840
电气设备行业周报：广东省发布海风竞配方案，持续推动海风高速发展,德邦证券,2023-06-05,电源设备,https://data.eastmoney.com/report/zw_industry.jshtml?infocode=AP202306051590403641
电力设备与新能源行业研究：光伏降价促需求、助消纳，供应趋松背景下看格局变化,国金证券,2023-06-05,电源设备,https://data.eastmoney.com/report/zw_industry.jshtml?infocode=AP202306051590403610
光伏产业链周评（6月第1周）：主产业链价格持续下降，组件新签订单降价显著,国信证券,2023-06-05,电源设备,https://data.eastmoney.com/report/zw_industry.jshtml?infocode=AP202306051590402870
储能产业链周评（6月第1周）：多省下发海上风光配储政策，氢能项目中标持续放量,国信证券,2023-06-05,电源设备,https://data.eastmoney.com/report/zw_industry.jshtml?infocode=AP202306051590402868
电力设备及新能源行业周报：国常会延续和优化新能源车辆购税减免政策，产业链价格持续下行,山西证券,2023-06-05,电源设备,https://data.eastmoney.com/report/zw_industry.jshtml?infocode=AP202306051590402466
电力设备行业跟踪周报：新能源汽车购置税减免有望延续、硅料加速下跌,东吴证券,2023-06-05,电源设备,https://data.eastmoney.com/report/zw_industry.jshtml?infocode=AP202306051590401842
电力设备：国内电动车购置税减免政策有望再延续，欧洲销量持续改善,中邮证券,2023-06-05,电源设备,https://data.eastmoney.com/report/zw_industry.jshtml?infocode=AP202306041590401385
电力设备行业周报：电车购置税减免政策延续，排产回升看好板块回暖,华安证券,2023-06-05,电源设备,https://data.eastmoney.com/report/zw_industry.jshtml?infocode=AP202306041590401162
电力设备及新能源行业周报：广东海上风电加快规模化发展,东莞证券,2023-06-04,电源设备,https://data.eastmoney.com/report/zw_industry.jshtml?infocode=AP202306041590399905
电力设备新能源行业周报（第22周）：光伏需求爆发节点已至，看好中美大储需求释放,浙商证券,2023-06-04,电源设备,https://data.eastmoney.com/report/zw_industry.jshtml?infocode=AP202306041590399019
电力设备与新能源行业6月周报：新型电力系统蓝图发布，新能源车购置税减免延续,国联证券,2023-06-04,电源设备,https://data.eastmoney.com/report/zw_industry.jshtml?infocode=AP202306031590395655
2023年中国质子交换膜行业词条报告,头豹研究院,2023-06-02,电源设备,https://data.eastmoney.com/report/zw_industry.jshtml?infocode=AP202306021589557592
钙钛矿行业深度报告：钙钛矿：降本潜力较大，产业化雏形已现,信达证券,2023-06-01,电源设备,https://data.eastmoney.com/report/zw_industry.jshtml?infocode=AP202306011587481485
电力设备与新能源：需求与供给共振，全球充电桩建设加速,国联证券,2023-05-31,电源设备,https://data.eastmoney.com/report/zw_industry.jshtml?infocode=AP202305311587389963
新能源周报（第39期）：电动车上游反弹持续，重视海外市场,太平洋,2023-05-30,电源设备,https://data.eastmoney.com/report/zw_industry.jshtml?infocode=AP202305301587354226
电气设备：2023年SNEC光伏展览会观展汇报：N型技术多路线涌现，光储充一体化发展趋势显现,德邦证券,2023-05-30,电源设备,https://data.eastmoney.com/report/zw_industry.jshtml?infocode=AP202305301587347554
电力设备新能源行业周报：国内需求SNEC参展人数超预期，多项新技术备受关注,东海证券,2023-05-29,电源设备,https://data.eastmoney.com/report/zw_industry.jshtml?infocode=AP202305291587343730
电新行业双周报2023年第8期总第8期：碳酸锂价格回升 动力电池回收有望迎来发展机遇,长城国瑞证券,2023-05-29,电源设备,https://data.eastmoney.com/report/zw_industry.jshtml?infocode=AP202305291587340054
