研报名称,机构名称,发布时间,行业,研报地址
电力设备与新能源行业周报：宁德时代发布零辅源储能方案，广东海风明确建设目标,中泰证券,2023-05-29,电源设备,https://data.eastmoney.com/report/zw_industry.jshtml?infocode=AP202305291587330310
电力设备及新能源周报：多地充电桩政策积极响应，储能项目需求稳步推进,民生证券,2023-05-29,电源设备,https://data.eastmoney.com/report/zw_industry.jshtml?infocode=AP202305291587325283
电力设备行业跟踪周报：SNEC人气火爆超预期、锂电终端需求弱复苏,东吴证券,2023-05-29,电源设备,https://data.eastmoney.com/report/zw_industry.jshtml?infocode=AP202305291587324858
电力设备及新能源行业深度分析：TOPCon迎规模量产，技术红利释放,安信证券,2023-05-29,电源设备,https://data.eastmoney.com/report/zw_industry.jshtml?infocode=AP202305281587324724
电力设备与新能源行业5月周报：SNEC参会人数创新高，广东海风明确建设目标,国联证券,2023-05-28,电源设备,https://data.eastmoney.com/report/zw_industry.jshtml?infocode=AP202305271587318764
