研报名称,机构名称,发布时间,行业,研报地址
内地房地产行业周报：基数影响环比大幅回升，区域政策调整稳步推进,中达证券投资,2023-05-24,房地产服务,https://data.eastmoney.com/report/zw_industry.jshtml?infocode=AP202305241587125324
物业管理行业研究周报：看好2023年业主增值服务收入增长,申港证券,2023-05-22,房地产服务,https://data.eastmoney.com/report/zw_industry.jshtml?infocode=AP202305221587043452
物管行业2022年报综述：“狂飙”时代已落幕，分化阶段徐开启,东吴证券,2023-05-22,房地产服务,https://data.eastmoney.com/report/zw_industry.jshtml?infocode=AP202305221587043035
房地产行业数据点评：销售保持温和复苏，投资持续走弱,湘财证券,2023-05-19,房地产服务,https://data.eastmoney.com/report/zw_industry.jshtml?infocode=AP202305191586964202
房地产及物管行业周报2023年W19：中介费率政策落地，核心城市土拍亮眼,浙商证券,2023-05-16,房地产服务,https://data.eastmoney.com/report/zw_industry.jshtml?infocode=AP202305161586673350
