研报名称,机构名称,发布时间,行业,研报地址
塑料事件点评：两部委发布一次性塑料制品管理办法，关注废旧塑料回收和可降解塑料发展机遇,国海证券,2023-05-22,塑料制品,https://data.eastmoney.com/report/zw_industry.jshtml?infocode=AP202305221587059039
可降解材料行业深度报告：政策、技术、产业齐发展，可降解材料替代大势所趋,山西证券,2023-04-19,塑料制品,https://data.eastmoney.com/report/zw_industry.jshtml?infocode=AP202304191585570324
合成生物学周报：2022年国内50多家合成生物公司完成融资，生物制法异丁醇走向工业化,华安证券,2023-04-16,塑料制品,https://data.eastmoney.com/report/zw_industry.jshtml?infocode=AP202304161585486966
2022年中国PGA塑料行业概览：“限塑令”催生新材料市场发展机遇,头豹研究院,2023-02-09,塑料制品,https://data.eastmoney.com/report/zw_industry.jshtml?infocode=AP202302091582957788
食品饮料行业周报：短期低预期，白酒进入去库存阶段,东海证券,2022-10-19,塑料制品,https://data.eastmoney.com/report/zw_industry.jshtml?infocode=AP202210191579268265
