研报名称,机构名称,发布时间,行业,研报地址
黄金珠宝行业深度报告：展望黄金珠宝消费新趋势,民生证券,2023-06-07,珠宝首饰,https://data.eastmoney.com/report/zw_industry.jshtml?infocode=AP202306071590505079
珠宝行业2023年一季报综述：金银珠宝零售额同比增幅逐月扩大，部分公司23Q1业绩表现优异,万联证券,2023-05-28,珠宝首饰,https://data.eastmoney.com/report/zw_industry.jshtml?infocode=AP202305281587323649
珠宝行业2022年年报综述：量价齐升推动黄金珠宝行业规模扩大，部分个股2022年业绩增长亮眼,万联证券,2023-05-26,珠宝首饰,https://data.eastmoney.com/report/zw_industry.jshtml?infocode=AP202305261587188488
4月珠宝电商数据跟踪：4月黄金珠宝线上景气度进一步上行，部分内资品牌表现杰出,万联证券,2023-05-18,珠宝首饰,https://data.eastmoney.com/report/zw_industry.jshtml?infocode=AP202305181586736562
珠宝首饰行业：景气延续，强者恒强,信达证券,2023-05-11,珠宝首饰,https://data.eastmoney.com/report/zw_industry.jshtml?infocode=AP202305111586504600
黄金珠宝板块2022年年报及2023年一季报综述：三重利好共振，推动珠宝板块业绩高增,德邦证券,2023-05-05,珠宝首饰,https://data.eastmoney.com/report/zw_industry.jshtml?infocode=AP202305051586297590
3月珠宝电商数据跟踪：3月黄金珠宝线上数据表现分化，淘系平台涨幅喜人,万联证券,2023-04-20,珠宝首饰,https://data.eastmoney.com/report/zw_industry.jshtml?infocode=AP202304201585601860
珠宝首饰：从量价角度解读3月社零数据：市场仍需逐步修复，关注龙头强者恒强,信达证券,2023-04-18,珠宝首饰,https://data.eastmoney.com/report/zw_industry.jshtml?infocode=AP202304181585548433
黄金珠宝行业点评：金价走强与产品力提升共振，黄金珠宝消费需求持续向好,国信证券,2023-03-22,珠宝首饰,https://data.eastmoney.com/report/zw_industry.jshtml?infocode=AP202303221584476865
饰品行业点评报告：下游消费韧性，2月印度培育钻裸钻出口环比+31%,财通证券,2023-03-13,珠宝首饰,https://data.eastmoney.com/report/zw_industry.jshtml?infocode=AP202303131584212371
黄金珠宝行业研究：关注黄金珠宝Q1兑现、业绩弹性标的,国金证券,2023-03-06,珠宝首饰,https://data.eastmoney.com/report/zw_industry.jshtml?infocode=AP202303061584062880
黄金珠宝行业研究：关注黄金珠宝Q1兑现、培育钻零售实质性落地,国金证券,2023-02-27,珠宝首饰,https://data.eastmoney.com/report/zw_industry.jshtml?infocode=AP202302271583816542
黄金珠宝行业研究：关注黄金珠宝一季报兑现、国内培育钻零售进展,国金证券,2023-02-20,珠宝首饰,https://data.eastmoney.com/report/zw_industry.jshtml?infocode=AP202302201583392342
饰品：1月培育钻毛坯进口环比+19%，中游补库持续修复,财通证券,2023-02-20,珠宝首饰,https://data.eastmoney.com/report/zw_industry.jshtml?infocode=AP202302201583380721
奢侈品行业新气象,毕马威,2023-02-17,珠宝首饰,https://data.eastmoney.com/report/zw_industry.jshtml?infocode=AP202302171583277629
黄金珠宝行业研究：节后一二线城市消费进一步修复，低线城市延续增长,国金证券,2023-02-06,珠宝首饰,https://data.eastmoney.com/report/zw_industry.jshtml?infocode=AP202302061582805746
黄金珠宝行业周报：关注1Q23培育钻反弹行情，低线城市春节珠宝销售靓丽,国金证券,2023-01-31,珠宝首饰,https://data.eastmoney.com/report/zw_industry.jshtml?infocode=AP202301311582551179
饰品行业点评报告：12月培育钻毛坯进口环比+44%，中游补库持续修复,财通证券,2023-01-27,珠宝首饰,https://data.eastmoney.com/report/zw_industry.jshtml?infocode=AP202301271582433030
黄金珠宝行业点评：12月进口环增，河南生产恢复+美国旺季需求韧性、存补库需求,国金证券,2023-01-20,珠宝首饰,https://data.eastmoney.com/report/zw_industry.jshtml?infocode=AP202301201582215828
黄金珠宝行业周报：关注金价上涨受益标的中国黄金、菜百股份,国金证券,2023-01-17,珠宝首饰,https://data.eastmoney.com/report/zw_industry.jshtml?infocode=AP202301171582066100
黄金珠宝电商数据专题分析报告：4Q22大盘增长提速，黄金、培育钻延续快增,国金证券,2023-01-16,珠宝首饰,https://data.eastmoney.com/report/zw_industry.jshtml?infocode=AP202301161582035432
黄金珠宝行业行业研究周报：看好黄金珠宝23年修复弹性、重点关注镶嵌类公司,国金证券,2023-01-09,珠宝首饰,https://data.eastmoney.com/report/zw_industry.jshtml?infocode=AP202301091581809369
黄金珠宝行业年度策略：关注珠宝疫后修复弹性，把握培育钻零售机会,国金证券,2022-12-26,珠宝首饰,https://data.eastmoney.com/report/zw_industry.jshtml?infocode=AP202212261581374665
培育钻石行业点评：印度1-11月培育钻石进/出口额同比增长39%/56%,浙商证券,2022-12-14,珠宝首饰,https://data.eastmoney.com/report/zw_industry.jshtml?infocode=AP202212141581080136
饰品行业点评报告：中游库存去化，培育钻毛坯进口环比+41%,财通证券,2022-12-14,珠宝首饰,https://data.eastmoney.com/report/zw_industry.jshtml?infocode=AP202212141581077907
黄金珠宝行业研究：本周大钻价格回升，关注黄金珠宝疫后修复,国金证券,2022-12-12,珠宝首饰,https://data.eastmoney.com/report/zw_industry.jshtml?infocode=AP202212121581013338
黄金珠宝行业周报：关注防控政策优化下黄金珠宝修复行情,国金证券,2022-12-06,珠宝首饰,https://data.eastmoney.com/report/zw_industry.jshtml?infocode=AP202212061580852783
黄金珠宝电商数据专题分析报告：10月中国培育钻线上销售延续快增,国金证券,2022-11-28,珠宝首饰,https://data.eastmoney.com/report/zw_industry.jshtml?infocode=AP202211281580614479
黄金珠宝行业周报：本周克拉HTHP及小钻价格回升,国金证券,2022-11-21,珠宝首饰,https://data.eastmoney.com/report/zw_industry.jshtml?infocode=AP202211211580439582
黄金珠宝行业研究：10月假期拖累印度毛坯进口，裸钻价格回升,国金证券,2022-11-15,珠宝首饰,https://data.eastmoney.com/report/zw_industry.jshtml?infocode=AP202211151580267098
培育钻石行业点评：印度1-10月培育钻石进/出口额同比增长44%/59%,浙商证券,2022-11-14,珠宝首饰,https://data.eastmoney.com/report/zw_industry.jshtml?infocode=AP202211141580218099
饰品行业点评报告：10月印度培育钻裸钻出口高基数下同比+22%,财通证券,2022-11-14,珠宝首饰,https://data.eastmoney.com/report/zw_industry.jshtml?infocode=AP202211141580217956
黄金珠宝行业研究：9月印度进出口改善，美国培育钻销售靓丽,国金证券,2022-10-17,珠宝首饰,https://data.eastmoney.com/report/zw_industry.jshtml?infocode=AP202210171579221976
黄金珠宝行业研究：至暗之后是黎明，珠宝零售旺季临近带来闪烁星光,国金证券,2022-10-17,珠宝首饰,https://data.eastmoney.com/report/zw_industry.jshtml?infocode=AP202210171579213305
黄金珠宝行业周报：国庆珠宝销售良好，三季报表现或分化,国金证券,2022-10-11,珠宝首饰,https://data.eastmoney.com/report/zw_industry.jshtml?infocode=AP202210111579061592
黄金珠宝行业研究：全球培育钻批发价近三周企稳，三季报或分化,国金证券,2022-10-08,珠宝首饰,https://data.eastmoney.com/report/zw_industry.jshtml?infocode=AP202210081578952508
饰品行业跟踪分析报告：8月印度培育钻石毛坯进口同比+54%,财通证券,2022-09-21,珠宝首饰,https://data.eastmoney.com/report/zw_industry.jshtml?infocode=AP202209211578560420
黄金珠宝行业研究：估值调整临近历史底，关注供应链旺季,国金证券,2022-09-13,珠宝首饰,https://data.eastmoney.com/report/zw_industry.jshtml?infocode=AP202209131578317415
黄金珠宝电商数据专题分析报告：8月大盘增速波动，培育钻延续快增,国金证券,2022-09-13,珠宝首饰,https://data.eastmoney.com/report/zw_industry.jshtml?infocode=AP202209131578309999
黄金珠宝行业研究：培育钻龙头Q2持续扩产，黄金珠宝疫情承压,国金证券,2022-09-06,珠宝首饰,https://data.eastmoney.com/report/zw_industry.jshtml?infocode=AP202209061578078428
饰品行业深度分析报告 ：培育钻五周期论——行业长期投资逻辑框架,财通证券,2022-09-05,珠宝首饰,https://data.eastmoney.com/report/zw_industry.jshtml?infocode=AP202209051578042417
黄金珠宝行业研究周报：谁在消费培育钻石？——中美差异视角,国金证券,2022-08-29,珠宝首饰,https://data.eastmoney.com/report/zw_industry.jshtml?infocode=AP202208291577773324
商贸零售行业周报：黄金珠宝7月强劲复苏，需求补释放及金价上行为主要驱动力,上海证券,2022-08-23,珠宝首饰,https://data.eastmoney.com/report/zw_industry.jshtml?infocode=AP202208231577487910
黄金珠宝行业周报：供需格局回归理性，龙头业绩高增望持续,国金证券,2022-08-22,珠宝首饰,https://data.eastmoney.com/report/zw_industry.jshtml?infocode=AP202208221577444604
黄金珠宝行业研究：7月珠宝零售额增22%，疫后率先强劲复苏,国金证券,2022-08-17,珠宝首饰,https://data.eastmoney.com/report/zw_industry.jshtml?infocode=AP202208171577297598
黄金珠宝行业研究：力量钻石、潮宏基拟合资孵化运营培育钻品牌,国金证券,2022-08-17,珠宝首饰,https://data.eastmoney.com/report/zw_industry.jshtml?infocode=AP202208171577293012
黄金珠宝行业研究周报：从美国需求释放节奏看中国培育钻未来空间,国金证券,2022-08-15,珠宝首饰,https://data.eastmoney.com/report/zw_industry.jshtml?infocode=AP202208151577221807
黄金珠宝电商数据专题分析报告：培育钻线上高增，黄金延续修复,国金证券,2022-08-11,珠宝首饰,https://data.eastmoney.com/report/zw_industry.jshtml?infocode=AP202208111577116161
黄金珠宝专题分析报告：金价上涨，珠宝品牌业绩弹性几何？,国金证券,2022-08-09,珠宝首饰,https://data.eastmoney.com/report/zw_industry.jshtml?infocode=AP202208091577040500
黄金珠宝行业深度：培育钻演绎，从上游马太效应到下游渠道价值重估,财通证券,2022-08-02,珠宝首饰,https://data.eastmoney.com/report/zw_industry.jshtml?infocode=AP202208021576805210
黄金珠宝行业研究周报：通胀不改美国培育钻高景气，传导周期保安全,国金证券,2022-08-02,珠宝首饰,https://data.eastmoney.com/report/zw_industry.jshtml?infocode=AP202208021576791312
黄金珠宝行业研究：国检海南揭牌，四方达合作海南珠宝,国金证券,2022-07-29,珠宝首饰,https://data.eastmoney.com/report/zw_industry.jshtml?infocode=AP202207291576675189
黄金珠宝行业研究：培育裸钻价短期波动影响有限，珠宝零售回暖,国金证券,2022-07-19,珠宝首饰,https://data.eastmoney.com/report/zw_industry.jshtml?infocode=AP202207191576338787
黄金珠宝行业研究：6月金银珠宝、化妆品零售额显著回暖,国金证券,2022-07-18,珠宝首饰,https://data.eastmoney.com/report/zw_industry.jshtml?infocode=AP202207181576267045
黄金珠宝行业周报：印度6月培育钻进口环比改善明显,国金证券,2022-07-18,珠宝首饰,https://data.eastmoney.com/report/zw_industry.jshtml?infocode=AP202207181576267003
黄金珠宝行业研究：培育钻设备/生产/切磨仍供不应求,国金证券,2022-07-11,珠宝首饰,https://data.eastmoney.com/report/zw_industry.jshtml?infocode=AP202207111576048299
黄金珠宝行业周报：培育钻Q2“免疫”属性强，业绩催化板块行情,国金证券,2022-07-04,珠宝首饰,https://data.eastmoney.com/report/zw_industry.jshtml?infocode=AP202207041575757392
黄金珠宝行业周报：印度5月培育钻出口继续高增、加速渗透,国金证券,2022-06-17,珠宝首饰,https://data.eastmoney.com/report/zw_industry.jshtml?infocode=AP202206171572744262
黄金珠宝行业深度报告：从产品本质到供需两侧，探索价值符号的生意经,民生证券,2022-05-25,珠宝首饰,https://data.eastmoney.com/report/zw_industry.jshtml?infocode=AP202205251567735353
黄金珠宝行业研究：假期致印4月培育钻进口波动、出口继续高增,国金证券,2022-05-18,珠宝首饰,https://data.eastmoney.com/report/zw_industry.jshtml?infocode=AP202205181566297770
黄金珠宝行业周报：局部地区五一假期需求旺盛，期待进一步恢复,国金证券,2022-05-05,珠宝首饰,https://data.eastmoney.com/report/zw_industry.jshtml?infocode=AP202205051563683431
黄金珠宝行业研究：Q1培育钻需求旺盛，板块估值调整性价比凸显,国金证券,2022-04-19,珠宝首饰,https://data.eastmoney.com/report/zw_industry.jshtml?infocode=AP202204191560203421
黄金行业2022年一季度业绩前瞻：量价齐升、蓄势待发,东亚前海证券,2022-04-14,珠宝首饰,https://data.eastmoney.com/report/zw_industry.jshtml?infocode=AP202204141559233383
黄金珠宝行业研究：对俄制裁升级，天然钻上游供应不确定性加大,国金证券,2022-03-15,珠宝首饰,https://data.eastmoney.com/report/zw_industry.jshtml?infocode=AP202203151552770530
黄金珠宝行业研究：2月天然钻涨价，国内培育钻需求快速释放,国金证券,2022-03-10,珠宝首饰,https://data.eastmoney.com/report/zw_industry.jshtml?infocode=AP202203101551757195
黄金珠宝行业研究：1-2月淘系销售同增13%，抖音持续分流,国金证券,2022-03-07,珠宝首饰,https://data.eastmoney.com/report/zw_industry.jshtml?infocode=AP202203071551099166
黄金珠宝行业系列专题报告：黄金首饰旺季复盘：高景气延续，品牌两极分化,浙商证券,2022-03-04,珠宝首饰,https://data.eastmoney.com/report/zw_industry.jshtml?infocode=AP202203041550497707
培育钻石行业跟踪：俄罗斯天然钻供应或受影响，价格维持高位,财通证券,2022-03-02,珠宝首饰,https://data.eastmoney.com/report/zw_industry.jshtml?infocode=AP202203021550097800
培育钻石行业跟踪点评：河南“982”工程，打造多个十亿级培育钻石生产项目,财通证券,2022-02-23,珠宝首饰,https://data.eastmoney.com/report/zw_industry.jshtml?infocode=AP202202231548753705
黄金珠宝行业研究：1月印度进出口靓丽、淘系钻饰同比高增,国金证券,2022-02-21,珠宝首饰,https://data.eastmoney.com/report/zw_industry.jshtml?infocode=AP202202211548283892
培育钻石行业周度数据跟踪：1月印度培育钻石毛坯进口1.53亿美元，创单月历史新高,财通证券,2022-02-21,珠宝首饰,https://data.eastmoney.com/report/zw_industry.jshtml?infocode=AP202202201548217783
2022年中国国潮消费系列研究报告：国潮珠宝大放异彩，老牌珠宝品牌与新兴品牌均迎来增长曲线,头豹研究院,2022-02-18,珠宝首饰,https://data.eastmoney.com/report/zw_industry.jshtml?infocode=AP202202181547712436
黄金珠宝行业研究：1月线上同比略降，头部品牌发力抖音,国金证券,2022-02-16,珠宝首饰,https://data.eastmoney.com/report/zw_industry.jshtml?infocode=AP202202161547331423
轻工制造：1月印度培育钻进出口数据验证行业高景气度,华安证券,2022-02-16,珠宝首饰,https://data.eastmoney.com/report/zw_industry.jshtml?infocode=AP202202161547314790
培育钻石行业数据跟踪：印度1月培育钻石裸钻出口1.22亿美元，同比+69%,财通证券,2022-02-16,珠宝首饰,https://data.eastmoney.com/report/zw_industry.jshtml?infocode=AP202202151547226157
黄金珠宝行业系列专题报告：黄金首饰消费为何在当下时点爆发？,浙商证券,2022-02-14,珠宝首饰,https://data.eastmoney.com/report/zw_industry.jshtml?infocode=AP202202141546902050
商业贸易：黄金珠宝专题：本轮黄金高景气还能走多远？,国海证券,2022-02-14,珠宝首饰,https://data.eastmoney.com/report/zw_industry.jshtml?infocode=AP202202141546901883
黄金珠宝行业研究：春节黄金销售旺盛，后续情人节望进一步助力,国金证券,2022-02-07,珠宝首饰,https://data.eastmoney.com/report/zw_industry.jshtml?infocode=AP202202071545451887
培育钻石行业深度报告：新经济成长赛道，孕育初生培育钻,东莞证券,2022-01-28,珠宝首饰,https://data.eastmoney.com/report/zw_industry.jshtml?infocode=AP202201281543164979
黄金珠宝行业周报：12月社零同降0.2%，关注春节板块行情,国金证券,2022-01-25,珠宝首饰,https://data.eastmoney.com/report/zw_industry.jshtml?infocode=AP202201251542490806
培育钻石行业周度数据跟踪：12月印度培育钻石毛坯进口额1.32亿美元，创历史新高,财通证券,2022-01-24,珠宝首饰,https://data.eastmoney.com/report/zw_industry.jshtml?infocode=AP202201231542211318
轻工制造：珠宝：从“V”字反弹、复苏企稳到再定价,华安证券,2022-01-20,珠宝首饰,https://data.eastmoney.com/report/zw_industry.jshtml?infocode=AP202201201541518464
黄金珠宝行业研究：春节黄金珠宝旺季来临，关注相关受益标的,国金证券,2022-01-17,珠宝首饰,https://data.eastmoney.com/report/zw_industry.jshtml?infocode=AP202201171540996171
黄金珠宝行业研究：培育钻石价格会下跌吗？-从供需角度出发,国金证券,2022-01-17,珠宝首饰,https://data.eastmoney.com/report/zw_industry.jshtml?infocode=AP202201171540960153
培育钻石行业周报（01）：钻石巨头埃罗莎21年收入同比+50%，国内培育钻上游龙头加码布局,财通证券,2022-01-17,珠宝首饰,https://data.eastmoney.com/report/zw_industry.jshtml?infocode=AP202201171540921940
黄金珠宝行业研究：市场风格切换，关注估值性价比品牌标的,国金证券,2022-01-11,珠宝首饰,https://data.eastmoney.com/report/zw_industry.jshtml?infocode=AP202201111539791700
珠宝行业跟踪点评：审美觉醒，龙头变革,浙商证券,2022-01-05,珠宝首饰,https://data.eastmoney.com/report/zw_industry.jshtml?infocode=AP202201051538606983
黄金珠宝行业研究：从天然钻石长短周期看培育钻石,国金证券,2022-01-04,珠宝首饰,https://data.eastmoney.com/report/zw_industry.jshtml?infocode=AP202201041538443196
2021年中国人造金刚石短报告,头豹研究院,2021-12-28,珠宝首饰,https://data.eastmoney.com/report/zw_industry.jshtml?infocode=AP202112281537127605
轻工制造行业周报：珠宝：明星杠杆与短视频费效比或面临重估,华安证券,2021-12-20,珠宝首饰,https://data.eastmoney.com/report/zw_industry.jshtml?infocode=AP202112201535658301
商业贸易行业深度研究：黄金珠宝深度：千秋之业，品牌渠道为王,国海证券,2021-12-14,珠宝首饰,https://data.eastmoney.com/report/zw_industry.jshtml?infocode=AP202112141534504112
商业贸易行业跟踪周报2021年第44期：力量钻石披露2021年业绩预告，归母净利润2.32-2.45亿元，同比实现高增，行业高景气度有望持续,东吴证券,2021-12-12,珠宝首饰,https://data.eastmoney.com/report/zw_industry.jshtml?infocode=AP202112121534178388
培育钻石行业深度分析：契机已至，向新而动,华金证券,2021-11-30,珠宝首饰,https://data.eastmoney.com/report/zw_industry.jshtml?infocode=AP202111301532026065
培育钻石行业系列报告之调研篇：再论“克拉自由”，培育钻石行业四问四答之调研篇,民生证券,2021-11-29,珠宝首饰,https://data.eastmoney.com/report/zw_industry.jshtml?infocode=AP202111291531828954
培育钻石跟踪：印度进出口高增，下游进场加速,国金证券,2021-11-26,珠宝首饰,https://data.eastmoney.com/report/zw_industry.jshtml?infocode=AP202111261531202403
培育钻石：供需共振，按下“快进键”的闪亮风口,中航证券,2021-10-30,珠宝首饰,https://data.eastmoney.com/report/zw_industry.jshtml?infocode=AP202110301525942617
