研报名称,机构名称,发布时间,行业,研报地址
可降解材料行业深度报告：政策、技术、产业齐发展，可降解材料替代大势所趋,山西证券,2023-04-19,塑料制品,https://data.eastmoney.com/report/zw_industry.jshtml?infocode=AP202304191585570324
合成生物学周报：2022年国内50多家合成生物公司完成融资，生物制法异丁醇走向工业化,华安证券,2023-04-16,塑料制品,https://data.eastmoney.com/report/zw_industry.jshtml?infocode=AP202304161585486966
2022年中国PGA塑料行业概览：“限塑令”催生新材料市场发展机遇,头豹研究院,2023-02-09,塑料制品,https://data.eastmoney.com/report/zw_industry.jshtml?infocode=AP202302091582957788
食品饮料行业周报：短期低预期，白酒进入去库存阶段,东海证券,2022-10-19,塑料制品,https://data.eastmoney.com/report/zw_industry.jshtml?infocode=AP202210191579268265
基础化工行业周报：国家邮政局：快递将禁用不可降解塑料,山西证券,2022-10-17,塑料制品,https://data.eastmoney.com/report/zw_industry.jshtml?infocode=AP202210171579226079
合成生物学周报：欧盟、印度推动生物经济发展，凯赛生物首次实现生物法癸二酸量产,华安证券,2022-10-16,塑料制品,https://data.eastmoney.com/report/zw_industry.jshtml?infocode=AP202210161579193848
塑料事件点评：改性塑料成本端压力缓解，行业盈利有望修复,国海证券,2022-08-07,塑料制品,https://data.eastmoney.com/report/zw_industry.jshtml?infocode=AP202208071576966314
基础化工行业深度报告：从生物柴油看再生塑料的投资机会,东方证券,2022-04-01,塑料制品,https://data.eastmoney.com/report/zw_industry.jshtml?infocode=AP202204011556525737
