研报名称,机构名称,发布时间,行业,研报地址
证券行业周报：成交额进一步萎缩至8000亿元上方,东莞证券,2023-05-29,证券,https://data.eastmoney.com/report/zw_industry.jshtml?infocode=AP202305291587328832
非银金融行业日报：三大指数走势分化 上市券商积极分红,大同证券,2023-05-29,证券,https://data.eastmoney.com/report/zw_industry.jshtml?infocode=AP202305291587328812
非银金融周报：市场预期回落，非银迎来较好配置机会,国联证券,2023-05-28,证券,https://data.eastmoney.com/report/zw_industry.jshtml?infocode=AP202305281587323382
非银金融行业周报：买券商的ROE提升和保险的基本面,信达证券,2023-05-28,证券,https://data.eastmoney.com/report/zw_industry.jshtml?infocode=AP202305281587323105
非银金融行业日报：沪指险守3200点，证监会就期货衍生品业务未来发展方向发声,大同证券,2023-05-26,证券,https://data.eastmoney.com/report/zw_industry.jshtml?infocode=AP202305261587189840
