研报名称,机构名称,发布时间,行业,研报地址
旅游及景区行业投资策略周报：海南国际航班开始修复；中免天府机场店开业-本周海南客流环比上升0.96%,财通证券,2023-05-25,旅游酒店,https://data.eastmoney.com/report/zw_industry.jshtml?infocode=AP202305251587158413
消费者服务行业周报：亚朵集团23Q1营收7.74亿元，调整后净利润达1.6亿元,山西证券,2023-05-23,旅游酒店,https://data.eastmoney.com/report/zw_industry.jshtml?infocode=AP202305231587067902
社会服务行业周观点：节假日释放出行需求，旅游经济全面恢复,万联证券,2023-05-23,旅游酒店,https://data.eastmoney.com/report/zw_industry.jshtml?infocode=AP202305231587067515
社服周观点：亚朵酒店23Q1调整后净利润1.6亿元，北京人力登陆资本市场谱写新篇章,民生证券,2023-05-22,旅游酒店,https://data.eastmoney.com/report/zw_industry.jshtml?infocode=AP202305221587047377
社会服务行业双周报（第57期）：海外酒旅龙头财报纷纷报喜，北京外企重组顺利落地,国信证券,2023-05-22,旅游酒店,https://data.eastmoney.com/report/zw_industry.jshtml?infocode=AP202305221587042965
