研报名称,机构名称,发布时间,行业,研报地址
社服行业2023年中期投资策略：关注旺季高景气度以及人服板块的配置价值,民生证券,2023-06-29,旅游酒店,https://data.eastmoney.com/report/zw_industry.jshtml?infocode=AP202306291591845305
社会服务双周专题：极端高温天气频发，避暑旅游市场欣欣向荣,信达证券,2023-06-28,旅游酒店,https://data.eastmoney.com/report/zw_industry.jshtml?infocode=AP202306281591795604
社会服务社会服务：自然景区持续强势复苏，暑期旺季序幕即将开启,国信证券,2023-06-28,旅游酒店,https://data.eastmoney.com/report/zw_industry.jshtml?infocode=AP202306281591794510
社会服务行业2023年中期投资策略：渐进复苏 业绩确定为体 政策受益为用,国信证券,2023-06-28,旅游酒店,https://data.eastmoney.com/report/zw_industry.jshtml?infocode=AP202306281591775722
社会服务行业跟踪报告：端午旅游消费潜力持续释放，民俗活动激发市场活力,万联证券,2023-06-27,旅游酒店,https://data.eastmoney.com/report/zw_industry.jshtml?infocode=AP202306271591732820
社会服务行业投资策略报告：花开四时，各有不同,万联证券,2023-06-27,旅游酒店,https://data.eastmoney.com/report/zw_industry.jshtml?infocode=AP202306271591732296
社会服务行业深度报告：聚焦景气提升的细分小行业龙头，关注顺周期赛道龙头的估值修复机会,中国银河,2023-06-27,旅游酒店,https://data.eastmoney.com/report/zw_industry.jshtml?infocode=AP202306271591717450
社会服务行业周报：端午节出行客流量恢复靓丽，期间旅游收入仍在恢复中,浙商证券,2023-06-27,旅游酒店,https://data.eastmoney.com/report/zw_industry.jshtml?infocode=AP202306271591706607
休闲服务行业专题研究：日本消费研究：物质从简，精神至上,国联证券,2023-06-27,旅游酒店,https://data.eastmoney.com/report/zw_industry.jshtml?infocode=AP202306261591605673
社会服务行业专题研究：彩票行业：体彩销售强劲，领跑消费复苏,国联证券,2023-06-27,旅游酒店,https://data.eastmoney.com/report/zw_industry.jshtml?infocode=AP202306261591600876
社服零售行业周报：端午出行消费恢复向好，暑期旺季表现可期,华西证券,2023-06-26,旅游酒店,https://data.eastmoney.com/report/zw_industry.jshtml?infocode=AP202306261591327368
社会服务行业研究：端午旅游人次超19年，餐饮修复较好，期待暑期旺季到来,国金证券,2023-06-26,旅游酒店,https://data.eastmoney.com/report/zw_industry.jshtml?infocode=AP202306261591288912
社会服务行业周报：端午出行“量优于价”，文旅融合项目获热捧,开源证券,2023-06-26,旅游酒店,https://data.eastmoney.com/report/zw_industry.jshtml?infocode=AP202306261591286060
社会服务行业投资策略周报：旅游出行消费市场螺旋式修复，总体景气度延续,财通证券,2023-06-26,旅游酒店,https://data.eastmoney.com/report/zw_industry.jshtml?infocode=AP202306261591285602
消费服务行业周报：端午出游热度延续，暑期旺季亲子游可期,东莞证券,2023-06-26,旅游酒店,https://data.eastmoney.com/report/zw_industry.jshtml?infocode=AP202306261591285089
社服行业周报：出行景气度向上，把握旺季业绩兑现,上海证券,2023-06-25,旅游酒店,https://data.eastmoney.com/report/zw_industry.jshtml?infocode=AP202306251591276365
社会服务行业周报：出行景气度上行确定，板块或迎反弹,浙商证券,2023-06-24,旅游酒店,https://data.eastmoney.com/report/zw_industry.jshtml?infocode=AP202306241591274677
社会服务行业月报：5月餐饮增速趋于平稳，关注旺季业绩兑现,东吴证券,2023-06-24,旅游酒店,https://data.eastmoney.com/report/zw_industry.jshtml?infocode=AP202306221591230932
酒店行业双周报：经济型酒店和头部酒店集团RevPAR先降后升,东吴证券,2023-06-21,旅游酒店,https://data.eastmoney.com/report/zw_industry.jshtml?infocode=AP202306211591195020
把脉“618”消费趋势，挖掘投资机遇,中航证券,2023-06-21,旅游酒店,https://data.eastmoney.com/report/zw_industry.jshtml?infocode=AP202306211591151520
社会服务行业2023中期策略：高景气度、结构调整及政策变化,浙商证券,2023-06-21,旅游酒店,https://data.eastmoney.com/report/zw_industry.jshtml?infocode=AP202306211591145636
休闲、生活及专业服务行业动态点评：香港举办国际旅游展，推动旅游市场全面复苏,东方财富证券,2023-06-20,旅游酒店,https://data.eastmoney.com/report/zw_industry.jshtml?infocode=AP202306201591082451
消费者服务行业周报：端午节长线游热度走高,山西证券,2023-06-20,旅游酒店,https://data.eastmoney.com/report/zw_industry.jshtml?infocode=AP202306201591082211
社服周观点：AI教育及职业教育板块政策持续催化，商务部推出支持恢复和扩大消费系列措施,民生证券,2023-06-19,旅游酒店,https://data.eastmoney.com/report/zw_industry.jshtml?infocode=AP202306191591062073
社会服务行业双周报（第59期）：产教融合再获政策助力，航空暑运预期恢复至疫前,国信证券,2023-06-19,旅游酒店,https://data.eastmoney.com/report/zw_industry.jshtml?infocode=AP202306191591061181
社会服务行业周报：消费复苏预期转好，关注酒旅投资机会,华福证券,2023-06-19,旅游酒店,https://data.eastmoney.com/report/zw_industry.jshtml?infocode=AP202306191591061152
消费者服务行业周报：暑期旺季已至，关注出行需求释放提速,东莞证券,2023-06-19,旅游酒店,https://data.eastmoney.com/report/zw_industry.jshtml?infocode=AP202306191591058861
社服与消费视角点评5月国内宏观数据：假期效应带动服务消费，目前仍处复苏区间,中银证券,2023-06-19,旅游酒店,https://data.eastmoney.com/report/zw_industry.jshtml?infocode=AP202306181591055860
社会服务行业周报：社零数据延续同比复苏，端午暑期旅游热度升温,中银证券,2023-06-18,旅游酒店,https://data.eastmoney.com/report/zw_industry.jshtml?infocode=AP202306181591056435
社会服务行业·周观点：端午暑期长线游成主流，酒店餐饮业绩弹性可期,中航证券,2023-06-18,旅游酒店,https://data.eastmoney.com/report/zw_industry.jshtml?infocode=AP202306181591055243
社服行业周报：携程强势复苏，暑期出行热度延续,国联证券,2023-06-18,旅游酒店,https://data.eastmoney.com/report/zw_industry.jshtml?infocode=AP202306171591054660
社会服务双周刊：“口红经济”下彩票行业快速增长，年轻化为长期发展基础,信达证券,2023-06-18,旅游酒店,https://data.eastmoney.com/report/zw_industry.jshtml?infocode=AP202306161591042357
社会服务行业周报：端午假期机票价格较五一低，长线出游性价比更高,南京证券,2023-06-16,旅游酒店,https://data.eastmoney.com/report/zw_industry.jshtml?infocode=AP202306161591019800
社服行业2023年中期策略报告：关注暑期消费及政策变化，积极寻找困境反转,平安证券,2023-06-16,旅游酒店,https://data.eastmoney.com/report/zw_industry.jshtml?infocode=AP202306161591016078
社会服务行业简评报告：社服，携程23Q1业绩超出疫前，旺季临近出行链迎全面复苏,首创证券,2023-06-14,旅游酒店,https://data.eastmoney.com/report/zw_industry.jshtml?infocode=AP202306141590936174
数读酒店市场供需现状,安信证券,2023-06-13,旅游酒店,https://data.eastmoney.com/report/zw_industry.jshtml?infocode=AP202306131590915896
消费者服务行业周报：携程Q1主营业务强劲复苏，本地游酒店预订量较疫前增长150%,山西证券,2023-06-13,旅游酒店,https://data.eastmoney.com/report/zw_industry.jshtml?infocode=AP202306131590895805
酒店行业周度数据跟踪：RevPAR阶段性波动，金陵打造南京老东门项目,财通证券,2023-06-13,旅游酒店,https://data.eastmoney.com/report/zw_industry.jshtml?infocode=AP202306131590893358
社会服务行业周观点：端午假期延续旅游旺势，夏季“北上避暑”成风潮,万联证券,2023-06-12,旅游酒店,https://data.eastmoney.com/report/zw_industry.jshtml?infocode=AP202306121590867703
社服周观点：端午假期旅游热度高涨，达势股份新店销售额创新高,民生证券,2023-06-12,旅游酒店,https://data.eastmoney.com/report/zw_industry.jshtml?infocode=AP202306121590867691
社会服务行业月报：前五月主要景区客流复苏强劲，端午暑期出行热度有望延续,中国银河,2023-06-12,旅游酒店,https://data.eastmoney.com/report/zw_industry.jshtml?infocode=AP202306121590852420
社会服务行业周报：“文化强国”推动文旅融合，直播+文旅开辟行业新航道,开源证券,2023-06-12,旅游酒店,https://data.eastmoney.com/report/zw_industry.jshtml?infocode=AP202306121590852366
社会服务行业投资策略周报：人社部专项行动助就业，消费需求有望改善,财通证券,2023-06-12,旅游酒店,https://data.eastmoney.com/report/zw_industry.jshtml?infocode=AP202306121590851831
社会服务行业·周观点：旅游市场持续升温，“端午+暑期”景气度可期,中航证券,2023-06-12,旅游酒店,https://data.eastmoney.com/report/zw_industry.jshtml?infocode=AP202306121590850963
免税行业周报（6月第2周）：前5月海南以免税品方式进口112.9亿元，同比+15%,浙商证券,2023-06-12,旅游酒店,https://data.eastmoney.com/report/zw_industry.jshtml?infocode=AP202306121590850101
社服行业周报：咖啡赛道竞争提速首迎万店品牌，旅游需求强劲释放关注夏季出行市场,上海证券,2023-06-12,旅游酒店,https://data.eastmoney.com/report/zw_industry.jshtml?infocode=AP202306121590850055
消费服务行业周报：旺季临近，预期先行,东莞证券,2023-06-12,旅游酒店,https://data.eastmoney.com/report/zw_industry.jshtml?infocode=AP202306121590849954
消费者服务行业2023年下半年投资策略：暑期旺季临近提振复苏预期，静待业绩验证,东莞证券,2023-06-09,旅游酒店,https://data.eastmoney.com/report/zw_industry.jshtml?infocode=AP202306091590665919
社会服务行业周报：峨眉山客流强势复苏，米奥会展成交量喜人,南京证券,2023-06-09,旅游酒店,https://data.eastmoney.com/report/zw_industry.jshtml?infocode=AP202306091590662165
社会服务行业简评报告：“520”酒店预订量恢复至疫前，年轻群体消费力提升,首创证券,2023-06-07,旅游酒店,https://data.eastmoney.com/report/zw_industry.jshtml?infocode=AP202306071590508604
社会服务行业周报：暑期出行订单量已超过2019年同期,南京证券,2023-06-07,旅游酒店,https://data.eastmoney.com/report/zw_industry.jshtml?infocode=AP202306071590508583
社服：同程旅行23Q1业绩加速恢复，深耕下沉市场全年增长动力强劲,首创证券,2023-06-07,旅游酒店,https://data.eastmoney.com/report/zw_industry.jshtml?infocode=AP202306071590508219
海外休闲、生活及专业服务行业专题研究：在线旅游疫后复苏，新生活力撬动竞争格局,东方财富证券,2023-06-06,旅游酒店,https://data.eastmoney.com/report/zw_industry.jshtml?infocode=AP202306061590459839
酒店行业周度数据跟踪：商旅城市需求相对韧性，23Q1华住业绩超预期,财通证券,2023-06-06,旅游酒店,https://data.eastmoney.com/report/zw_industry.jshtml?infocode=AP202306061590438235
酒店行业双周报：奢华和中高端酒店RevPAR韧性较强,东吴证券,2023-06-06,旅游酒店,https://data.eastmoney.com/report/zw_industry.jshtml?infocode=AP202306051590431855
社会服务业：暑期旺季行情有望提前演绎，关注景区及澳门博彩板块,中国银河,2023-06-05,旅游酒店,https://data.eastmoney.com/report/zw_industry.jshtml?infocode=AP202306051590413062
社服周观点：前五月全国多地景区旅客人次超19年同期，峨眉山、九华山表现亮眼,民生证券,2023-06-05,旅游酒店,https://data.eastmoney.com/report/zw_industry.jshtml?infocode=AP202306051590412675
社服零售行业周报：618首轮战报出炉，部分可选消费表现亮眼,华西证券,2023-06-05,旅游酒店,https://data.eastmoney.com/report/zw_industry.jshtml?infocode=AP202306051590408825
社会服务行业周报：解压和种草经济带火寺庙游，餐饮消费趋于理性,中银证券,2023-06-05,旅游酒店,https://data.eastmoney.com/report/zw_industry.jshtml?infocode=AP202306051590406723
社会服务行业投资策略周报：六月小长假支撑出行，用工回升关注消费机会,财通证券,2023-06-05,旅游酒店,https://data.eastmoney.com/report/zw_industry.jshtml?infocode=AP202306051590403643
消费服务行业周报：关注旺季临近带来预期变化机会,东莞证券,2023-06-05,旅游酒店,https://data.eastmoney.com/report/zw_industry.jshtml?infocode=AP202306051590403629
社会服务行业·周观点：“618”迎开门红，四大投资机会值得关注,中航证券,2023-06-05,旅游酒店,https://data.eastmoney.com/report/zw_industry.jshtml?infocode=AP202306051590403340
社服行业周报：科学教育获政策利好，关注AI等先进科技赋能基础教育,上海证券,2023-06-05,旅游酒店,https://data.eastmoney.com/report/zw_industry.jshtml?infocode=AP202306051590402898
社会服务行业双周报（第58期）：“AI+教育”再获政策肯定，峨眉山客流强势复苏,国信证券,2023-06-05,旅游酒店,https://data.eastmoney.com/report/zw_industry.jshtml?infocode=AP202306051590402874
社服行业周报：华住业绩超预期，中免调整会员权益,国联证券,2023-06-04,旅游酒店,https://data.eastmoney.com/report/zw_industry.jshtml?infocode=AP202306031590397130
旅游及景区行业投资策略周报：本周海南客流环比下降6.11%，海南客流维持高景气：大兴机场国际客流创新高,财通证券,2023-06-02,旅游酒店,https://data.eastmoney.com/report/zw_industry.jshtml?infocode=AP202306021588081323
景区行业专题：暑期旺季可期，国企改革加速,国信证券,2023-06-01,旅游酒店,https://data.eastmoney.com/report/zw_industry.jshtml?infocode=AP202306011587449216
社会服务：AI模型代工为NPC注入“灵魂”，游戏智能化加速,中航证券,2023-05-31,旅游酒店,https://data.eastmoney.com/report/zw_industry.jshtml?infocode=AP202305311587381365
消费者服务行业周报：同程旅行Q1收入增长超过50%，月活和月付费用户数均创新高,山西证券,2023-05-30,旅游酒店,https://data.eastmoney.com/report/zw_industry.jshtml?infocode=AP202305301587365009
社服周观点：景区旅游板块国企积极推进改革，古茗与美团合作启动万店加速,民生证券,2023-05-30,旅游酒店,https://data.eastmoney.com/report/zw_industry.jshtml?infocode=AP202305301587347539
社会服务：Q1收入超预期，利润端大幅修复,平安证券,2023-05-30,旅游酒店,https://data.eastmoney.com/report/zw_industry.jshtml?infocode=AP202305301587347276
社会服务行业周观点：暑期旅游市场预定火热，大众旅游成增长主动力,万联证券,2023-05-29,旅游酒店,https://data.eastmoney.com/report/zw_industry.jshtml?infocode=AP202305291587339765
社会服务行业周报：咖啡产业规模突破2000亿，618预售美妆表现亮眼,开源证券,2023-05-29,旅游酒店,https://data.eastmoney.com/report/zw_industry.jshtml?infocode=AP202305291587330202
消费服务行业周报：关注下半年旺季旅游需求释放,东莞证券,2023-05-29,旅游酒店,https://data.eastmoney.com/report/zw_industry.jshtml?infocode=AP202305291587328829
社会服务行业投资策略周报：618大促开启，关注国货美护品牌崛起,财通证券,2023-05-29,旅游酒店,https://data.eastmoney.com/report/zw_industry.jshtml?infocode=AP202305291587328556
社会服务行业周报：暑期出行热度渐起，大众旅游市场活跃,中银证券,2023-05-29,旅游酒店,https://data.eastmoney.com/report/zw_industry.jshtml?infocode=AP202305291587327792
免税行业周报（5月第4周）：白云机场免税业务恢复至19年的4成左右、T1出境免税协议重签在即,浙商证券,2023-05-29,旅游酒店,https://data.eastmoney.com/report/zw_industry.jshtml?infocode=AP202305291587325759
社会服务双周刊：出行渐进复苏，短期向下实为蓄力向上,信达证券,2023-05-29,旅游酒店,https://data.eastmoney.com/report/zw_industry.jshtml?infocode=AP202305281587324071
社服行业周报：把握出行复苏机遇下的业绩兑现,上海证券,2023-05-28,旅游酒店,https://data.eastmoney.com/report/zw_industry.jshtml?infocode=AP202305281587324028
消费者服务行业月报：消费复苏稳步进行，出行表现亮眼,中原证券,2023-05-26,旅游酒店,https://data.eastmoney.com/report/zw_industry.jshtml?infocode=AP202305261587206151
旅游及景区行业投资策略周报：海南国际航班开始修复；中免天府机场店开业-本周海南客流环比上升0.96%,财通证券,2023-05-25,旅游酒店,https://data.eastmoney.com/report/zw_industry.jshtml?infocode=AP202305251587158413
消费者服务行业周报：亚朵集团23Q1营收7.74亿元，调整后净利润达1.6亿元,山西证券,2023-05-23,旅游酒店,https://data.eastmoney.com/report/zw_industry.jshtml?infocode=AP202305231587067902
社会服务行业周观点：节假日释放出行需求，旅游经济全面恢复,万联证券,2023-05-23,旅游酒店,https://data.eastmoney.com/report/zw_industry.jshtml?infocode=AP202305231587067515
社服周观点：亚朵酒店23Q1调整后净利润1.6亿元，北京人力登陆资本市场谱写新篇章,民生证券,2023-05-22,旅游酒店,https://data.eastmoney.com/report/zw_industry.jshtml?infocode=AP202305221587047377
社会服务行业双周报（第57期）：海外酒旅龙头财报纷纷报喜，北京外企重组顺利落地,国信证券,2023-05-22,旅游酒店,https://data.eastmoney.com/report/zw_industry.jshtml?infocode=AP202305221587042965
社服零售行业周报：4月社零低基数下实现高增长，黄金珠宝增速领跑可选消费,华西证券,2023-05-22,旅游酒店,https://data.eastmoney.com/report/zw_industry.jshtml?infocode=AP202305221587039621
社服行业周报：餐饮市场强势复苏，暑期出行有望延续“五一”高热度,上海证券,2023-05-22,旅游酒店,https://data.eastmoney.com/report/zw_industry.jshtml?infocode=AP202305221587039533
社会服务行业投资策略周报：618活动将至，关注“百亿补贴”提振消费需求,财通证券,2023-05-22,旅游酒店,https://data.eastmoney.com/report/zw_industry.jshtml?infocode=AP202305221587039523
社服教育周报：可选消费等待持续性修复，重点观察618电商消费,平安证券,2023-05-22,旅游酒店,https://data.eastmoney.com/report/zw_industry.jshtml?infocode=AP202305221587038329
免税行业周报（5月第3周）：4月海南岛内免税店日均销售额1.3亿元，同比增长2.7倍,浙商证券,2023-05-22,旅游酒店,https://data.eastmoney.com/report/zw_industry.jshtml?infocode=AP202305221587037514
社会服务：新消费研究之怪兽充电：共享充电龙头，修复可期,平安证券,2023-05-22,旅游酒店,https://data.eastmoney.com/report/zw_industry.jshtml?infocode=AP202305221587037474
酒店行业双周报：中高端和头部酒店集团RevPAR韧性较强,东吴证券,2023-05-22,旅游酒店,https://data.eastmoney.com/report/zw_industry.jshtml?infocode=AP202305211587036077
中航社服行业周报：“一带一路”主题催化，利好CIPS和跨境电商,中航证券,2023-05-22,旅游酒店,https://data.eastmoney.com/report/zw_industry.jshtml?infocode=AP202305211587036056
社会服务行业周报：社零数据彰显消费延续弱复苏，出入境团队游进一步开放,中银证券,2023-05-21,旅游酒店,https://data.eastmoney.com/report/zw_industry.jshtml?infocode=AP202305211587036516
消费服务行业周报：出境游供给修复，携程暑期订单量已超2019年同期,东莞证券,2023-05-21,旅游酒店,https://data.eastmoney.com/report/zw_industry.jshtml?infocode=AP202305211587035743
社服行业周报：23Q1亚朵RevPAR恢复至疫情前118.3%,国联证券,2023-05-21,旅游酒店,https://data.eastmoney.com/report/zw_industry.jshtml?infocode=AP202305201587032245
社服行业22年报&23Q1业绩总结：厚积薄发，复苏开启,德邦证券,2023-05-18,旅游酒店,https://data.eastmoney.com/report/zw_industry.jshtml?infocode=AP202305181586736524
2023年社会服务行业中期策略：韶华不负春光美 聚焦景气新周期,太平洋,2023-05-17,旅游酒店,https://data.eastmoney.com/report/zw_industry.jshtml?infocode=AP202305171586715065
社会服务行业月报：4月及五一餐饮复苏趋势验证，看好龙头,东吴证券,2023-05-17,旅游酒店,https://data.eastmoney.com/report/zw_industry.jshtml?infocode=AP202305171586714518
社服零售行业2023年中期投资策略：服务类消费恢复弹性大，聚焦细分行业小龙头,华西证券,2023-05-17,旅游酒店,https://data.eastmoney.com/report/zw_industry.jshtml?infocode=AP202305171586710754
