研报名称,机构名称,发布时间,行业,研报地址
煤炭行业周报：快速出清利于新的多头逻辑形成,山西证券,2023-05-28,煤炭行业,https://data.eastmoney.com/report/zw_industry.jshtml?infocode=AP202305281587323971
煤炭周报：进口冲击使港口煤价短期回落，供给收缩保长期中枢稳定,民生证券,2023-05-28,煤炭行业,https://data.eastmoney.com/report/zw_industry.jshtml?infocode=AP202305281587323953
煤炭开采行业跟踪周报：需求维持弱势，煤价承压震荡,东吴证券,2023-05-28,煤炭行业,https://data.eastmoney.com/report/zw_industry.jshtml?infocode=AP202305281587322928
中国煤炭行业：澳煤恢复进口短期内对炼焦煤市场供需格局影响有限,中诚信国际,2023-05-26,煤炭行业,https://data.eastmoney.com/report/zw_industry.jshtml?infocode=AP202305261587188494
煤炭进口数据拆解：价格倒挂抑制进口增量，4月进口量环比负增长,山西证券,2023-05-24,煤炭行业,https://data.eastmoney.com/report/zw_industry.jshtml?infocode=AP202305241587132821
