研报名称,机构名称,发布时间,行业,研报地址
煤炭行业7月投资策略（7月第2周）：高日耗高库存，电厂采购支撑煤价高位,国信证券,2023-07-10,煤炭行业,https://data.eastmoney.com/report/zw_industry.jshtml?infocode=AP202307101592129801
煤炭行业周报：煤价旺季强势，持续看好板块反弹,德邦证券,2023-07-10,煤炭行业,https://data.eastmoney.com/report/zw_industry.jshtml?infocode=AP202307101592123037
煤炭开采行业周报：港口&产地价格继续上涨，煤企高质量资产值得重视,国海证券,2023-07-10,煤炭行业,https://data.eastmoney.com/report/zw_industry.jshtml?infocode=AP202307091592122670
煤炭开采行业周报：电厂日耗高位&非电需求抬升，有望支撑煤价趋稳走强,信达证券,2023-07-10,煤炭行业,https://data.eastmoney.com/report/zw_industry.jshtml?infocode=AP202307091592122098
煤炭行业周报：7月动力煤长协价再小幅下调，现货价季节性走强,安信证券,2023-07-09,煤炭行业,https://data.eastmoney.com/report/zw_industry.jshtml?infocode=AP202307091592121705
煤炭行业周报：高温天气来袭，煤价支撑较强,中泰证券,2023-07-09,煤炭行业,https://data.eastmoney.com/report/zw_industry.jshtml?infocode=AP202307091592121677
煤炭开采行业周报：煤价延续上涨&厄尔尼诺高温，煤炭股可顺势布局,开源证券,2023-07-09,煤炭行业,https://data.eastmoney.com/report/zw_industry.jshtml?infocode=AP202307091592121659
煤炭行业周报：全面高温影响下电煤日耗创年内高位,山西证券,2023-07-09,煤炭行业,https://data.eastmoney.com/report/zw_industry.jshtml?infocode=AP202307091592121194
煤炭周报：发运倒挂，加速港口及终端去库，板块配置价值凸显,民生证券,2023-07-09,煤炭行业,https://data.eastmoney.com/report/zw_industry.jshtml?infocode=AP202307091592121146
煤炭债季度复盘：二季度长期限发行明显增加，煤价下跌对估值影响有限,山西证券,2023-07-07,煤炭行业,https://data.eastmoney.com/report/zw_industry.jshtml?infocode=AP202307071592088438
